"Discussion in seminar setting on specific issues related to Religion and Society. Students are allowed to take these courses for more than once, and gain the units each time they pass the course."
"Discussion in seminar setting on specific issues related to Religion and Society. Students are allowed to take these courses for more than once, and gain the units each time they pass the course."
"This seminar examines Islam as a religion and civilization characterized by dynamics of borrowing, conflict, and interaction between and within traditions that are identified as “Islamic”. We will begin by studying some representative works of both primary and secondary source. Specific themes and topics will then be chosen in accordance with students’ interest for in-depth examination. The specific content will be designed by the teacher who offers the course."
"In this course, a student is required to meet with his/her supervisor regularly who provides necessary guidance and supervision to write up a thesis and monitors the student’s academic progress."
"In this course, a student is required to meet with his/her supervisor regularly who provides necessary guidance and supervision to write up a thesis and monitors the student’s academic progress."
"In this course, a student is required to meet with his/her supervisor regularly who provides necessary guidance and supervision to write up a thesis and monitors the student’s academic progress."
