"This course will be built around readings concerning methodology and history of the discipline of the “History of Religions”. Study of selected figures and methodological approaches to religions, including phenomenological, psychological, structural, hermeneutical and sociological methods, will also be covered. The purpose of this course is to acquaint students with a sophisticated knowledge of the theories and methods in research on different forms of religious manifestations."
"From the establishment of the sociological endeavor, the study of religion has been central to the understanding of modern societies. This course will continue in this tradition by surveying the interactions between religion and society while developing the sociological and Anthropological approach to the study of religion as a social institution. In particular, we will look at the ways in which religion is transformed by, and plays a role in the transformation of, a global society. This course is designed to give students tools and concepts with which to understand the social organization of religion and the role of religion in society. We will focus on classical and emerging themes in the field, and analyze case studies that relate to them. Students will: -learn how religion is shaped by and, in turn, shapes the larger social field in which it exists;-become familiar with the dynamics of secularization, ecological theories, and other developments;-develop an understanding of the ways in which religion interacts with other social institutions such as the state and economy, and culture."
"This course centres on the study of the literature of the Han Dynasty which is formative of the chief religious concepts such as cosmology, anthropology and soteriology, with the aim of understanding of the principles of religious theory construction in traditional China."
"This course studies major traditions in Chinese Buddhism including Chan, Pure Land, Huayen and Tiantai Buddhism. We also seek to understand the Chinese Buddhist tradition by utilizing some recent researches in the field. Some examples are the research on northern school of Chan Buddhism by John McRae and Bernard Faure, on Pure Land Buddhism by Luis Gomez and Richard Payne, on Buddhism in the Song especially Tiantai Buddhism by Peter Gregory and Daniel Getz. Secondary sources will be used together with selected primary sources to stimulate discussion in class."
"Recent researches on Chinese religion show that the term “three religions” or sanjiao monastic Buddhism, priestly Daoism, and Confucian philosophy - is not adequate to describe Chinese religiosity. To subsume several thousand years of Chinese religious experience under the term of “three religions”, in effect, is to exclude the vast majority of Chinese religious behaviour. In reality, only a few elite orient their lifestyles to the Buddhist or Taoist concepts of transcendence. Over emphasis on the intellectual and spiritual world of the scholarly official, the gentry and the literate elite, overlooks religious practices and beliefs of ordinary people, the peasants and the labourers who are the majority of the Chinese population. This course studies Chinese religion from the , traditional economy and village temples of various local societies in China.perspective of local society in South China. By making use of recent ethnographical studies on China, we examine Chinese religion from a holistic approach involving the analysis of lineage"
"This course introduces the system of religious thought of Taoism in China. Topics that include Taoist ideas such as the Tao, Taoist gods, Taoist cosmology, human life and nature, canon, life after death, ritual and self-cultivation, and moral values will be examined."
"This course studies the early and medieval histories of religious Taoism during the period from the Six Dynasties until Tang Dynasty. The important historical development of the sects of the Way of Celestial Master, the Lingbao and the Shangqiing will be covered."
"This course will survey the developments of religious Taoism in late imperial China. The course will focus on the rise and spread of such new Taoist movements as the Quanzhen (Complete Perfection) school and Jingming (Pure Illumination) school, as well as the continuing penetration of the Zhengyi (Orthodox Unity) school into the national politics and local society."
"This course aims at a general study of Taoism in Chinese cultural context. The focus is on Taoist elements and values in Chinese art, music, drama, and literature. This will allow students not only to study Taoism as one of Chinese religious traditions, but also to understand the intersections of Taoism and various aspects of Chinese culture. No prior knowledge of Taoism is assumed."
The course will focus on the recent development in biblical interpretation in Asia in the larger context of theological endeavours and religious studies of Asian scholars in their coming to terms with the diversity of Asian realities. Adequate attention will be paid to methodological issues in relation to the pluralistic religio-cultural traditions and the complex socio-political experiences of the Asian peoples. Biblical interpretation developed in various Asian countries will also be studied.
This course will focus on exegesis of selected passages from the Hebrew Bible or the New Testament. It would be an advantage if students have gone through either Hebrew Exegesis or New Testament Greek Exegesis.
This course will focus on exegesis of selected passages from the Hebrew Bible or the New Testament. It would be an advantage if students have gone through either Hebrew Exegesis or New Testament Greek Exegesis.
"The course introduces the approaches to reading and interpreting the Bible for the sake of gender equality and justice. It looks into the effects of gender injustice in the history of biblical interpretation and theology, and promotes interpreting the Bible with sensitivity towards gender inclusivity. It will cover both feminist and masculinity interpretations of the Bible."
This course is an advanced study of the biblical text (the Hebrew Bible and/or the New Testament) in the light of the contemporary critical biblical scholarship. The religious and cultural issues of ancient Israel and/or the early Christian church are to be tackled.
"This course is designed to introduce student to Semitic languages relating to the Hebrew Bible. Students will read some long and some short excerpts from either a) Aramaic and its many offshoots including Syriac, or b) Ugaritic or c) Akkadian, with its 2500-year-old history, or e) Classical Arabic, with elementary readings from the Qur’an or f) a comparative study of various Semitic languages which are similar. The direction the course will take depends upon the students’ needs and interests. This course will have in mind both the student of the Hebrew Bible, and the student who wants to gain a wider knowledge of the thought of ancient West Asia. In both cases, knowledge of Hebrew is required."
"This course attempts to explore the complexity of contemporary issues raised by ethics and society through a religious perspective. How religious thinking can be enriched and challenged by issues of bioethical, business, legal and political nature."
"This course will attempt to study some of the modern developmental theories such as Piaget’s cognitive developmental theory, Erikson’s socio-psychological theory, Kohlberg’ s moral developmental theory and Fowlers’ faith developmental theory. Special attention will be given to the evaluation of their signifi cance to education in a religious context."
"This course aims at introducing students to the approaches to reading the Hebrew Bible (The Christian Old Testament) in its literary, socio-political and religio-cultural contexts. The literary setting and historical background will be surveyed and explored in order to enhance students’ understanding of the text and the dynamics of the reading process."
"This course attempts to examine the principles and ways of Church’s responses to social issues from the Catholic faith tradition. Topics include the relationship between morality and spirituality, the foundation of social ethics, the methods of theological reflection and pastoral actions. Particular attention is given to Catholic Social Teachings and its development, and its perspectives on issues like human rights, economic justice and globalization, work and labour, ecology, political participation, racism, women’s status and so on. Catholic social movements and individuals will also be introduced."
"This course will introduce the basic concepts of Islam to the students i.e. fundamentals of faith, rituals of worship, Seerah of the Prophet of Islam, Islamic Civilization and Muslim contribution to different cultures. It will help the students to understand the contemporary issues in the light of Islamic teachings and the methodogical issues in Islamic Studies. The course has been designed for such students who have never studied Islamic Studies so far."
"Hindu religious traditions offer a rich variety of concepts as well as visualizations of divinity, from highly abstracted and nuanced notions of the Deity to highly tangible and specific images seen and elaborately venerated in temples. By close readings of classical sacred texts (in translation), viewing iconography, and discussion of India’s historical and social contexts in which texts and images have been embedded, this course will explore the fascinating amalgam of ritual, yoga, textual exegesis, and devotionalism of the Hindu religious world."
"This course provides an overview of the historical development of Buddhist culture in Asia. Main features elements of Buddhism in the diversified culture is highlighted. Theoretical foundations of Buddhist philosophy is delivered at the beginning, with reference to the development of the various Buddhist traditions, such as Theravada, Mahayana and Vajrayana. Their impact, evolution and integration on and into different cultures are being studies, with reference to the contemporary Buddhist practices. Comparisons amongst various cultural elements would be made, providing a greater in depth understanding of the different aspects of Buddhist Culture and the dynamism of Buddhism in its adaptation to different cultures. The course will end with discussing the role of Buddhism in its influence in reshaping the culture of modern society, highlighting facts that will help in the formation of a harmonious society."
"From more than 2500 years, Buddhism has spread almost all parts of the world, and undergone the developments from Primitive Buddhism, Theravada, Mahayana, to Tantriyana. In the contemporary world, Humanistic Buddhism has become one of the mainstreams of Buddhist developments. And the ideas and practices for the welfare of society and benefit of humanity have dominated Buddhist activities. This course designed to study the development of Humanistic Buddhism, including the history, thoughts, and practices. This course is divided into three parts yet each part is organically connected with the others. We first investigate the basic doctrines of traditional Buddhism related to the arising and practice of humanistic Buddhism, such as the Four Noble Truth, the Dependent-Origination, the ideas and practices of Bodhisattva. Having understood the doctrinal foundation of Humanistic Buddhism, we then examine the history of humanistic Buddhism in the early Republic era (1912-1949). Social, political, religious, as well as economic background in which Humanistic Buddhism arose will be discussed so that students could have holistic picture about the interaction between Buddhist institutions and society then. The teaching and practice of some pioneers of Humanistic Buddhism, such as Ven. Taixu will be examined to reveal the contents of Humanistic Buddhism. Towards the end of semester, we explore the contemporary developments of humanistic Buddhism in general, and Foguan Shan Buddhism in particular."
"The research paper in Religious Studies, which is planned with our faculty and those faculty members in relevant fields, allows students to develop some of the ideas and skills they have acquired during their study with us. Every student must write a research paper in Religious Studies of not less than 15,000 words (in Chinese or English) on an approved topic under individualized supervision. Students will be able to acquire some fundamental skills and methodologies of doing research and writing a dissertation in Religious Studies. They will also be better equipped for an application for MPhil/PhD programmes. Even though there will be group and individual supervision to guide students through from start to finish, this is largely a self-taught course and student initiative is most important."
"The problem of life and death constitutes the core concern of practically all religions of the world. The values and beliefs that relate to life and death have far-reaching impacts on different dimensions of religious practice. This course takes a thematic approach by examining and comparing the issues of life and death in some major religions in the world, including mainly the Indian, Chinese and Abrahamic traditions. The emphases and peculiarities of each religion will be illustrated from the doctrinal, textual, ritual and symbolic perspectives. Through the study of religion in different cultures, students will be equipped with a broadened horizon and fundamental framework for taking more advanced courses in all area of religious studies."
"This course adopts an innovative approach to examine the interactions between Christianity and Chinese literature from the 19th to early 20th centuries. Literary texts to be analyzed include mainly the late Qing missionary novels, and works of May Fourth writers (such as Lu Xun, Bing Xin and Xu Dishan). This course aims to widen the students’ perspectives in the indigenization of Christianity in Chinese religious and literary contexts, the rhetorical influences of the Bible on the emergence of modern Chinese literature, and the interdisciplinary study of literature and religion."
"Chinese literature has long been intertwined with religion. While Confucian, Buddhist and Daoist thoughts permeate classical Chinese literature, a large number of works constitute a lively epitome of Chinese religious culture. This course aims to investigate the interactive relationship between Chinese religion and literature. Students will be guided to examine the ways in which religious thoughts and symbols shape the themes, narratives and language of the literary works. Texts selected for reading mainly include Chinese classical novels such as The Journey to the West and The Story of the Stone."
"The classics of different religious traditions offer a wealth of knowledge, insight and wisdom about nature, reality and life. The store of ancient wisdom accumulated in various cultures is oftentimes still relevant to our contemporary contexts. This course takes a textual and story approach by examining the notions and themes of wisdom in some major religions of the world. Through guided reading of selected passages from the religious classics, students may draw from the well of profound wisdom to stimulate their reflection on the approach of life, the way of looking at the world, and the recurring issues facing humanity. Texts selected for reading may include Zhuangzi, the Lotus Sutra, the Bible and the Quran, the Bhagavad Gītā, and so forth. The exact list of texts may be modified by the teacher who offers the course in a particular year."
"This course is designed to explore the rich heritage of Taoist self-cultivation tradition. The course begins with an understanding of Taoist cosmology and its correlation with human body by indepth reading of major Taoist texts, e.g. Inner Chapters of Baopu zi neipian, Wuzhen pian, Lingbao bifa, and Jinhua zongzhi. Students of this course will be taught how are how Taoist concept of qi shapes the understanding of health and perfection of human body, and develops the practices of self cultivation, e.g. inner alchemy, meditation, qigong exercises and etc. The approach of this course emphasizes lecture, discussion of reading materials and practice."
"Centering on the notion of “right mindfulness”, this course aims to introduce students to the core topics on the Buddhist way to inner peace and happiness. The course will therefore address subjects such as affliction, self and no-self, the middle way, right mindfulness, and etc. Furthermore, the course will touch upon some common issues in modern life, and will investigate how they can gain inspirations from Buddhist perspectives, whether theoretical or practical. Towards the middle and the end of the course, students will learn essential methods of meditation based on Buddhist mindfulness. Students will thereby acquire an initial experience of meditation and take the benefits of meditative concentration into every aspect of their life."
"The specific topics of this course vary from year to year, depending on the expertise of the teacher of that particular year. Generally, they can be topics and issues related to different religious traditions, religion and society, religion and culture, or religion and life."
"The specific topics of this course vary from year to year, depending on the expertise of the teacher of that particular year. Generally, they may be more advanced themes and theories related to different religious traditions, religion and society, religion and culture, or religion and life."
"Integrating classroom learning with field work in relation to religious culture, this course is designed to help students truly comprehend textual knowledge and develop deeper insights into religious understanding by engaging in the spatial, geographical and material dimensions of particular religious traditions. This is a three-credit course in which the majority of the academic work is accomplished through group study and travel to some carefully selected religious sites, whether overseas or domestic. It aims to provide students with a lively and effective learning experience at an off-campus location for a minimum of three overnights, and enhances the student’s classroom learning through first-hand exposure to the religious relics and material culture. Each study tour will be organized and headed by experienced members of teaching staff. The specific sites of visit will depend on the subject and theme of study designed by the teacher who offers the course in a particular year."
"This course is designed to assist students in recognizing religious concepts, east and west, through analyzing movies that seem to have to do with “religion” per se. The course will help students explore how religion may be treated as an integral human phenomena and how religion involves the fullness of the human world through film watching.In addition, the course provides students with opportunities to think critically about a wide range of meanings concerning the existence of human beings through particular films. A religious notion of interpretation will be taken to examine how the meanings are constructed and transmitted to viewers through various visual narrative forms and symbols. It also encourages students to appreciate the form of cinematic aesthetics and symbols from the interdisciplinary perspectives."
"This course surveys major topics in the religious studies approach to religion and global politics. The first objective of the course is to familiarise students with the existing theoretical literature and empirical research. The second objective to evaluate recent research on the role of religious actors, institutions, and ideologies in policymaking, state-building, democratic politics, social movements, and other political processes."
"Are religion and sex always at odds? Do gods have genders? How can political leaders be celebrated as supreme dads? What can we learn from Foucault’s History of Sexuality, Antonio Gramsci’s prison writings, and Weber, Mahmood, Sedgwick…?This course examines religion, gender and sexuality as crucial systems of power that shape our world. Students will develop an understanding of religion and gender as both subjects and as categories of analysis. As categories of analysis, students will use gender and religion to interrogate cultural production and social systems, paying close attention to how gender and religion intersect with other categories of social difference. Students will connect the assigned academic readings to “real-life” examples in the news, media, and their own lives, thereby producing new theoretical understandings of gender, religion, and sexuality in the contexts of Hong Kong, Asia, and the world."
The purpose of this course is to give first-year M. Phil. and Ph.D. students an opportunity to report on and discuss their independent research and thesis writing.
The purpose of this course is to give second-year M. Phil. and Ph.D. students an opportunity to report on and discuss their independent research and thesis writing.
"Discussion in seminar setting on selected issues related to studies of Chinese religions. Emphasis will be placed on the interactions among different religious traditions in local Chinese society. Students are allowed to take these courses for more than once, and gain the units each time they pass the course. The specific content will be designed by the teacher who offers the courses."
"Discussion in seminar setting on selected issues related to studies of Chinese religions. Emphasis will be placed on the interactions among different religious traditions in local Chinese society. Students are allowed to take these courses for more than once, and gain the units each time they pass the course. The specific content will be designed by the teacher who offers the courses."
"This seminar examines Buddhism as a dynamic process of borrowing, conflict and interaction between and within traditions that have been identified as Buddhist. We will begin by studying some representative works of both primary and secondary source (such as those put together by Donald Lopez in his Buddhism in Practice). Specific themes and topics will then be chosen in accordance with students’ interest for in-depth examination. The specific content will be designed by the teacher who offers the courses."
"This seminar examines Buddhism as a dynamic process of borrowing, conflict and interaction between and within traditions that have been identified as Buddhist. We will begin by studying some representative works of both primary and secondary source (such as those put together by Donald Lopez in his Buddhism in Practice). Specific themes and topics will then be chosen in accordance with students’ interest for in-depth examination. The specific content will be designed by the teacher who offers the courses."
"Discussion in seminar setting on selected issues related to Taoism. Readings may include Taoist Canon, Taoist ritual manuscripts, and recent scholars’ work on Taoist studies. Students are allowed to take these courses for more than once, and gain the units each time they pass the course. The specific content will be designed by the teacher who offers the courses."
"Discussion in seminar setting on selected issues related to Taoism. Readings may include Taoist Canon, Taoist ritual manuscripts, and recent scholars’ work on Taoist studies. Students are allowed to take these courses for more than once, and gain the units each time they pass the course. The specific content will be designed by the teacher who offers the courses."
"Discussion in seminar setting on special issues related to biblical studies. Students are allowed to take these courses for more than once, and gain the units each time they pass the course."
"Discussion in seminar setting on special issues related to biblical studies. Students are allowed to take these courses for more than once, and gain the units each time they pass the course."
"Discussion in seminar setting on specific issues related to Christian studies. Students are allowed to take these courses for more than once, and gain the units each time they pass the course. The specific content will be designed by the teacher who offers the courses."
"Discussion in seminar setting on specific issues related to history of Christianity. Students are allowed to take these courses for more than once, and gain the units each time they pass the course."
"Discussion in seminar setting on specific issues related to history of Christianity. Students are allowed to take these courses for more than once, and gain the units each time they pass the course."
"This seminar course aims to reconsider various Christian doctrines from Chinese religious, philosophic and socio-cultural contexts. Students are allowed to take these courses for more than once, and gain the units each time they pass the course. The specific content will be designed by the teacher who offers the courses."
"This seminar course aims to reconsider various Christian doctrines from Chinese religious, philosophic and socio-cultural contexts. Students are allowed to take these courses for more than once, and gain the units each time they pass the course. The specific content will be designed by the teacher who offers the courses."
"Discussion in seminar setting on specific issues related to Christian studies. Students are allowed to take these courses for more than once, and gain the units each time they pass the course. The specific content will be designed by the teacher who offers the courses."
