"This course develops an advanced understanding of building technology in view of the growing global complexities of built environments. The course, offered as a required course for post-graduate level Architecture majors, enables students to master design thinking and, by following a problem-based group approach, apply it to an understanding of topical architectural issues. Lectures are arranged to advance building technology topics in structural, sustainable and environmental systems design, providing a holistic and integrated focus to the design and making of buildings. Case studies from contemporary practice and significant historic works will be used to illustrate building system typologies that contribute to an understanding of the relationship between design intention and built form. Course topics will also emphasize integrated and sustainable strategies in tall building design."
"This course develops an advanced understanding of an integrated design process in view of the growing global complexities of built environments. The course, offered as a required course for post-graduate level Architecture majors, enables students to master design-thinking and, by following a problem-based group approach, apply it to an understanding of topical architectural issues. Building on the substantial knowledge base in building technology (structural, sustainable and environmental systems design), the course advances the students’ relevant understanding of professional practice issues to provide a holistic and integrated focus to the design and making of buildings. Students form groups to actively engage in a “creative” design process that leads to an innovative proposal that fulfills a list of design goals. Upon completing this course, students will have acquired design skills and practical problem-solving skills in integrated building technology that are directly transferrable to further design work in their future careers."
"These elective courses investigate topics and issues in the specific field of building technology. Each specific elective is designed to allow the students to gain in-depth knowledge and ability to discourse or execute the theory and practice of the particular field. Each semester, there will be different sections of electives offered with specific course descriptions for students to choose from."
"These elective courses investigate topics and issues in the specific field of professional practice management. Each specific elective is designed to allow the students to gain in-depth knowledge and ability to discourse or execute the theory and practice of the particular field. Each semester, there will be different sections of electives offered with specific course descriptions for students to choose from."
"These elective courses investigate topics and issues in the specific field of sustainable design. Each specific elective is designed to allow the students to gain in-depth knowledge and ability to discourse or execute the theory and practice of the particular field. Each semester, there will be different sections of electives offered with specific course descriptions for students to choose from."
"This course examines the main ideas, histories and theories of the city through specific local and international examples from significant historical, political, geographical and environmental periods and aspects. Important themes and debates in urban design and planning will be critically explored to understand the relationship between the urban forms, the culture of cities and their sustainable development. In particular, the way urban forms have been used and reinterpreted, adapted and challenged by different social, economic and political contexts. Exemplary design projects and planning policies are investigated in view of their relationship to contexts and their impacts on communities and the environment."
"These elective courses investigate topics and issues in the specific field of urban design. Each specific elective is designed to allow the students to gain in-depth knowledge and ability to discourse or execute the theory and practice of the particular field. Each semester, there will be different sections of electives offered with specific course descriptions for students to choose from."
"The history of a locality is often defined by its culture and the built manifestations of that culture. The preservation of the architectural heritage of a culture is an indication of the importance that culture placed on its past. The trend in the developed world today is to preserve historical monuments, historic district, tangible and intangible heritage as much as possible. In Asia, conservation has a checkered history. For China and Hong Kong, architectural conservation is at the early stages of development. Much have been learned and much have to be done. This course is designed to introduce the basic concepts and practices in conservation with a particular emphasis on conservation practices in Hong Kong and the region. It will serve as the foundation for further development of interest and skill in conservation."
"Every building tradition has its unique construction system employing primarily local materials and craftsmanship. This course will introduce to the students various regional traditions, such as the timber tradition in East Asia, stone and brick tradition both ingenious and imported to East Asia and the 20th century tradition in the region with local and imported materials. Issues and techniques in employing these materials and construction systems in historic periods will be addressed. Site visit will be a feature of this course."
"This course will address the pertinent and current issues facing heritage conservation in the region. The format will be a heritage forum with invited speakers articulating the current discourses and issues which might include conservation legislature frameworks, cultural values of built heritage, grass-root advocacy, heritage tourism, sustainability, revitalization of heritage sites, or issues facing specific projects in urban renewal, conservation of national monuments, and other design projects. The key activities of the course are discussions and dialogues for understanding and critique of the current practices in conservation of built heritage in Hong Kong, China and the region, as well as to explore the future."
"This course looks at the architectural development and planning in Hong Kong through historical periods, examining both traditional Chinese settlements and colonial urban development. Issues such as culture and society, land and building regulations, rural and urban conditions, as well as building techniques will be covered. At the end of the course, student shall be able to identify the architectural style, spatial quality, layout, function, and decoration of buildings of different types and periods. The types of buildings that will be covered include the following three categories:- Chinese traditional buildings;- Buildings with colonial influence from late nineteenth to early twentieth centuries;- Building with modern building technique from 1910-1970"
"This module-based course is offered to investigate novel design methods and theories for architecture. There will be a different number of electives offered with specific course descriptions, designated as section A/ B/ C/ D etc. Students may take a maximum of three of these courses in place of a single three-credit elective. However, students may not take the same course section more than once in any particular semester."
"The year-long Design Studio forms the core of the Master of Architecture programme, with each course directly connected with the School’s design, societal and environmental agenda. Students are expected to design an architectural proposal from concept to final representation, through careful consideration to scale, context, tectonics, material and technology. The course offers a wide range of topics including: Urbanism, Building Technology, History & Theory, Digital Design and Design & Practice. It is geared towards developing innovative forms of competence and enabling students to work on different architectural fields, from the design of urban masterplans to individual buildings, from landscape redevelopments to adaptive reuse of existing buildings, from sustainable building designs to application of the latest building technologies."
"The Design Studio forms the core of the Master of Architecture programme, with each course directly connected with the School’s design, societal and environmental agenda. Students are expected to design an architectural proposal from concept to final representation, through careful consideration to scale, context, tectonics, material and technology. The course offers a wide range of topics including: Urbanism, Building Technology, History & Theory, Digital Design and Design & Practice. It is geared towards developing innovative forms of competence and enabling students to work on different architectural fields, from the design of urban masterplans to individual buildings, from landscape redevelopments to adaptive reuse of existing buildings, from sustainable building designs to application of the latest building technologies."
"The Design Studio forms the core of the Master of Architecture programme, with each course directly connected with the School’s design, societal and environmental agenda. Students are expected to design an architectural proposal from concept to final representation, through careful consideration to scale, context, tectonics, material and technology. The course offers a wide range of topics including: Urbanism, Building Technology, History & Theory, Digital Design and Design & Practice. It is geared towards developing innovative forms of competence and enabling students to work on different architectural fields, from the design of urban masterplans to individual buildings, from landscape redevelopments to adaptive reuse of existing buildings, from sustainable building designs to application of the latest building technologies."
"The year-long Design Studio forms the core of the Master of Architecture programme, with each course directly connected with the School’s design, societal and environmental agenda. Students are expected to design an architectural proposal from concept to final representation, through careful consideration to scale, context, tectonics, material and technology. The course offers a wide range of topics including: Urbanism, Building Technology, History & Theory, Digital Design and Design & Practice. It is geared towards developing innovative forms of competence and enabling students to work on different architectural fields, from the design of urban masterplans to individual buildings, from landscape redevelopments to adaptive reuse of existing buildings, from sustainable building designs to application of the latest building technologies."
"The Design Studio forms the core of the Master of Architecture programme, with each course directly connected with the School’s design, societal and environmental agenda. Students are expected to design an architectural proposal from concept to final representation, through careful consideration to scale, context, tectonics, material and technology. The course offers a wide range of topics including: Urbanism, Building Technology, History & Theory, Digital Design and Design & Practice. It is geared towards developing innovative forms of competence and enabling students to work on different architectural fields, from the design of urban masterplans to individual buildings, from landscape redevelopments to adaptive reuse of existing buildings, from sustainable building designs to application of the latest building technologies."
"The Design Studio forms the core of the Master of Architecture programme, with each course directly connected with the School’s design, societal and environmental agenda. Students are expected to design an architectural proposal from concept to final representation, through careful consideration to scale, context, tectonics, material and technology. The course offers a wide range of topics including: Urbanism, Building Technology, History & Theory, Digital Design and Design & Practice. It is geared towards developing innovative forms of competence and enabling students to work on different architectural fields, from the design of urban masterplans to individual buildings, from landscape redevelopments to adaptive reuse of existing buildings, from sustainable building designs to application of the latest building technologies."
"This course is offered to Master of Architecture students who have completed their first degree in architecture and their year-out practical training. While in line with the HKIA/ARB professional practice assessment requirements, this course is meant to prepare the students in the handling of professional matters once they graduate from the MArch programme, to help them integrate into the profession and begin their professional training with an aim of obtaining professional qualification in Hong Kong."
Discussion of current research and research traditions in the various domains of architecture.
An introduction to research methods common to the various domains of architecture.
"In this course, a student is required to meet with his/her supervisor regularly who provides necessary guidance and supervision to write up a thesis and monitors the student’s academic progress."
"In this course, a student is required to meet with his/her supervisor regularly who provides necessary guidance and supervision to write up a thesis and monitors the student’s academic progress."
"In this course, a student is required to meet with his/her supervisor regularly who provides necessary guidance and supervision to write up a thesis and monitors the student's academic progress."
