"This course covers the topics on:1. Introduction to modern information technologies • Digital computing: hardware, software, and peopleware • Networking and communication systems: wired, wireless, and optical • Data storage technologies: personal, institutional, and ubiquitous • Internet and the web: technologies, services, and applications, such as cloud computing and social networking • How IT change our lifestyle and the society2. Basic skills and applications of information technologies • Efficient, effective and green operation of a computer • Using selected application software: spreadsheet; covering skills such as using functions and formula, charting, data analysis, data retrieval, etc.  • Using mobile digital services, web-based services, and online collaborative tools, e.g., personal information management (PIM) software, online questionnaire, online spreadsheet, etc. • Techniques in using productivity and automation tools, e.g. commands and scripts, simple programming for repeated and automatic tasks3. Information literacy • Information sources: identification, characteristics, and their evaluation • Effective search strategies and skills • Information usage: evaluation and proper citation • Advanced search skills for different information sources4. Information security • Information system security issues and measures by case studies • Using IT services in a secure manner, e.g., Using virtual private network (VPN), secure browsing, securing Wi-Fi connections, using security suite software, configuring personal firewall, junk mail filtering and sorting • Protection of personal sensitive data, e.g., How to use encryption and password-protection while transferring data and using mobile data storage devices • Information security policies and practices5. Ethics in IT and relevant Hong Kong legislations • Ethical and cultural issues in using and handling digital information • Intellectual properties • Freedom of expression and netiquette • Relevant Hong Kong legislations"
"This is an introductory level course on digital literacy and its applications. The course first covers basic information technology skills and spreadsheet usage. Then basic statistics and data science concepts for working with data from digital sources will be introduced. Computational thinking techniques for solving problems with data (e.g., automation, textual analysis, data visualization, etc.) will be covered. Demonstrations on solving real-life problems creatively will be provided. Case studies in social media usage will be included to illustrate how to interpret data properly and identify false information. The course focuses on hands-on practices using relevant software toolboxes, without covering the inner-working details."
"This is an introductory level course on digital literacy and its applications. The course first covers basic information technology skills and spreadsheet usage. Then basic statistics and data science concepts for working with data from digital sources will be introduced. Computational thinking techniques for solving problems with quantitative data (e.g., automation, curve fitting, classification, clustering, etc.) will be covered. Demonstrations on solving real-life problems creatively will be provided. Case studies in social media usage will be included to illustrate how to interpret data properly and identify false information. The course focuses on hands-on practices using relevant software toolboxes, without covering the inner-working details."
"This is a hands-on project-based course which introduces the basic engineering concepts, experimental skills and design methodology needed for the design and construction of a hardware based system. Students will work in small groups on a practical project in which they will apply the design methodology introduced to them in lectures in a design project. The project work will involve defining milestones, identifying the constraints and requirements, defining the requirement specifications of the design, making and evaluating different possible designs by carrying out experiments to obtain data for refining the design, prototyping of the final design and testing of the system built in the project."
"This is a computer-programming course to equip students with software knowledge and skills to solve engineering problems. Students will learn fundamental programming concepts in C, such as data representation and variables, operators and expressions, flow-control statements, functions, arrays, structures, pointer basics, input/ output handling, etc. In addition to lectures and e-learning, students will work in labs to practise solving problems and complete an engineering software project. The course will cover various problem solving methods such as incremental development, divide-and-conquer, debugging technique, finite-state machine, etc. Through practices, students will acquire skills to define problems and specifications, to perform modelling and simulation, to develop software system prototypes, to carry out verification, validation, and performance analysis."
"This course aims at introducing students to the fundamental concepts and methods in linear algebra, which are key to many fields of engineering. Topics include systems of linear equations, Gauss elimination, matrix factorization, matrices and their operations, determinants, eigenvalues and eigenvectors, diagonalization, vector space, the Gram-Schmidt process, and linear transformation."
"This course aims at introducing students to fundamental concepts and methods in multivariable calculus, which provide tools for solving engineering problems. Topics include functions of several variables, curves and surfaces, partial derivatives, Taylor’s formula, method of Lagrange multipliers, multiple integrals, line and surface integrals, Green’s theorem, Stokes’ theorem and divergence theorem"
"This is an introductory calculus-based engineering physics course covering topics in electromagnetics, optics and modern physics. Topics in electromagnetics include: electric and magnetic properties, Coulomb’s law, Gauss’ law, electromagnetic energy and forces, Biot-Savart law, electromagnetic fields and Maxwell’s equations, propagation of plane electromagnetic waves. Topics in optics include: optical interference, interferometers, optical diffraction. Topics in modern physics include: wave-particle duality, momentum and energy of photons and electrons, electronic states and energy bands, electrical conduction in metals and semiconductors. Contents will be supplemented by discussions on applications relevant to engineering."
"Linear algebra: matrices, matrix addition, matrix multiplication, inverses, special matrices; vector spaces, basis and dimension, linear independence, rank, determinants; linear transformations, projection, orthogonality, systems of linear equations, Gaussian elimination; eigenvalues and eigenvectors. Vector calculus: 3-D vector space and algebra; vector differential calculus, gradient, divergence, curl; vector integral calculus, Green's theorem, Gauss's theorem, Stoke's theorem."
"The objective of the course is to enable students to have a basic understanding of the practical aspects of the engineering profession. Prior to the enrolment of this course, students must have completed not less than 8 weeks of full-time internship approved by the Faculty of Engineering. To be qualified for award of the subject credit, the student must submit a report, within the semester of enrolment, summarizing what he or she has done and learnt during the internship, together with a testimonial from the corresponding employer. Pass or fail of the course will be determined by the professor-in-charge, based on the report and the testimonial submitted.Student may look for internship opportunities at the Placement and Internship Program (PIP) website administered by Centre for Innovation and Technology of the Faculty, or from any other sources available to him or her. Students are recommended to seek professor-in-charge’s comment on internship undertaken before enrolling in the course. Work-Study, the 12-month internship program organized by the Faculty, is a valid internship satisfying the requirements of ENGG1820.Advisory: For year 2 or above Engineering Majors students. (new curriculum)"
"(UGEB1407 is double-coded with ENGG1910.) Artificial intelligence (AI) is not only one of the most influential technologies nowadays but also a hot topic for the general public. Today’s AI technology is built upon profound mathematical and scientific knowledge, and a full array of engineering innovations. This introductory course on AI is designed for undergraduate students majoring in non-engineering subjects. Students taking the course are assumed to have minimal background in mathematics and no experience in computer programming. Students will learn the basic elements of artificial intelligence, data analytics, and machine learning, and develop in-depth understanding of notable applications of AI, for example, face recognition, talking robots, synthetic media, art creation, sentiment analysis. A large part of the learning activities will be in the forms of technology demonstrations, laboratory practice, project design and group discussion."
"(UGEB1408 is double-coded with ENGG1920.) Artificial intelligence (AI) refers broadly to the technologies that enable computing machines to perform tasks that are believed to require human intelligence.  Nowadays AI is widely applied not only to solve high-complexity real-world problems but also to provide powerful tools to assist our day-to-day work and living. The objectives of this course are to let students experience the use of AI, and encourage them to apply AI in their interested areas. Students will learn the basic principles, the functions, the performance and limitation of main types of AI technologies. Through guided programming practice and design project, students will gain hands-on experience on using AI software tools, evaluating existing technologies and creating new applications."
This course introduces the digital concepts; number systems; operations and codes; logic gates; Boolean algebra and logic simplification; combinational logic; functions of combinational logic; flip-flops and related devices; counters; finite state machines; programmable logic devices - programming and sequential logic applications; memory and storage; integrated circuit technologies.
"This course introduces the concepts of signals and systems and teaches the mathematical and computational tools for the analysis of engineering signals and systems. The course content covers Fourier representations of continuous-time and discrete-time signals, frequency spectrum, linear and time-invariant systems, impulse response, convolution sum and convolution integral, frequency response, Laplace transform and z-transform representations of signals and systems. Sampling theorem and the relation between continuous-time and discrete-time signals will be discussed. This course includes mandatory laboratory modules."
"Complex analysis: analytic functions and Cauchy Riemann; complex integration, Cauchy principal value; elementary complex valued functions: exponential functions, Euler’s formula, trigonometric and hyperbolic functions, logarithm and general powers; power series, Taylor series and convergence tests.ODE: classification of differential equations; 1st order ordinary differential equations; 2nd order ordinary differential equations. Partial differential equations."
"Fundamental probability concepts: probability and events; expectation, variance, moments, moment generating functions; single variate distributions. Multivariate probability: conditional probability, joint probability; Bayes’ Theorem; conditional expectation, covariance; multivariate distributions, functions of random variables. Central limit theorems, law of large number. Statistics: estimation, sample size and applications."
"Set theory, functions, relations, combinatorics, graph theory, algebraic systems, propositional and predicate logic."
"Probability theory: population, sample spaces and events, counting, axioms of probability, conditional probability, Bayes' Theorem, discrete distributions, continuous distributions, joint distributions, expectation and decision making, random processes. Statistical inference: sampling distributions, point estimation, confidence interval, hypothesis testing, chi-square goodness-of-fit test. Introduction to regression analysis: linear regression."
"The course will cover the following topics:Sets, relations, proof methods, combinatorics, probability and events: expectation, variance, moments, moment generating functions, single variate distributions. Multivariate probability: conditional probability, joint probability, Bayes’ Theorem, conditional expectation, covariance, multivariate distributions. Functions of random variables. Central limit theorem, law of large numbers."
"A first course in complex numbers and the calculus of functions of one complex variable. Topics include complex numbers, complex differentiation, analytic functions and Cauchy–Riemann equations, elementary complex functions, complex integration, series, and residues integration."
"A first course in the theory and applications of ordinary and partial differential equations. Topics include classification of differential equations, linear ordinary differential equations, Fourier series, and partial differential equations."
"A first course in the fundamentals of probability theory and their applications in engineering. Topics include sample space and events, counting, axioms of probability, conditional probability, independence of events, discrete and continuous distributions, random variables, joint distributions, and limit theorems."
"A first course in the fundamentals of statistics and their applications in engineering. Topics include populations and samples, point estimation, confidence intervals, hypothesis testing, and basics of linear regression."
"The 1-unit course will introduce engineering entrepreneurship and provide the key basic concepts needed in the preparation of technical proposals and business plans. The course will introduce students to analytical process of evaluating new ideas, and metrics to compare ideas with existing approaches in the market. The course will include in class discussion of forecasts based on market size estimates, cashflow analysis and technical development plans. The course objective is to prepare students to develop and present their innovative technical ideas that have potential for practical development as a preliminary entrepreneurship project in the following semester in ENGG3803. In addition to a formal written proposal to describe their ideas, students will also be asked to present their proposal to the course instructor. Shortlisted proposals will be invited to a second presentation where a panel of experienced engineering entrepreneurs select proposals for further development."
"The 2-unit course is project based. Students will be provided with individual or small group project supervision to help them implement their project proposal from ENGG3802. The objective of the course is to provide an initial technical implementation showing the technical feasibility of the proposal. The focus is carry out practical prototyping, simulations and/or computer coding and build a pre-alpha proof of concept demonstration via initial computer software or design/building of the critical hardware subsystems. At the end of the course, students will present their work to a panel of assessors in a project competition, and those shortlisted will be assessed by a panel including external entrepreneurs who may consider the successful projects for possible continuation (eg as the final year project or capstone project of their major programme)."
"This course is designed to present an overview of some advanced computer architectures and their underlying design principles. Issues discussed will include scalability and performance evaluation. The underlying technologies such as processor and memory hierarchy, cache and shared memory, and advanced pipelining techniques will be presented. Examples of high performance vectorprocessors, multicomputers and massive parallel processors will be compared. Some novel architectures such as VLIW, fault tolerant systems and data flow machines will also be elaborated.Advisory: Students are expected to have taken CENG3420 or having background knowledge in computer organization."
"Data mining provides useful tools for the analysis, understanding and extraction of useful information from huge databases. These techniques are used in business, finance, medicine and engineering. This course will introduce the techniques used in data mining. Topics will include clustering, classifi cation, estimation, forecasting, statistical analysis and visualization tools."
"This course will cover fundamental knowledge and advanced topics in image processing and computer vision, including feature detection, segmentation, motion estimation, panorama construction, 3D reconstruction, scene detection and classification, color image processing and restoration. Applications in computer graphics will also be introduced, including image transformation, and cameracalibration. Basic concepts of related algorithms and mathematic background will be discussed."
"This course aims to introduce important topics in computer and network security from an applied perspective. Topics include: (i) applied cryptography (e.g., cryptographic primitives, programming with OpenSSL), (ii) network security (e.g., unauthorized accesses, large-scale network attacks, firewall & intrusion detection systems), (iii) web security (e.g., HTTP session management and web attacks), and (iv) system security (e.g., buffer overflow, passwords, file system security). The course also discusses latest applied security topics depending on the current research trends.Advisory: Students are expected to have taken CSCI3150 or ESTR3102, and CSCI4430 or CENG4430 or IERG3310"
"This course provides an introduction to the important concepts, theories and algorithms of pattern recognition. The topics cover Bayesian decision theory, maximum likelihood and Bayesian parameter estimation, support vector machine, boosting, nonparametric pattern recognition methods, and clustering. It also includes applications of pattern recognition in different fields. Students taking this course are expected to have the background knowledge of calculus, linear algebra, probability and random process as a prerequisite. Pre-requisite: ELEG3410 or with the consent of the instructor."
"This course is designed to introduce the Advanced Microwave Engineering. Topics will be selected from the following: antennas, array antennas, MIMO antennas, phased array, microwave filter design, computer-aided design of microwave circuits, electromagnetic simulation, and radio propagation."
"This course is a review of semiconductor physics. The course content covers the following topics. Electrons in nanostructures: density of states, quantum confinement, transport properties, nanocontacts, Coulomb blockade. Nanoscale fabrication and synthesis: lithography, nanopatternning, epitaxy and heterostructure, self-assembly, other techniques. Nanoscale characterization: scanning probe microscopy and other microscopic techniques, nanoscale electrical measurements. It also introduces nanoscale devices such as nano-MOSFETs; carbon nanotube devices, nanowire- and nanoparticle-based devices, organic thin film devices, molecular electronic devices, their applications, and commercialization. Pre-requisite: ELEG2510 or ELEG3510 or ELEG4510 or with the consent of the instructor."
"This course is an overview of fiber communication technology. This course content covers fiber transmission impairments, introduction to nonlinear optics, second order and third order nonlinear phenomena, lightwave propagation in nonlinear media, optical signal processing in communications and specialty fibers."
"Introduction. Shannon's information measures. Entropy rate of a stationary process. The source coding theorem. Kraft inequality. Huffman code. Redundancy of a prefix code. The channel coding theorem. Rate-distortion theory. Universal data compression.Blended-mode class section is available for this course. Please refer to the ""Class Notes"" of the blended-mode class section for details.Advisory: Students are expected to have fundamental probability concepts."
"This course provides an extensive introduction to basic principles and advanced techniques in the physical layer of wireless communications. Topics to be covered include channel coding, MIMO andspace-time processing, OFDM and multicarrier systems, spread spectrum and CDMA, channel capacity, opportunistic scheduling and diversity schemes.Advisory: A prior undergraduate level course in wireless communication is highly recommended."
"This is a graduate-level course on cryptography. It focuses on the definitions and constructions of various cryptographic schemes and protocols, as well as their applications. Useful tools for securing practical systems and emerging techniques in the applied research community will be introduced. No prior knowledge of security, cryptography, or number theory is required.- Introduction: a brief history, applications in distributed systems; basic number theory- Symmetric-key encryption: definition, information-theoretic security, Entropy, PRNG- Provable security: bounded adversary, random oracle model, basic primitives, reduction- Public-key encryption: modelling security, Diffie-Hellman protocol, hybrid encryption- Authentication: Hash function, collision-resistance, MAC, unforgeability- Public-key infrastructure: certificate management, deployment, and revocation issues- More schemes: Fiat-Shamir transformation, Cramer-Shoup encryption, identity-/attribute-based encryption, certificateless encryption, proxy re-encryption , broadcast- Privacy-enhancing cryptography: zero-knowledge proof, anonymous credentials- Pairing-based cryptography: elliptic curve basic, short signature, searchable encryption"
"This course covers the design of advanced optical fiber communication systems. Topics include: optical signal characterization and spectral efficient optical modulation formats, high-speed signal transmission & multiplexing techniques, linear & nonlinear fiber effects and fiber transmission impairments, basic guided-wave optoelectronics and novel integrated optical devices (tunable lasers, planar lightwave circuits, silicon photonics), optical signal amplification, regeneration and performance monitoring techniques, coherent optical communications and enabling digital signal processing techniques, and examples of optical subsystems for optical networks.Advisory: Knowledge of basic optical communication principles is required."
"This course provides a comprehensive overview of robotics for postgraduate level study. The course covers the fundamental concepts and methods to analyze, model, and control of robotic mechanisms. Specific topics include kinematics, inverse kinematics, dynamics, trajectory generation, individual and multivariable control, interaction force control, and sensors. Students will also involve in hands-on programming project to reinforce the basic principles developed in lectures as well as develop robot algorithm implementation skillsets. The course will also expose students to the latest and advanced developments in robotics such as medical robotics, dynamic parameter identification."
"Linear system theory and design is the core of modern control approaches, such as optimal, robust, adaptive and multivariable control. This course aims to develop a solid understanding of the fundamentals of linear systems analysis and design using the state space approach. Topics covered include state space representation of systems; solution of state equations; stability analysis; controllability and observability; linear state feedback design; observer and compensator design, advanced multivariable control systems design, decoupling and servo control. This course is a must for higher degree students in control engineering, robotics or servo engineering. It is also very useful for those who are interested in signal processing and computer engineering."
"This course provides a broad overview of microfabrication and microelectromechanical systems. Topics include introduction to basic micromaching techniques such as photolithography; isotropic and anisotropic wet etching; dry etching; physical and chemical vapor deposition; electroplating; metrology; statistical design of experiments; MEMS release etching; stiction; and MEMS device testing. The course also reviews important microsensors, microactuators and microstructures. Topics include accelerometers; pressure sensor; optical switches; cantilever beams; thin-film stress test structures and bulk micromaching test structures. Lastly, the course introduces the fundamentals of central dogma of molecular biology; cell and tissue biology; and principles of transduction and measurements of molecules, cells and tissues."
