"This is a hands-on project-based course which introduces the basic engineering concepts, experimental skills and design methodology needed for the design and construction of a hardware based system. Students will work in small groups on a practical project in which they will apply the design methodology introduced to them in lectures in a design project. The project work will involve defining milestones, identifying the constraints and requirements, defining the requirement specifications of the design, making and evaluating different possible designs by carrying out experiments to obtain data for refining the design, prototyping of the final design and testing of the system built in the project."
"This is a computer-programming course to equip students with software knowledge and skills to solve engineering problems. Students will learn fundamental programming concepts in C, such as data representation and variables, operators and expressions, flow-control statements, functions, arrays, structures, pointer basics, input/ output handling, etc. In addition to lectures and e-learning, students will work in labs to practise solving problems and complete an engineering software project. The course will cover various problem solving methods such as incremental development, divide-and-conquer, debugging technique, finite-state machine, etc. Through practices, students will acquire skills to define problems and specifications, to perform modelling and simulation, to develop software system prototypes, to carry out verification, validation, and performance analysis."
"This is an introductory calculus-based engineering physics course covering topics in electromagnetics, optics and modern physics. Topics in electromagnetics include: electric and magnetic properties, Coulomb’s law, Gauss’ law, electromagnetic energy and forces, Biot-Savart law, electromagnetic fields and Maxwell’s equations, propagation of plane electromagnetic waves. Topics in optics include: optical interference, interferometers, optical diffraction. Topics in modern physics include: wave-particle duality, momentum and energy of photons and electrons, electronic states and energy bands, electrical conduction in metals and semiconductors. Contents will be supplemented by discussions on applications relevant to engineering."
"Linear algebra: matrices, matrix addition, matrix multiplication, inverses, special matrices; vector spaces, basis and dimension, linear independence, rank, determinants; linear transformations, projection, orthogonality, systems of linear equations, Gaussian elimination; eigenvalues and eigenvectors. Vector calculus: 3-D vector space and algebra; vector differential calculus, gradient, divergence, curl; vector integral calculus, Green's theorem, Gauss's theorem, Stoke's theorem."
"This course aims at introducing students to the fundamental concepts and methods in linear algebra, which are key to many fields of engineering. Topics include systems of linear equations, Gauss elimination, matrix factorization, matrices and their operations, determinants, eigenvalues and eigenvectors, diagonalization, vector space, the Gram-Schmidt process, and linear transformation."
"This course aims at introducing students to fundamental concepts and methods in multivariable calculus, which provide tools for solving engineering problems. Topics include functions of several variables, curves and surfaces, partial derivatives, Taylor’s formula, method of Lagrange multipliers, multiple integrals, line and surface integrals, Green’s theorem, Stokes’ theorem and divergence theorem"
This course introduces the computer-oriented problem-solving methods and algorithm development; object oriented programming concepts; concepts of abstract data types; simple data structures; illustrative applications. The C++ programming language will be used.
"This course aims at providing students with the basic knowledge of computer programming. In particular, programming methodologies such as object-oriented programming and structured programming, and the use of abstract data types will be illustrated using high-level programming languages such as Java."
"Complex analysis: analytic functions and Cauchy Riemann; complex integration, Cauchy principal value; elementary complex valued functions: exponential functions, Euler’s formula, trigonometric and hyperbolic functions, logarithm and general powers; power series, Taylor series and convergence tests.ODE: classification of differential equations; 1st order ordinary differential equations; 2nd order ordinary differential equations. Partial differential equations."
"Fundamental probability concepts: probability and events; expectation, variance, moments, characteristic functions, moment generating functions; single variate distributions. Multivariate probability: conditional probability, joint probability; Bayes’ Theorem; conditional expectation, covariance; multivariate distributions, functions of random variables. Central limit theorems, law of large number. Random process: definition, stationary and ergodic random processes, Gaussian random processes, white noise. Statistics: estimation, sample size and applications."
"Set theory, functions, relations, combinatorics, graph theory, algebraic systems, propositional and predicate logic."
"Probability theory: population, sample spaces and events, counting, axioms of probability, conditional probability, Bayes' Theorem, discrete distributions, continuous distributions, joint distributions, expectation and decision making, random processes. Statistical inference: sampling distributions, point estimation, confidence interval, hypothesis testing, chi-square goodness-of-fit test. Introduction to regression analysis: linear regression."
"The course will cover the following topics:Sets, relations, proof methods, combinatorics, probability and events: expectation, variance, moments, moment generating functions, single variate distributions. Multivariate probability: conditional probability, joint probability, Bayes’ Theorem, conditional expectation, covariance, multivariate distributions. Functions of random variables. Central limit theorem, law of large numbers."
"A first course in complex numbers and the calculus of functions of one complex variable. Topics include complex numbers, complex differentiation, analytic functions and Cauchy–Riemann equations, elementary complex functions, complex integration, series, and residues integration."
"A first course in the theory and applications of ordinary and partial differential equations. Topics include classification of differential equations, linear ordinary differential equations, Fourier series, and partial differential equations."
"A first course in the fundamentals of probability theory and their applications in engineering. Topics include sample space and events, counting, axioms of probability, conditional probability, independence of events, discrete and continuous distributions, random variables, joint distributions, and limit theorems."
"A first course in the fundamentals of statistics and their applications in engineering. Topics include populations and samples, point estimation, confidence intervals, hypothesis testing, and basics of linear regression."
"This course introduces the techniques for building embedded systems such as the use of microprocessors, interfacing memory systems and timing control of digital signals. It also discusses peripheral input/output interfacing methods such as: timer, serial and parallel interfaces, analog-to-digital conversion, polling, interrupt and device driver developments. Assembly language programming will also be introduced: concepts of addressing modes, data manipulation, control flow instructions, programme linkage and relation to high level languages."
"This course introduces the concept of abstract data types and the advantages of data abstraction. Various commonly used abstract data types including vector, list, stack, queue, tree, and set and their implementations using different data structures (array, pointer based structures, linked list, 2-3 tree, B-tree, etc.) will be discussed. Sample applications such as searching, sorting, etc., will also be used to illustrate the use of data abstraction in computer programming. Analysis of the performance of searching and sorting algorithms. Application of data structure principles."
This course introduces the digital concepts; number systems; operations and codes; logic gates; Boolean algebra and logic simplification; combinational logic; functions of combinational logic; flip-flops and related devices; counters; finite state machines; programmable logic devices - programming and sequential logic applications; memory and storage; integrated circuit technologies.
"This course is concerned with the development of web applications. The major topics include 1) Building blocks of web applications, 2) Client-side/front-end technologies, 3) Server-side/back-end technologies, and 4) Web application design and security issues."
"This course covers the definition, scope, basic principles and problems in biomedical engineering, introduction to the enabling technologies for biomedical engineering. It provides the overview of various topics in biomedical engineering, e.g., biomedical sensors, bioinstrumentation, bio-signal processing, biomechanics, biomaterials, molecular engineering, tissue engineering, bio-nanotechnology, medical imaging and rehabilitation engineering, etc. It covers the applications of engineering principles to selected medical and biological problems and contemporary roles and challenges of biomedical engineering."
"This course provides hands-on experience in various aspects of biomedical engineering, introduction to basic electronics, chemistry, molecular biology, microbiology, electrophysiology laboratory techniques and hospital visits. Laboratory skills, experimental design, interpretation of data, technical writing and safety and ethical issues relevant to laboratory work. It concludes with a student-driven design project."
"This course covers biostatics, biodynamics, and biosolid mechanics and their applications to the human musculoskeletal systems and the clinical practice of orthopaedics. Topics include: force and moment vectors, equations of equilibrium, moments of inertia, kinematics of particles, Newton's second law, kinematics of rigid bodies, dynamics of rigid bodies, stress-strain relations, linear elasticity, loading and deformation, shear forces and bending moments, multi-body kinematics and application to skeletal system.Clinical scenarios will be presented with open-ended questions concerning musculoskeletal injury mechanisms associated with musculoskeletal biology (aging, gender, diseases, adverse effects of treatments) and external forces (sports and traffic accidents), basic principles for designing medical devices and implants for prevention and treatment of musculoskeletal injuries.Relevant laboratory sessions on musculoskeletal force analysis and human movement studies will be synergized with the corresponding lectures to enhance learning. Students are expected to have prior knowledge on the basic principles of Newtonian mechanics at secondary school level."
"This course introduces the concepts of signals and systems and teaches the mathematical and computational tools for the analysis of engineering signals and systems. The course content covers Fourier representations of continuous-time and discrete-time signals, frequency spectrum, linear and time-invariant systems, impulse response, convolution sum and convolution integral, frequency response, Laplace transform and z-transform representations of signals and systems. Sampling theorem and the relation between continuous-time and discrete-time signals will be discussed. This course includes mandatory laboratory modules."
"This is a foundation course on telecommunication and related technologies. It describes the essential elements of a modern communication system. Students will learn the basic concepts in electrical communication, the operation principles and the performance requirements for a real-world communication system. The course content include signal representation and properties, amplitude modulation, angle modulation, analogue-to-digital signal conversion, demodulation and detection, pulse modulation, multiplexing, baseband transmission, passband transmission, inter-symbol interference, system performance evaluation and other topics. The course is the basis of various advanced courses on electrical and optical communications."
"Linear time-invariant systems. Fourier analysis of continuous-time and discrete-time signal and systems. Laplace transform. z-transform. Feedback systems. Applications such as processing of communication signals and images, control of disk drive systems, and analysis of the stock market."
"This course introduces the basic analysis of analog and digital electronic circuits, as well as the basic principles of communication circuits. The analog circuit analysis includes: basic circuit laws and theorems; mesh and nodal analysis; resonant circuits, steady-state and small signal analyses; electrical amplifiers. The digital logic circuit analysis includes Boolean algebra; logic gates; combinational logic circuit and sequential logic circuit design; synchronous and asynchronous sequential machine design. Overview of the computer architecture will be introduced. Examples of common electronic circuits will be discussed as case studies."
"This course introduces the C programming language with applications to systems programming. Topics include fundamentals of the C programming language, software development tools, and system programming principles."
"The course introduces the fundamental principles of probability models and their engineering applications. It includes the topics in basic probability theory, random variables, common distributions and probability functions, moment generating function, inequalities, limit theorems, basic random processes, and basic Markov chains and Poisson processes. This is the foundation course to prepare the students for courses in communications and networking."
"The course covers Linear-time Invariant Systems, Convolution, Dirac delta functions, Fourier Analysis of Continuous and Discrete-time Systems, Sampling Theorem, Fast-Fourier Transform, Laplace Transform, Z-Transform, and Fourier uncertainty principle. There will be emphasis on the interplay between mathematical ideas in MATH courses and engineering applications. Ideas such as inner product spaces, Contour integration, Cauchy-Schwartz inequality, Spectral decomposition, etc. will be employed for obtaining various results."
"The course covers the following two related topics. Discrete Structures: Graphs, Combinatorics - sums and asymptotics, recurrences, countingProbability: Random Variables and Probability density functions, conditional probability, independence, expectations, Markov and Chebychev inequalities, laws of large numbers, Random Walks, basic Markov Chains."
"This course provides an introduction to the statics and dynamics. You will be introduced to and become familiar with all relevant physical properties and fundamental laws governing the behavior of particles and rigid bodies, and you will learn how to solve a variety of problems in terms of kinematics, kinetics, energy, and momentum of particles and rigid bodies. The emphasis is on the physical understanding of why particles or rigid bodies behave the way they do in both the statics and the dynamics."
"This course will cover fundamental topics in thermodynamics including basic concepts, heat and work, pure substance, ideal gas, first law and second law of thermodynamics, entropy, gas and vapor power cycles, and refrigeration cycles."
"This course introduces the heating, ventilation, and air-conditioning (HVAC) systems for buildings. The contents include psychrometrics, air-handling process, zones, single-zone system, constant air volume (CAV) systems, variable air volume (VAV) systems, hydronic system and architecture, central plant, thermal comfort, ventilation and indoor air quality."
"Principles of engineering economy. Value and cost; cash flows. Economic analysis of alternatives, technological, social and human factors. Models involving allocation and scheduling of resources. Analytical techniques for evaluating industrial projects. Relationship between economics of technical choice and industrial productivity. Basic financial accounting concepts; accounting cycle; financial statements."
"This course introduces the essentials of optimization methods, including models, solution methods, and programming techniques. Topics cover linear programming, integer linear programming, nonlinear programming, and convex programming. It will highlight applications of these methods in Fintech, such as asset allocation, portfolio management, and data analysis."
"This course presents an introductory roadmap into the newly emerged and rapidly evolving field of data science, with the objective of introducing the problem-solving mindset in a data-intensive context.The course projects data science as a productive synthesis of its parent disciplines, including mathematics, statistics, computing, data mining, system science and data visualization, etc. Such a productive synthesis is applicable across many fields to bring about scientific discovery through data-intensive, analytical methods. This course aims to help navigate students in taking more advanced courses in its parent disciplines to build up their expertise in data science. We cover topics including:History and impact of Data Science.Collecting Data: sources, types and categorization of data.Visualising Data: summary statistics, data display, data dictionaries, schema and graphical visualization.Analysing Data: pattern recognition, correlations and relationships, hypotheses testing, statistical significance.Investigating Data: data mining, machine learning, inference, meta-data, modeling, eliciting meaning and validation.Applicational contexts: Examples of useful applications from case studies."
"This required course covers basic circuit theories that are needed for understanding the operation, as well as design of many biomedical devices. It also provides a theoretical and mathematical foundation for analyzing and processing electrical signals. Students will learn the parametric concepts commonly used for the representation, analysis and transformation of continuous-time and discrete-time signals, and the principles of processing time-varying signals in linear systems. This course emphasizes on using mathematical methods to analyze and to solve engineering problems.Specific topics of this course are: basic circuit laws and theorems, mesh and nodal analysis, superposition and source transformation; analysis of operational amplifier circuits and their biomedical applications; concept of phasor and impedance; AC analysis, introduction to transient analysis; inductors and transformers for biomedical devices; Basics of biomedical signals; continuous-time and discrete-time signals and systems; Fourier series and Fourier transform for analysis of signals and systems; convolutions/filters; sampling."
"This course provides hands-on experience in various aspects of biomedical engineering, including introduction to basic electronics, chemistry, molecular biology, microbiology, electrophysiology laboratory techniques. Students will gain exposure to biological and chemical safety and other general safety issues. Students will also receive training on laboratory skills, design of experiments, interpretation of data and technical writing. This course concludes with a student-driven design project."
"This course introduces digital prototyping techniques such as the use of a hardware description language for hardware system development, and the methods for interfacing field programmable devices to microprocessors, memory systems, and peripheral devices."
"This course introduces the various internal components of an operating system, including process and thread management, memory management, file system, security, and synchronization."
"This course introduces the basics of algorithm analysis: correctness and time complexity. Techniques for designing efficient algorithms: greedy method, divide and conquer, and dynamic programming. Fundamental graph algorithms: graph traversals, minimum spanning trees and shortest paths. Introduction to complexity theory: polynomial-time reductions and NP-completeness."
"This course introduces, analyses and evaluates the important concepts found in current programming languages. The concepts are illustrated by contrasting their appearances in different languages. Major topics include: concepts, paradigms and implementation techniques."
"This course introduces the basic concepts and techniques of artificial intelligence. Knowledge representation: predicate logic and inference, semantic networks, scripts and frames, and object-oriented representation. Searching: such as A*, hill-climbing, minimax and alpha-beta pruning. Planning: the frame problem and the STRIPS formalism, representation schemes and planning strategies. Neural networks: learning algorithms, neural architecture and applications. Natural language processing. Knowledge acquisition and expert systems: properties, techniques and tools of expert systems"
"This course describes some algorithms commonly used in contemporary bioinformatics. After a brief introduction to basic molecular biology and genetics, four main topics will be covered with corresponding lists of algorithms:1. Sequence alignment and assembly: dynamic programming for optimal sequence alignment, FASTA and BLAST for heuristic alignment of long sequences, tree-based methods for multiple sequence alignment, suffix-tree, suffix-array and Burrows-Wheeler Transform for short read alignment, and algorithms based on de Bruijn graphs for sequence assembly 2. Statistical modeling: forward, backward, Viterbi and Baum-Welch algorithms for hidden Markov models, Gibbs sampling for sequence motif discovery, and Bayesian classifiers, logistic regression and expectation-maximization for data classification and clustering3. Phylogenetics: methods based on Jukes-Cantor and Kimura models for divergence time estimation, maximum parsimony, UPGMA, Neighbor-joining and maximum likelihood methods for phylogenetic tree reconstruction.4. High-throughput data analysis: Hierarchical clustering and k-means for data clustering, and algorithms for selected problems such as signal peak calling, detection of gene fusion, haplotype phasing.Other topics such as RNA secondary structure prediction may also be covered depending on the available time."
"This course aims to provide students with the basic knowledge of optimization theory and introduce various computational libraries and programming techniques to perform optimization. Topics include unconstrained optimization methods, conjugate gradient methods, quasi-newton methods, theory of constrained optimization, linear programming, non-linear constrained optimization, etc."
"This course provides students with the analytical and programming skills required for applying standard optimization algorithms to engineering and AI problems. The syllabus covers basic topics on optimization including the theory of unconstrained and constrained optimization, dual optimization tasks, linear programming, convex optimization, line search methods, trust-region methods, gradient descent, and Newton's method."
"This course provides the basic knowledge of semiconductor physics, including electrons and holes, energy band diagram, Fermi energy, intrinsic and doped semiconductors, drift and diffusion currents. The principles of P-N junctions, bipolar and MOS transistors will be explained. The device performance measures, namely current efficiency, transit frequency and intrinsic gain, will be introduced. Other topics covered include frequency response of transistor amplifiers, filters, feedback, stability, frequency compensation, and oscillators. This course includes mandatory laboratory modules."
"The course teaches the physical principles behind semiconductor devices. It starts by reviewing the particle-wave properties of electrons and photons. The problems of electrons in a 1-D potential well and electron scattering in potential barriers are addressed. Fundamental concept and theories of semiconductor devices are introduced: hydrogen atoms, bonds, crystal structures, band theory of solids, effective mass, and the Fermi energy. Electric conductions in semiconductors are taught: intrinsic and extrinsic, drift, mobility, diffusion, recombination, Hall effect. Properties and structures of metal-semiconductor junction, p-n junction and MOS capacitor are analyzed, and their breakdown effects are described. Semiconductor transistors, including MOSFET and JFET, are briefly introduced. Integrated circuits fabrication is also described: layer formation, photolithography and layout."
"This course covers the physics, technology, and engineering applications of optical communications. The topics include overview on the development of fiber communications, optical fibers and their properties, LED and Laser sources, optical power launching and coupling, optical detectors and receivers, repeaters, regenerators, and optical amplifiers, introduction to optical communication systems, modulation and multiplexing technologies, optical networks, and nonlinear fiber optics. Recent developments in optical communication technology will also be discussed."
