"The course discusses data-intensive analytics, and automated processing of very large amount of structured and unstructured information. We focus on leveraging the MapReduce paradigm to create parallel algorithms that can be scaled up to handle massive data sets such as those collected from the World Wide Web or other Internet systems and applications. We organize the course around a list of large-scale data analytic problems in practice. The required theories and methodologies for tackling each problem will be introduced. As such, the course only expects students to have solid knowledge in probability, statistics, linear algebra and computer programming skills. Topics to be covered include: the MapReduce computational model and its system architecture and realization in practice ; Finding Frequent Item-sets and Association Rules ; Finding Similar Items in high-dimensional data ; Dimensionality Reduction techniques ; Clustering ; Recommendation systems ; Analysis of Massive Graphs and its applications on the World Wide Web ; Large-scale supervised machine learning; Processing and mining of Data Streams and their applications on large-scale network/ online-activity monitoring.Advisory: Basic hands-on operating system configuration and software installation skills covered in lab courses like IERG2602 and IERG3800 are required."
"This is a second course on computer networking protocols and systems. The introductory course, IERG 3310 Computer Networks, covers the basic principles of networks, the protocol stack, and network programming. This course covers additional topics related to the operation and management of the Internet as well as new and emerging network technologies. A major topic in this course is Internet routing and traffic engineering which studies the operational model of transit ISPs and local ISPs, and their peering agreements. The course covers new technologies and protocols including, for example, support for multimedia applications, streaming, VoIP, IPTV services, and architectures for content delivery and data center networking. The emerging issues covered in this course may include the support for mobility, convergence of different types of wired and wireless networks, and the design of next generation Internet protocols as well as the issues in the transition to these protocols."
"This course introduces the principles of wireless communication systems. Topics include digital cellular systems, physical characteristics of radio channels, fading channel, advanced digital modulation, spread spectrum and OFDM technology, diversity techniques, multiple access schemes, mobile network control and management, 4G and 5G technologies."
"Cyber Security is an important topic in modern information and communication technology. This course introduces students to major areas of Cyber Security, including introductions to cryptography, network security, computer security, and web security.Advisory: Basic knowledge on Computer Networks are suggested."
"This is a project-oriented course that teaches the development of network applications. Subject areas include object-oriented programming (C++ and Java); message-driven programming (windows); client-server systems design; interprocess communication; sockets: blocking and nonblocking I/O; multithreaded process; iterative and concurrent server designs; system-throughput bottlenecks; multimedia over network. Case studies: FTP, RPC, Web."
"Mobile devices has greatly increased the demand of Internet-based services. Large-scale online services such as Pinterest and Instagram must be designed in a way such that they can be scaled up and scaled out in a rapid and seamless manner. This course will teach students how to build scalable online services and applications. In particular, the design principles and engineering considerations for different core components, including the front-end system, the load-balancer, performance monitoring, content-delivery networking, fault-tolerant mega data store, distributed messaging services, backend big data processing/ analytics will be discussed. As a course project, the students will prototype a scalable Internet service by leveraging industrial-strength component offerings from leading infrastructure and platform service providers.Advisory note: Students are expected to have background in object oriented programming."
"The focus of this course will be on the design, implementation, and evaluation of a digital wireless communication link. Software-defined wireless communication platforms, e.g., USRP (universal software radio peripheral), will be used as a teaching tool. A two-hour laboratory period will complement the usual two-hour lecture period each week.The students will learn how to transmit, receive, analyze, and process RF wireless signals. The main topics may include: Introduction to SDR, USRP, and common programming software (GNU Radio and NI LabVIEW); Baseband QAM Modulation and Demodulation; Channel Estimation; Synchronization; Frequency Offset Estimation and Correction; OFDM Modulator and Demodulator; OFDM Synchronization, Frequency Offset Compensation, Channel Tracking, and etc.Advisory note: It is advisable for students to have had digital communications background or take digital communications course (IERG3010) at the same time as this course."
"This course aims to provide students with the hands-on experience needed for a successful career in Big Data in the information technology industry. Many of the assignments will be completed on massive publicly available data sets giving them appropriate experience with the algorithms, mainstream platforms, and software tools needed to master programming for Big Data. The students will develop a solid background in provisioning, programming and applying Big Data systems and software."
"This course introduces the principles of various building blocks of an optical fiber transmission system. The topics include the optical fiber and transmission characteristics, optical sources and transmitters, photodiodes and optical receivers, optical components such as optical couplers, filter, switches, modulators and amplifiers. Optical system design, wavelength division multiplexing, system performance evaluation, lightwave systems and network applications are also discussed."
"Cryptography is essential in many cyber security goals and many application domains. This course introduces students with a foundation of theory of cryptography and its application, including introductions to number theory, symmetric-key cryptography, public-key cryptography, and a brief overview of the research advances (with respect to the latest research trend of the time).1. Cryptography as a Scientific Discipline2. Number Theory and RSA3. The Basics of Provable Security4. Secret Sharing5. Basing Cryptography on Intractable Computations6. Pseudorandom Generators and Pseudorandom Functions7. Chosen Plaintext Attacks and Chosen Ciphertext Attacks8. Message Authentication Codes and Hash Functions9. Authenticated Encryption10. Digital Signatures11. Public-Key Encryption12. Pairing-Based Cryptography13. Special Topic, e.g., Overview of Latest Research Advances"
"Data science is a cross-disciplinary study involving informatics, machine learning, and statistics. This course adopts a problem driven approach to discuss various components in the pipeline of a data science project and the applications in various real-life examples. Topics include, but not limited to, Python programming, data pre-processing, feature selection, common machine learning algorithms and data visualization."
"The course introduces the basic underlying cryptographic concepts of blockchain as a powerful tool to support distributed ledgers in all digital transactions. The significances of trust, anonymity, and consensus mechanisms are discussed. The course further explores the applications of blockchain and smart contracts in various practical applications, including financial services, distributed systems, and specific domains such as smart city, healthcare, logistics and supply chains, etc."
"Functional Programming is an important programming paradigm based on lambda-calculus. It has been widely used by many finance and trading companies (e.g., Jane Street) as well as big IT companies (e.g., Google, Facebook). Different from the imperative programming paradigm based on Turing Machines to specify the exact operation in each step, functional programming performs computation through evaluation and composition of expressions. These differences of the underlying computation model lead to many unique features, including algebraic data types, pattern matching, high-order functions, etc., and such features may help developers solve certain computation problems more efficiently. This course will introduce the following core topics about the functional programming paradigm:1. Lambda Calculus2. Data types, such as tuples, lists, records, variants, and algebraic data types3. Pattern matching4. Function as the first-class citizen and high-order functions5. Recursive Function and Tail Recursion6. Modular programming7. Imperative programming inside functional programming8. Advanced functional data types, e.g., hash tables, trees, sequences, monads9. Typical algorithms in functional programming10. Real-world applications of functional programming"
"In this course, we will discuss kinetic energy harvesting devices and systems, from basic mechanisms to applications. The first half semester of this course will start with talking about the fundaments of kinetic energy harvesting, including mechanisms of electromagnetic, piezoelectric, triboelectric, electrostatic, and others. And then it will cover basic device designs and energy transfer; physics and circuit models; electromechanical modeling and analysis; simulation methods and practice; and interfacing circuits. The second half semester will cover the applications of kinetic energy harvesting in various situations, including power plants, wind turbine, vibrations, hydro system, ocean waves, body motions and others, and ends with discussions on kinetic energy harvesting technology in the future. The evaluation will be based on final project, midterm exam, homework, lab report, and participation in class."
"This course provides students with knowledge of solar energy and photovoltaic technologies. It covers the following topics: introduction to solar energy technologies, semiconductors for photovoltaics; working principle and performance evaluation of photovoltaic cells (PVs); photovoltaic technologies (crystalline PVs, thin film PVs, and organic and nanostructure based PVs), solar panel system design, cost aspects, and market development and environmental impact of photovoltaic industry."
"This course will introduce the basic nuclear physics - elementary quantum theory; nuclear forces; shell structure of the nucleus; alpha, beta, and gamma radioactive decays; nuclear reactions; fission and fusion. In addition, this course will discuss the nuclear power plant design - nuclear power plant layout; reactor dynamics; reactor start up and process control, waste treatment. Risk management - assessment and management of nuclear safety, radiation, exposure and environment, safety assessment will be introduced in this course."
"This course provides students with a solid background in the fundamentals of computer-integrated manufacturing technology. It covers the following topics: concurrent engineering, computer-integrated manufacturing models and concepts, rapid prototyping, computer-aided manufacturing, control of manufacturing systems (numerical control and computer numerical control), programmable logic controller, computer aided process planning and manufacturing scheduling, and quality assurance. The hands-on experiments and projects are included."
"The purpose of this course is to learn the mathematical and computational method for finite element analysis. Students will learn the computational procedure, basic elements, shape functions and the method for imposing boundary conditions. The numerical implementation for finite element analysis will also be learned. Finite element analysis software will be used in project to solve engineering applications."
"This course will cover fundamental topics in heat transfer including physical origins of three heat transfer modes and their rate equations, heat diffusion equation, boundary and initial conditions, steady-state and transient conduction, numerical methods, boundary layer equation, external and internal forced convection, free convection, and thermal radiation."
"Mechatronics is at the intersection of mechanical, electronic, control, and software engineering. This course will cover the technologies involved in developing and designing intelligent electro-mechanical systems. Specific topics include physical system modelling and analysis, measurement and manipulation principles, sensors, actuators, data acquisition and conversion, microcontrollers and interface, control system design and tuning. The course includes a significant lab component with a course project in mechatronics system design. Students will involve in hands-on programming project to reinforce the basic principles developed in lectures as well as develop control algorithm implementation skillsets."
"This course provides students with the knowledge of modern control systems analysis and design. It covers the following topics: continuous and discrete domain state space representations (including transition matrix, stability, controllability and observability, pole placement control, state estimator), emulation design, and discrete design. Case studies are also included."
"The course will introduce basic concepts of engineering optimization methods as applied to engineering problems. The theory and application of optimization techniques will be presented, including unconstrained and constrained optimization, Lagrange multiplier, necessary and sufficient conditions for optimality and dynamical programming."
"Combustion and its control are essential to our daily life and more than 80% of the energy used nowadays is from combustion sources. This course starts with the basic principles that govern combustion phenomena such as conservation of mass, the first and second laws of thermodynamics, and the momentum principle. Then students will learn the new applications of these basic principles to account for the chemical transformations. We will discuss the basic concepts of chemical kinetics and the forms of reaction rate laws that apply in combustion processes, as well as mass transport phenomena. These laws will be applied to a variety of combustion phenomena, including spontaneous ignition of combustible mixtures, pollutant formation, internal combustion engine and fire safety."
"This course describes the fundamental principles, device and system design of energy storage technologies including electrochemical energy storage (batteries, supercapacitors, fuel cells etc.), thermal energy storage (phase change), mechanical energy storage (flywheel and compressed air energy storage), hydrogen storage. The applications of energy storage technologies in supporting renewable energy sources for smart grid, hybrid and all-electric vehicles, and green building applications will be discussed."
"This course will introduce electric power system fundamentals, control, and operation. The course will discuss power system components and overview, review of basic circuit elements, AC circuit analysis and phasor representation, complex power, active and reactive power, power factor and power triangle, reactive power compensation, balanced 3-phase system analysis, Yconnection and delta-connection, transformer modelling and analysis, per-unit analysis, transient stability and analysis, voltage stability and control, frequency stability and control, power flow analysis, economic dispatching, optimal power flow problem, power plant planning, smart grid, energy storage system, renewable generation and utilization, and electric vehicle integration."
The integrated logistics management concept. Customer service. Channels of distribution. Transportation; vehicle routing and scheduling; freight consolidation. Facility location and network planning. Storage and material handling systems. Information systems for order processing and inventory tracking. Purchasing and supply scheduling. Business process re-engineering.Third-party logistics. Global logistics.
"Management of moving raw materials, in-process inventory and finished-goods; transferring information and payment. Topics include: distribution; inventory management; purchasing and supplier management; the value of information and information technology; supply chain integration and strategic partnering; product design for supply chain management."
"This course aims to equip students with an overview of the latest technologies, e.g. cloud computing, social media, mobile applications, etc. that are impacting the business world every day. It also enable students to learn how some of the latest technology solutions are applied to the business world to solve real-life problems.Students will be given ample opportunity to apply what they have learned in class through participations in facilitated class discussions and sharing, and possibly with pilot technological implementations. The SEEM department will invite participation by industry leaders and practitioners to share their insights in this course."
"In depth examination of numerical methods and their implementation for finance and risk management problems: Linear and Nonlinear Equation solutions, Unconstrained and constrained optimization, Monte Carlo Simulation, Finite difference for PDEs. Other related financial applications."
"Financial data are undoubtedly rich from stock markets and many websites and sources such as Bloomberg and Reuters. This course studies empirical research methods in financial engineering, i.e., deriving intelligence from data through data analysis and statistical inference. In particular, this course addresses important issues of a statistical nature such as: use of different financial market data models, estimation of model parameters, simplification of models, and elaboration of models. The key objective of this course is to address how the prices of stocks and other financial assets behave."
"This course covers the advanced topics in logistics and supply chain management. In particular, it uses comprehensive models to describe, and hence explore the optimal strategies in, various important logistics and supply chain management problems. The topics include customer service, channels of distribution, transportation, vehicle routing and scheduling, freight consolidation, facility location and network planning, storage. This course also introduces important practice in logistics and supply chain management, such as material handling systems, information systems for order processing and inventory tracking, purchasing and supply scheduling, business process re-engineering, third-party logistics, and global logistics."
"This course introduces the concepts of stochastic models and their applications in decision analytics. It covers the topics of Markov chains, Markov decision processes, and various approximate dynamic programing techniques."
"This course provides an overview on global medical device regulation. Regulatory affairs refer to how to get a medical product registered in different countries’ health authorities. A registered product would demand a lot of technical documentation to prove its efficacy, safety, and quality. To successfully and smoothly register a product, knowledge and skills are required to deal with various key stakeholders in governments, testing centers, hospitals, and medical doctors. The course is characterized by its unique international focus. In addition to learning Hong Kong, Chinese Mainland and Asia regulatory affairs, students would learn European and US medical device regulatory system to facilitate the medical device to be marketed around the world."
"The course is designed to provide students with an opportunity to carry out, under the supervision of an academic staff, an independent, systematic and rigorous study with research elements in engineering."
"The course is designed to provide students with an opportunity to carry out, under the supervision of an academic staff, an independent, systematic and rigorous study with research elements in engineering."
