"This course introduces the fundamentals in design, fabrication and selection of biomaterials for medical applications. Topics include physical, chemical, and biological properties of different types of biomaterials (e.g. metals, ceramics, synthetic and natural polymers, and composites etc.), physical and biological evaluations of biomaterials for clinical applications, introduction to and principles of tissue engineering, and applications of biomaterials in tissue engineering."
"This course introduces the fundamental knowledge in fluid mechanics, including nature of fluids, integral and differential equations of fluid flows, conservation of mass, momentum and energy, basic mass transfer, inviscid flow, viscous-dominated flows, navier-stokes equation, dimensional analysis, internal and external flows and reynolds number. It covers micro-fluidic devices and biological applications. It also describes fluids in human body and blood flow, including blood velocity, blood vessel geometry and respiratory mechanics."
"This course is designed to prepare electronic engineering students with the foundation knowledge for learning radio and optical communication technologies. It starts with the review of vector differential operators. The course content cover time-varying fields, Maxwell's equations, electromagnetic wave propagation, reflection and transmission, transmission line theory, Smith Chart, microwave and optical waveguides, transients on transmission lines, antenna radiation, and basic concepts of wireless and optical communications. This course includes mandatory laboratory modules."
"This course is an introduction to robotics, perception, and artificial intelligence, with concentration on robotic systems empowered with perception and intelligence for real-world applications. We start with the fundamentals of robotics and artificial intelligence. The technical topics include electronic and mechanical components of robots, sensors and robotic vision, sensor data fusion and evaluation, signal and image processing. The knowledge areas cover robotics, machine learning and artificial intelligence, robot motion and task planning, robotic programming, and human-robot interaction. It aims to help students establish a wide-spectrum understanding about the principles and the fundamental knowledge of robotics, perception and intelligence in a real-world context."
"This course introduces the principles of digital communications. Topics include source and channel models, modulation and detection, intersymbol interference and equalization coding, multipath fading, spread spectrum and synchronization."
"This course introduces various networking technologies we use each day and the fundamental ideas behind them. Different from many ""theory-based"" networking courses, this course is organized around a list of intriguing questions about the technological, social, and economical aspects of modern networks. The course will broadly cover topics on wireless networks, Internet, social networks, and network economics. We will introduce various methodologies such as graph theory, optimization theory, game theory, and pricing theory. The intended audience of this course includes undergraduates with majors in Information Engineering, Computer Science and Engineering and Electronic Engineering. It is also suitable for interested undergraduate students from Mathematics, and other Social Science majors. Advisory: Students are expected to have taken Advanced Engineering Math course covering multivariate calculus and linear algebra."
"This course starts with the topic of Markov chain. It includes the Chapman-Kolmogorov equations, random walk, classification of states, limiting probabilities, and time reversibility. The second topic in the course is stopping time and martingales. This includes Wald's equation, the concept of martingale, and the martingale stopping theorem. The third topic is exponential distribution, Poisson distribution, and Poisson process. This includes the unique memoryless property of the exponential distribution, combining and splitting a Poisson random variable, method of randomization, various equivalent definitions for a Poisson process, and M/M/1 queue. Throughout the course, many examples of applications are related to communications and computers. Advisory: Students are expected to have basic background in probability."
"Social media is one of the main sources of big data. This course aims to enable students to understand about social media and the interaction between human and information. It (1) examines the social and human dimensions of social media; (2) introduces the theories, models, and analysis techniques related to social media and human information interaction; and (3) discusses how to integrate theories and concepts in social media and human information interaction into the analytics and visualization of big data. Topics include: foundations of social media, human cognition and information behavior, online communities and social interactions, as well as infographic and big data visualization."
"Software Engineering practice such as requirement analysis and specifications, system design and integration, object-oriented designs and development, software testing and maintenance, software quality and performance metrics, documentation, CASE tools, project planning and management. Information engineering practice concerning software intellectual property rights, privacy, Internet commerce, entrepreneurship and public policies."
"OSI reference model. Overview of TCP/IP. Local area networks and wide area networks. Network layer and protocols. Transport layer and protocols. Examples of application layer protocols such as HTTP. Network security: firewall, SSL, and private and public keys encryption systems. One term project on client-server programming to create a web server and proxy."
"This course emphasizes the intersection between energy consumption and human/corporate/economic activities. The course follows a grid structure in its organisation. The grid’s horizontal lines are about energy consumption, involving electricity use, and direct burning of fuels including combustion engines, boilers, stoves, etc. The vertical lines are about human activities, involving major economic sectors including the industrial, transport, commercial, and residential ones. The intersections between the grid’s horizontal lines and vertical lines are the lecture topics. Each lecture has discussion over three aspects: (1) how energy is utilized; (2) what factors are affecting energy consumption in intensity and in total; and (3) how human behaviour could be changed for energy conservation and pollution control."
"This course introduces fundamentals of materials including atomic bonding; crystal structures, defects; mechanical properties of materials, phase diagram; overview of metals, alloys, ceramics, polymers, semiconductors and composites; electrical, optical, magnetic, and thermal properties of materials; materials selection and design considerations for engineering technologies. Applications of materials to energy and environmental engineering, mechanical engineering, medical engineering, and others will be discussed."
"This course provides students with fundamental background of manufacturing technologies. It covers the following topics: overview of manufacturing technologies, engineering materials, metal forming processes, plastic forming processes, 3D printing processes, machining processes, micro-manufacturing and fabrication. A number of industrial visits and hands-on labs are also included."
"This course provides students with fundamental knowledge of control systems. It covers the following topics: mathematical modelling and linear approximation of engineering systems, Laplace transform, transfer function and block diagram representation, characteristics of feedback systems, performance specifications, Routh-Hurwitz stability criterion, root locus design, frequency response design and Nyquist criterion. The utilization of computer-aided analysis and design software is also included."
"The course covers the basic and fundamentals to the study of robotic manipulators, including: classification of robots, robot sensors and actuators, coordinate frames and homogeneous transformations, Denavit-Hartenberg notation, forwards and inverse kinematics, Jacobians and statics, singularity and workspace analysis, and trajectory generation. The course includes a creative project component for students to apply robot manipulators for a new and innovative application. This requires the students to design a new application for robot manipulators that would be useful to the community and globally. By using the introduction to the state-of-the-art in robotics around the world, and fundamentals learnt in the course, the students have to innovatively design and present the idea as a mock start-up company project."
"This course introduces the control strategies of the heating, ventilation, and air-conditioning (HVAC) systems, including introduction to building automation, control of CAV systems, VAV systems, chilled water systems, chillers, cooling towers, design and control, control devices and BAS. This course also introduces thermal insulation, heating and cooling load calculations, ventilation and infiltration."
Non-linear programming: convex sets and functions; local and global optima; Lagrange multipliers; optimality conditions for unconstrained problems; descent methods; constrained optimization; Karush-Kuhn-Tucker conditions; solution methods. Non-differentiable optimization: integer programming models; formulations; cutting-plane methods; branch-and-bound. Dynamic programming: models and formulation; Bellman's equations; solution methods.
"Factors that drive continuous creative product innovation. Study of processes of creating, assessing and pursuing product opportunities. Evaluation of new product ideas and risk assessment of commercialization. Product development strategies in industrial marketing. Understanding the behaviour of buyer. Formulation and implementation of innovative marketing strategy and business plan."
"Principles of operating system functions. Introduction to linkers, loaders, memory management and process management. Performance analysis of scheduling algorithm. Applications based on systems such as UNIX, Cloud computing concepts and their evaluation and selection based on application needs."
"Basic elements of information systems, their concepts and interrelations. Database systems: database models, relational database, database application programming. Information retrieval: models, indexing, performance evaluation. Expert systems: knowledge and data engineering, expert system shell, application studies."
Review of basic probability. Probabilistic dynamic programming. Stochastic processes and Markov chains. Birth-and-death processes and queuing models. Stochastic inventory models: single and multiple periods. Forecasting and time series. Markov decision processes.
"Basic theory of interests, fixed income securities, the term structure of interest rates, valuation of a firm, decision making under uncertainty, mean-variance portfolio theory, capital asset pricing model, models and data, basics of forward and futures contracts, basic options theory."
"Overview of the operations functions of service organizations. Examination of methods for designing and operating service delivery systems in the health care, financial, hospitality, telecommunication, and logistics industry. Discussion on service strategy, services for individual and corporate customers, service technologies, process and facility design, management of waiting lines, demand forecasting, demand and supply management, service quality, staffing and scheduling."
"This course presents students with a broad overview of the latest technologies, e.g. cloud computing, social media, mobile applications, etc. that are impacting the business world everyday. Students are presented with case studies to illustrate how advanced technologies are used in solutions to real-world problems. Students will be presented with opportunities to adopt design thinking techniques to come up with innovative ideas for problem-solving, and optionally create pilot implementations of their design. The SEEM department will invite participation by industry leaders and practitioners to share their insights in this course."
"Logistics and Supply Chain Management involves various flows (e.g., materials flow and information flow) among all of the entities that contribute value to a product, from the source of raw materials to end customers. This course will focus on the basic concepts, models and techniques for effective strategic management of an integrated and coordinated supply chain. The emphasis is on recognizing key tradeoffs, analyzing system characteristics, and understanding effectiveness of tactics such as risk pooling, inventory policies, collaboration, and information sharing."
"This course introduces the basic concepts of decision and data analytics from a statistical and probability view. Topics include linear regression, classification, sampling techniques, model selection, decision trees, principal component analysis, clustering, and their applications in decision making."
"In view of the prevalence of the aging population and accompanying chronic illnesses, demands for medical instrumentation and design have been escalating worldwide. This course aims at enabling students to master design-thinking skills and by applying it to the broad medical fields. Laboratory sessions will be arranged to train students in developing prototypes and enrich their understanding of the fundamental design concepts covered in lectures."
"This course discusses the introduction of neuroengineering: the past, the current status and the future. The topics cover Neural system and neuron activity; Neural modeling and computation; Neural information processing, Neuromuscular systems and Electromyography (EMG); Brain-computer interface (BCI) and neuroprosthesis: functional electrical stimulation, retina and cochlea; Electric and magnetic field of human brain (EEG and MEG), transcranial magnetic stimulation (TMS); Transcranial direct-current stimulation (tDCS); biopotential electrode and amplifier; Mechanisms underlying neurological disorders (stroke, Parkinson's disease, Alzheimer's Disease or epilepsy); optogenetic technology, principles and applications of neuroimaging such as functional magnetic resonance imaging (fMRI). Selected state-of-the-art topics in a highly interdisciplinary field that combines neuroscience, electrophysiology, neural activity imaging, optics and engineering technologies. Other selected topics of recent research interests."
"In view of the prevalence of the aging population and accompanying chronic illnesses, demands for medical instrumentation and design have been escalating worldwide. This course aims at enabling students to master design-thinking skills and by applying them to the broad medical fields. Laboratory sessions and design project modules are arranged to train students in developing prototypes, enrich their understanding of the fundamental design concepts and microcontroller programme coding skills."
"The course topics include biological and cellular laboratory safety and bioethics, basic molecular cloning skills (restriction enzyme cutting, ligation, and E Coli transformation) and mammalian cell culture techniques (cell culture maintenance, observation of cell growth and proliferation, analysis of cell death, genetic modification, cell staining)"
"This course will cover high-throughput experimental methods, standard data processing pipelines, sequence alignment and mapping, foundational concepts of data analytics, data exploration and visualization, clustering and classification, dimension reduction, and their applications in personalized genomics and precision medicine. For personalized genomics, we will also cover the integration of heterogeneous sequencing and non-sequencing data, single-cell data analysis, multi-omics analysis methods, and cancer genomics. For precision medicine, we will cover protein-RNA interactions, biological graph analysis, and gentle introduction to biomedical imaging and electronic health records."
"This course introduces concepts, models, and implementations related to distributed and parallel computing. Topics include parallel and distributed programming, system architectures, synchronization, and concurrency control techniques."
"This course introduces concepts and principles of cloud computing and storage. Subjects include: cloud computing models (SaaS, PaaS, IaaS), distributed and parallel data processing (MapReduce, Hadoop, multicore technologies), virtualization technologies (hypervisor, virtual machines, full virtualization, paravirtualization), data storage (cloud storage architectures, data centers, data deduplication), security/privacy issues, and case studies of real-world cloud services (Amazon EC2, Windows Azure). This course emphasizes applied methodologies of using cloud computing and storage for solving practical engineering problems."
"This course aims to introduce fundamental concepts and technologies in computer networking. The course adopts a top-down approach introducing the TCP/IP networking stack. The design of the contemporary communication applications will be studied. The fundamental concepts in implementing the reliable transport protocols, such as TCP, will be taught in this course. Design issues of TCP, such as the sliding window protocol and the congestion control, will also be included. This course will also focus on the IP network and the routing algorithms used in the Internet. Last, the design issues in the data link layer (e.g., Ethernet), including the medium access control, will be introduced."
"This course aims to cover topics in online learning and online optimization. Typical topics include multi-armed bandit (MAB) problems in various settings, online convex optimization (OCO) problems such as online linear regression, online classification, and certain general reinforcement learning problems. Different algorithms will be introduced to solve these problems and analysis of theperformance and efficiency will be provided."
"This course covers how to use deep learning techniques to resolve real-life computational problems, handling different kinds of data. We start the course by introducing the problem-solving paradigm with deep learning: data preparation, building the model, training the model, model evaluation, and hyper-parameter searching. Then, we fill in the details in the paradigm. Regarding the deep learningmodels, we will go from the simplest linear regression model, towards the relatively complicated models. To handle various data types, that is, the structured data, images, text, sequences, signals, and graphs, in our daily life, we would cover CNN/ResNet, RNN/LSTM, Attention, and GNN models. In addition to the above paradigms, we will also cover the commonly used techniques to handle overfitting. We would briefly go through the generative models, VAE, and GAN, at the end of this course.Advisory: Students are expected to have background knowledge on python programming."
"This course provides knowledge and technical background on the current available AI and imaging technologies developed for biomedical engineering applications. The AI part focus on introducing recent cutting-edge advances in computer vision, deep learning, neural networks, robotics, and machine intelligence and their applications in clinical diagnostics, medical operations, tissue engineering, and regenerative medicine. The imaging part emphasis lies on introducing advanced biomedical imaging modalities, including QCT, pQCT, microCT for animals and human, nano-CT, multimodal MRI, ultrasound, and other advanced imaging modalities. It also covers applications of biomedical imaging in diagnosis, prevention and treatment of aging related disorders of cardiovascular, neurodegeneration and other relevant living systems. Selected topics relating to use the above AI and imaging technologies for evaluation of scaffold biomaterials, repair of musculoskeletal tissues, diagnostics and evaluation of neurodegeneration diseases and cancers, and so on will be covered."
"This course introduces and discusses medical imaging and treatment techniques which make use of sound and electromagnetic waves (e.g., ultrasound, laser, terahertz, etc.) for biomedical imaging and spectroscopy. The lectures will be divided into the following three main topics: (1) Ultrasound imaging techniques and applications: wave propagation theory (wave equation, transmission andreflection coefficients, attenuation, instrumentation and therapeutics), sonography design aspects, and medically relevant examples; (2) Optical imaging and spectroscopy basics and techniques; and (3) Laser techniques for medical treatments: photodynamic therapy, laser surgery."
"This course consists of two parts. The first half covers basic concepts in nanotechnology (e.g., length scales (less than 100 nm) effect on properties of materials and devices), and introduces techniques and tools for fabricating nanostructured and bioengineered materials: quantum dots, DNA, self-assembly and templating, surface patterning, and functionalization. The second half introduces three key applications of nanotechnology in biomedical research (i.e., diagnostics, in vivo imaging, and targeted drug delivery), and briefly discusses the process of translating laboratory discoveries to therapies applicable in clinical trials."
"BioMEMS is the application of MEMS (Microelectromechanical Systems) technology in the fields of biomedical and health sciences. Due to their small size (1 μm ~ 1 mm), BioMEMS have the advantages of low weight, low cost, quick response, high throughput, high efficiency, requiring much less sample/reagent, and easy system integration. BioMEMS has found broad applications in disease diagnosis, prevention, and treatment. Various bioMEMS products have been developed, such as microfluidic devices, neural interface devices, μTAS (micro Total Analysis Systems), Lab-on-a-Chip, DNA Chips, micro drug delivery system, microsurgical tools, biosensors. This course covers the introduction of BioMEMS, techniques used in constructing the devices, patterning biomolecules, biomedical problems that can be addressed by the BioMEMS technology, as well as the associated engineering challenges."
"This course consists of two parts. The first half covers basic concepts in biomolecular engineering, including structure and properties of biomolecules (e.g., nucleic acid, protein, lipid, and sugar), the central dogma of molecular biology, and regulation of gene expression. Building on the theoretical framework from the first half, the second half introduces experimental tools involved in biomolecular engineering research, including synthesis and characterization of DNA and protein, gene recombination, and basic genomics. Set at the advanced undergraduate level, the course focuses on developing students’ ability to analyze research data and critique the scientific literature."
"This course introduces the application of the principles of biology and engineering to the development of viable substitutes which restore, maintain, or improve the function of musculoskeletal tissues. Topics include musculoskeletal tissues: tissue engineering of tendon/ligament, cartilage and bone. It focuses on the understanding the interactions between extracellular matrices and cells, mechanobiological responses of cells/tissues. It also discusses musculoskeletal biomaterials including the development of bioactive, biomimetic advanced biological materials for replacement of aged and diseased musculoskeletal tissues."
"This course first review the fundamental knowledge about semiconductor physics and MOSFET transistors and go through various advanced silicon based devices and technologies, including NMOS, CMOS, CCD, TFT and SOI. Junction devices, namely bipolar junction transistors, tunnel diodes, heterojunction and quantum-well devices, and quantum dots, are introduced. Silicon based memory technologies, including DRAM, floating gate MOSFET, flash memory, are covered. The course also gives introduction to photonic devices, for examples, light emitting devices (LEDs), semiconductor lasers, photodetectors, and solar cells. Organic electronics, including organic light emitting diodes (OLEDs) and organic thin film transistors, and flexible electronic devices are described."
"This course focuses on applications of signal processing in different domains such as audio and speech processing, biomedical signal processing, communications, data science, to name a few. The course will first introduce advanced signal processing methods such as filter designs, spectral estimation, time-frequency analysis, statistical signal processing, adaptive signal processing, and principal component analysis. Their applications to various real-life problems will then be studied."
"This course is for electronic engineering students to lay the essential foundation for learning the design of radio frequency circuits. It provides the system perspectives of wireless communication. The course starts with the review of transmission line theory and covers basic passive and active RF circuits, including impedance matching circuits, couplers, power divider, filters, amplifiers, etc. The basic concepts of wireless system design are discussed. This course includes mandatory laboratory modules."
