"This course covers the essential concepts of physics in mechanics, heat, electricity and magnetism, waves, atoms, and nuclei. It aims to bring out the essential concepts and their relevance, using simple mathematics. Secondary school physics and calculus are not required. It is suitable for students in physical sciences, biological and medical sciences, and earth science who lack the basic physics training in secondary school, and for students in other majors who want to learn the essential concepts of physics for their later courses."
"This introductory physics course covers selected topics in mechanics, thermodynamics, electricity, and modern physics. This is a non-calculus-based course, but some algebra and trigonometry will be used. This course is designed for students with HKDSE Physics or HKDSE Combined Science with a physics component. It is suitable for students in the physical sciences, biological and medical sciences, earth science, and for those in other majors who want to learn some basic concepts of physics for their later courses. Students with HKDSE Physics, or a good preparation in HKDSE Combined Science with a physics component and HKDSE Mathematics, who want to major in Physics, may benefit more from taking PHYS1111 or PHYS1113."
"This non-calculus-based course covers some essential concepts in mechanics, heat, electricity and magnetism. It is designed for engineering students to get an overview on what physics is about. Selected topics include: Newton’s laws of motion, Archimedes’ principle, fluid flow, temperature and heat, laws of thermodynamics, electric field and potential, current and circuits, and electromagnetic waves. The course is suitable for Engineering students without HKDSE physics or Combined Science with a physics component, or with permission of instructor."
"(UGEB1506 is double-coded with PHYS1004.) The course aims at revealing the fundamental role that physics principles have been playing in the development of science and technology (S&T), which has drastically changed our ways of living and understanding of nature. Successful stories on the evolution of S&T in human history are introduced in the perspectives of STEM, i.e., from the discovery of fundamental Scientific (Physics) (S) principles, to applying the principles to Technological (T) innovations, solving Engineering (E) problems to make the applications viable, and with Mathematics (M) as the essential language that encompasses the whole process. Modern technology is also shown to change the ways of modern scientific investigation and accelerate human understanding of the physical world in an unprecedented speed. Science related social issues are used to help students understand the importance of using science principles and knowledge in making judgements and informed decisions. Lively demonstrations, lab visit, and STEM activities are used in class to (1) illustrate basic physics principles, (2) make physics principles more connected to students’ daily life applications, and (3) better prepare students for explaining science concepts and conducting basic educational STEM activities as an educator, publisher, reporter, and in other S&T related disciplines in the future. Secondary school physics are not required to take this course."
"This is an introductory calculus-based engineering physics course covering topics in mechanics and thermodynamics. Topics include: Use of vectors in mechanics, force and motion, free-body diagrams, work and energy, potential energy and conservation of energy, momentum and impulse, torque, essential ideas in rotation, equilibrium, gravitation, ideal fluids, oscillations, waves and sound, elementary concepts of thermodynamics and heat transfer mechanisms. Contents will be supplemented by discussions on applications relevant to engineering. The course is suitable for Engineering students with HKDSE physics or Combined Science with a physics component, or with permission of instructor."
"This introductory calculus-based course discusses the basic principles of mechanics, fluids and waves. The course assumes a background of HKDSE Physics or a good preparation in HKDSE Combined Science with a physics component. It is suitable for potential majors in science and engineering, and for those who intend to minor in physics. Topics include: particle kinematics, force and motion, work and kinetic energy, potential energy, momentum, systems of particles and collisions, rotation, Newton’s law of gravitation, fluid statics and the dynamics of ideal fluids, oscillations, and waves. Students are advised to take this course concurrently with an introductory mathematics course that includes vectors and calculus."
"This introductory calculus-based course discusses the basic principles of mechanics, fluids and waves. The course assumes a good background of HKDSE Physics, Mathematics and Mathematics Extended Part Module 2. It is suitable for potential majors in physics, mathematics and other physical sciences. Topics include: particle kinematics, force and motion, work and kinetic energy, potential energy, momentum, systems of particles and collisions, rotation, Newton’s law of gravitation, fluid statics and the dynamics of ideal fluids, oscillations, and waves. Students are advised to take this course concurrently with an introductory mathematics course that includes vectors and calculus."
"This introductory calculus-based course discusses the basic principles of optics, special relativity, and quantum physics and its applications, plus an introduction to particle physics. The course assumes a background of HKDSE Physics. It is suitable for potential majors in science and engineering, and for those who intend to minor in physics. Topics include: Geometric optics, interference, diffraction, special relativity, quantum physics and its applications to atoms, molecules, solids, and nuclei, particle physics. Students are advised to take this course concurrently with a course in calculus."
"This is a first course in experimental physics, with an aim to help students develop basic skills in performing experimental measurements, handling and utilizing basic equipment, as well as build necessary concepts and attitudes in data and error analysis. The experiments also serve to illustrate the principles and to reinforce the concepts taught in the lecture course PHYS1111."
"This introductory calculus-based course discusses the basic principles of thermodynamics and electromagnetism. The course assumes a background of HKDSE Physics. It is suitable for potential majors in science and engineering. Topics include: the laws of thermodynamics and the kinetic theory of gases; Coulomb’s law, electric field and potential, Gauss’ law, capacitance and dielectrics, current and resistance, DC circuits, magnetic fields, Ampere’s law, Faraday’s law, inductance, AC circuits, Maxwell’s equations and electromagnetic waves."
"This course provides an introduction to the various analytical techniques necessary for studying physics at university level. Topics include: vectors, rates of change and kinematics, methods for solving ordinary differential equations in mechanics and electric circuits, line integrals and multiple integrals in mechanics, partial differentiation and its applications in mechanics and thermodynamics, methods of vector calculus used in electromagnetism, and applications of infinite series and systems of linear equations in physics."
"This course provides students with the basic knowledge of a few numerical methods and computer programming commonly used to solve problems in physics. Topics include: basic programming skills, interpolation, numerical integration of functions, numerical solution of ordinary differential equations and wave equations. There are computational laboratories for practice, demonstration and illustration of the subject matter. This course, together with PHYS3061 and 4061, provides basic, intermediate and advanced training on this important branch of computational physics. This fundamental course assumes no prior knowledge in computing."
"The course aims at introducing basic concepts of astronomy and astrophysics, assuming only a secondary school physics and mathematics background. It is designed not only to present a volume of knowledge, but also to arouse students’ curiosity in how nature works. Topics include: the universe at different scales, the Earth and the sky, lunar phases, tides and eclipses, the rise of modern astronomy, theory of motion and gravitation, relativity, the solar system, measuring stars, birth of stars, structure of stars, post-main-sequence evolution, the death of stars, neutron stars, black holes, galaxies and cosmology. Optional activities, for examples, star-gazing trips and visits, may be arranged."
"This course provides student-centred learning experience in a small-group setting. Students are required to study physics problems on selected topics relevant to introductory physics courses, present the solutions in class, and engage in discussion with classmates and the instructor. Emphasis is put on skills in self-study, problem solving, and especially presentation and communication skills."
"This course provides student-centred learning experience in a small-group setting. Students are required to study physics problems on selected topics relevant to introductory physics courses, present the solutions in class, and engage in discussion with classmates and the instructor. Emphasis is put on skills in self-study, problem solving, and especially presentation and communication skills."
"This course aims at providing students with project learning experience in physical science. Students are required to complete a short project with a topic decided by the supervisor. The project may focus on research or literature review or experiential learning activities in science. At the end of the term, students are required to submit a written report and/or give an oral presentation."
"This course, together with PHYS1712, aims to introduce basic skills in performing experimental measurements, handling and utilizing basic equipments; and build necessary concepts and attitudes of data and error analysis. The experiments in this course also serve to illustrate the principles and reinforce the concepts taught in the lecture courses PHYS1122 and 2041. Students are advised to take PHYS1712 before taking this course."
"This course consists of several selected experiments with an aim to illustrate the principles taught in modern and quantum physics courses. Students will gain not only a deeper understanding of the principles behind the experiments, but also hands-on experience in hardware instrumentation, data acquisition, and report writing. Students are advised to take PHYS2711 before taking this course."
"The course covers the foundation of classical mechanics at the undergraduate level. Topics include: vectors, matrices and vector calculus; Newtonian mechanics of single particles; calculus of variations; Lagrangian and Hamiltonian mechanics; central force motion; dynamics of a system of particles; and moving coordinate systems."
"This course provides an exposition of the central concepts and theoretical framework of non-relativistic quantum mechanics. Topics include: origins of quantum theory, Schrödinger equation, one-dimensional problems, harmonic oscillators, central potential problems, spins, and an overview of formalism in Dirac notation."
"This course provides an exposition of applications of quantum mechanics. Topics include: approximation methods in quantum mechanics, applications of quantum mechanics to atomic, molecular, and nuclear physics. Course instructor may choose to give an introduction to a topic among: quantum information, elementary particle physics, superconductivity, and Bose-Einstein condensation."
"The course is an introduction to the physics of quantum computing and quantum communication at the undergraduate level. Topics include: qubits, quantum gates and quantum circuit model, entanglement and quantum teleportation, quantum algorithms, quantum decoherence and quantum error correction."
"This course emphasizes the understanding of the fundamental concepts and basic theories of thermodynamics, and the analytical skills needed to analyze various thermodynamic systems. In addition to a classical approach to equilibrium thermodynamics and their applications, essential concepts in statistical physics including the relationship between microstates and entropy in an isolated system, the Boltzmann distribution, density of states, Fermi-Dirac and Bose-Einstein distributions will be discussed."
"This course covers the foundation of electromagnetic theory at the undergraduate level. Topics include electrostatics and magnetostatics in vacuum and in material media; solution of boundary value problems using the separation of variables, method of image, and multipole expansion; electromagnetic induction; scalar and vector potentials; Maxwell’s equations in vacuum and in media; basic properties of electromagnetic waves and radiation. Students should have learnt the knowledge of vector calculus before taking this course. This course lays a foundation for PHYS4041 and 4450."
"This course provides a survey of various analytical techniques commonly used to solve problems in theoretical physics. The following physical problems are used as examples: heat conduction, vibrating strings and membranes, waves and electrostatics. Students are advised to take the introductory calculus-based physics courses: PHYS1111 or 1113, 1122, 2041 or their equivalents before taking this course."
"This is a project-oriented course on computer simulation, emphasizing the setting up of physical models, the development of algorithms for the models, data analysis and graphical techniques. Topics include: the cooling problem, single and many particle dynamics, chaotic dynamics, random processes, wave phenomena, and electrostatic problems. There are computational laboratories for practice, demonstration and illustration of the subject matter. Students are expected to have a solid background in the introductory calculus-based physics courses: PHYS1111, 1122, 2041 and first-year mathematics course: MATH1010, and have written working computer programs before taking this course. Students are advised to seek prior advice from the instructor before enrolment."
"This course aims to offer a quantitative introduction to the dynamics of soft matter (complex fluids, synthetic soft materials and biomaterials) and living matter (living biological systems that can self-organize, self-replicate, and adapt to the environment). Soft and living matters constitute a major part of the physical world around human beings. The large complexity, the far-from-equilibrium nature, and the rich emergent phenomena of soft and living matter present many challenges and opportunities for contemporary science across multiple disciplines. The contents of this course integrate interdisciplinary knowledge from physics, chemistry and life sciences. The course is suitable for students from physics, chemistry, life science, mechanical engineering, and biomedical engineering."
"This course provides an introduction to electronic circuits commonly used in experimental physics. It aims at providing hands-on experience on what electronic components and circuits can do. Topics include: circuit analysis, diode circuits, rectifying circuits, transistors, operational amplifiers, and logic circuits. Each topic begins with an overview of the fundamentals, followed by laboratory exercises for practice. The course ends with a short project. The course is essential for performing experimental work in senior projects and postgraduate studies. The course assumes no prior experience in electronics."
"Topics of contemporary interest will be selected both from fundamental physics (e.g., black holes, pulsars) and from physics with important applications to technology (e.g., giant magnetoresistance, blue light-emitting diodes and laser). Each will be treated qualitatively and phenomenologically. The objectives are to introduce students to the frontiers of physics, and at the same time to develop skills in heuristic understanding and explanation. Students taking this course are expected to have knowledge at the level of the introductory calculus-based physics courses: PHYS1111, 1122, 2041."
"This course aims at providing students with project learning experience in physical science. Students are required to complete a short project with a topic decided by the supervisor. The project may focus on research or literature review or experiential learning activities in science. At the end of the term, students are required to submit a written report and/or give an oral presentation."
"Students who have carried out project work or engaged in other physics learning experience related to physics or the training and application of generic skills in the physics curriculum off-campus, typically during exchange or internship programmes, may apply to register into the course. Assessment will be based on a project report and an oral presentation on the off-campus project work."
This course aims at providing students with project learning experience in experimental physics. Students taking this course are required to finish a short experimental project which illustrates modern physics and/or experimental techniques. A project report in the format of a journal article is required. Students are advised to take PHYS1712 and 2711 before taking this course.
"This course aims at providing students with the essential techniques and hands-on experience in basic instrumentation of experimental physics, and a proper perspective on how to plan for a physics experiment. A mixture of lectures, laboratory sessions and one project will cover topics and skills ranging from machine programming, computer interface, hardware instrumentation, data acquisition, error analysis, and report writing. The course will be useful to students who plan to do experimental works in postgraduate studies."
This course aims at providing students with project learning experience in theoretical or computational physics. Students are required to finish a short project or guided study in theoretical or computational physics and to present a project report.
"This is an advanced undergraduate course on classical mechanics. The course covers waves in mechanical systems, fluid mechanics, special theory of relativity, and one topic from either nonlinear mechanics or dynamics of rigid bodies."
"This course provides an extension of PHYS3021. Topics include: formalism of quantum mechanics, approximation methods, operator methods for harmonic oscillator and angular momentum, and quantum measurement problems."
"This course provides an introduction to equilibrium statistical mechanics of classical and quantum systems via the theory of ensembles. Topics include: thermodynamic potentials, review on microcanonical ensemble, canonical ensemble, open systems and grand canonical ensemble, Bose-Einstein and Fermi-Dirac statistics and their applications, properties of ideal quantum gases. Elementary thermodynamics and statistical physics of phase transformation and transport phenomena will also be discussed. Students are advised to take PHYS3031 or its equivalents before taking this course."
"This is an advanced undergraduate course on electromagnetic theory. The course aims at introducing concepts of classical electrodynamics, especially electromagnetic waves and radiation and their applications, in various situations at the undergraduate level. The concepts of energy, momentum and angular momentum of electromagnetic fields will be introduced as a basis for understanding the properties of electromagnetic waves. Optical phenomena such as reflection and refraction, absorption and dispersion of light, will be explained. The retarded potentials will be derived as a solution to Maxwell’s equations and applied to illustrate the generation of radiation by moving point charges, as well as electric and magnetic dipoles. The relation between electromagnetism and special relativity is discussed."
"This core course aims at providing students with the essential concepts of solid state physics and an understanding of the properties of matter. The properties of solids are discussed using skills and concepts acquired in the fundamental subjects in physics. The course thus also serves to illustrate how physical concepts can be applied to explain the various properties of solids. Topics include: crystal lattices and structures, wave diffraction and reciprocal lattice, lattice vibrations, thermal properties of insulators, metallic behavior and free electron gas, energy bands, semiconductor physics and devices, magnetic properties, dielectric properties, and superconductivity. This is a capstone core course (subject matter) normally taken in final year of study."
"This course provides students with the essential mathematical physics background needed for carrying out postgraduate studies in physics. Topics include complex analysis: analytic functions, Laurent series, Cauchy-Riemann conditions, Residue Theorem and its applications; ordinary differential equations: Frobenius method, singular points, hypergeometric ODE, Bessel equation and Bessel functions; partial differential equations: eigenfunction expansions and boundary-value problems; inhomogeneous ODE and PDE: Green’s function method."
"Unlike a course in computer science or programming, this course is intended to provide a solid training in the computational techniques for the analysis and modelling of physical systems. It focuses specifically on methods for solving various physics problems. Topics include: basic numerical methods, numerical methods in linear algebra, numerical methods for ordinary and partial differential equations in physics."
"This course provides an introduction to the physical principles in meteorology, weather observation and forecasting. Topics include: physics of fluids; dynamic meteorology; atmospheric thermodynamics; atmospheric physics (cloud and lightning); weather systems and phenomena; weather observation, analysis and forecasting; climate change. Trips to Hong Kong Observatory headquarters/ outstations will be arranged to acquaint students with the operation of meteorological instruments and the real-life practice of weather analysis and forecasting."
"This course provides an introduction to modern astronomy and cosmology. Topics include: star formation and pre-main sequence evolution, main sequence stars, post-main sequence evolution: red giants, white dwarfs, supernovae, neutron stars and black holes. Students should have basic knowledge in mechanics, quantum mechanics and thermal physics (PHYS3011, 3021, 3031) before taking this course. Students are advised to seek prior advice from the instructor before enrolment."
"This course covers the theories and applications of materials with a length-scale of nanometers. The selected topics focus on phenomena spanning from nano-electronics to nano-photonics. Topics include: growth and fabrication of nano-size materials, applying quantum physics to semiconducting heterostructures and quantum dots, band theory and its application to photonic and plasmonic crystals, physics and applications of nano-photonics and plasmonics, and applications of perturbation theories to nano-electronics and nano-photonics. The contents may differ from year to year, depending on available expertise."
"This course provides an overview of the basic principles and applications of various branches of modern optics physics. Topics covered include: geometrical optics, waves optics, polarization, Fourier optics, introduction to laser physics and nonlinear optics."
"This course serves as an introduction to the central ideas of the theory of general relativity. The theory of special relativity is also reviewed and its geometric formulation will be introduced. Topics in the theory of special relativity include: Lorentz transformation, relativistic kinematics and dynamics, spacetime interval. Elements of differential geometry such as metric, vectors, covariant differentiation and curvature will also be introduced. Topics in the general theory of relativity include: gravity as spacetime curvature, geodesic equation, Einstein’s equations, Schwarzschild metric, black holes, gravitational waves, and cosmological models."
"This course is an elementary introduction to nuclear and particle physics. Topics include: particle accelerators and detectors, nuclear and particle phenomenology, symmetries and conservation laws, interactions, and optional contemporary topics. Students are advised to take PHYS3021 and 3022 or their equivalents before taking this course."
Different topics illustrating important ideas of physics will be discussed at an advanced undergraduate level. The choice of topics may vary from time to time.
Different topics illustrating important ideas of physics will be discussed at an advanced undergraduate level. The choice of topics may vary from time to time.
Different topics illustrating important ideas of physics will be discussed at an advanced undergraduate level. The choice of topics may vary from time to time.
Different topics illustrating important ideas of physics will be discussed at an advanced undergraduate level. The choice of topics may vary from time to time.
"A project in experimental or theoretical physics, either in research or in reviewing the literature. The course may be taken as a one-semester project course or followed by PHYS4620 as a sequence. Students should seek prior permission of project advisor before enrolment."
