"A project in experimental or theoretical physics, either in research or in reviewing the literature. The course may be taken after PHYS4610 as a sequence to form a two-semester project. Students should seek prior permission of project advisor before enrolment."
"Students who have carried out project work or engaged in other physics learning experience related to physics or the training and application of generic skills in the physics curriculum off-campus, typically during exchange or internship programmes, may apply to register into the course. Assessment will be based on a project report and an oral presentation on the off-campus project work."
"This course aims at providing students with project learning experience in experimental physics. Student taking this course is required to finish a short experimental project, which illustrates modern physics and/or experimental technique. A project report in the format of a journal article is required."
"This course aims at providing students with project learning experience in experimental physics. Student taking this course is required to finish a short experimental project, which illustrates modern physics and/or experimental technique. A project report in the format of a journal article is required."
"This course aims at providing students with project learning experience in experimental physics. Student taking this course is required to finish a short experimental project, which illustrates modern physics and/or experimental technique. A project report in the format of a journal article is required."
"Small group discussions on topics in modern or contemporary physics. The course also trains students on their presentation and communication skills. Students are advised to take core courses on electromagnetic theory, thermal physics, and quantum mechanics or their equivalents before taking this course."
"Small group discussions on topics in modern or contemporary physics. The course also trains students on their presentation and communication skills. Students are advised to take core courses on electromagnetic theory, thermal physics, and quantum mechanics or their equivalents before taking this course."
This course aims at providing students with project learning experience in theoretical or computational physics. Students are required to finish a short project or guided study in theoretical or computational physics and to present a project report.
This course aims at providing students with project learning experience in theoretical or computational physics. Students are required to finish a short project or guided study in theoretical or computational physics and to present a project report.
"This is an introductory level course for postgraduate students on various computational techniques and concepts of artificial intelligence adopted in the field of computational physics. This course provides an opportunity for students to learn and apply the artificial intelligence related techniques learned in the lecture to various research related projects. To prepare for this course, students are expected to have taken undergraduate level computational physics (PHYS3061 or equivalent) and have grasped fundamental skills in computer programming. The course will cover random processes, linear and nonlinear regression, clustering, neural network assisted force field fitting, machine learning applications in biophysics, and other advanced artificial intelligence topics such as in-depth neural network, genetic algorithm, and/or particle swarm optimization, etc. The student is expected to conduct several related programming projects and deliver a final presentation."
"This is a graduate-level introduction to classical mechanics and special relativity for Master of Science students. The course covers: Lagrangian and Hamiltonian formulations and applications, relativity and spacetime, and relativistic mechanics. Optional topics include: nonlinear dynamics and chaos, continuum mechanics, and Hamiltonian-Jacobi theory."
"This course explores essential concepts and methods of modern quantum mechanics at the postgraduate level for Master of Science students. Topics covered include: Postulates of quantum mechanics, quantum state evolution and quantum measurements, path integral approach, and selected topics in modern applications of quantum mechanics."
"This is a graduate level introduction to thermal and statistical physics for Master of Science students. This course intends to cover laws of thermodynamics, statistical basis of thermodynamics, ensemble theory, and Fermi and Bose gases. Optional topics include interacting systems, quantum statistics, non-equilibrium dynamics, and phase transitions."
"This graduate level course covers basic principles of electromagnetism for Master of Science students. Topics include: Maxwell’s equations, conservation laws, electromagnetic waves, potential theory, and electromagnetic radiation."
"A broad survey of the materials used and the generation, transmission, modulation, detection and harvesting of light by various optoelectronic devices. Emphases are placed on the operational principles and applications of both devices and materials in communications, data processing, light emission, lasing, light control, photovoltaics and photodetection, as well as on related state-of-the-art scientific research."
"This course provides an introduction to the working principles and operation techniques of instruments commonly used in experimental physics. Topics covered include: transducers and sensors; signal conditioning, propagation and conversion; noise, signal recovery techniques, computer interface, vacuum techniques, and integrated-circuit instrumentation. This course also includes laboratory experiments for practice and illustration of the subject matter."
"Principles and operation of materials characterization techniques with electron sources atom and ion sources, X-ray diffractometry and other techniques. This course also provides experiments on microstructural analysis of materials for practice and illustration of selected subject matters."
"This course will discuss various theoretical topics of non-relativistic quantum mechanics at the graduate level. The quantum mechanics of many-body systems will also be introduced. Topics covered include: operator methods in quantum mechanics, addition of angular momenta, variational method, stationary perturbation theory, time-dependent perturbation theory, scattering theory, and introduction to the quantum theory of many-body systems."
This course is intended to provide an introduction to the theory of classical electrodynamics at the graduate level. The emphasis is on the problems of electromagnetic radiation and the covariant formulation of electrodynamics. Selected topics of current research interest will also be discussed.
"This course serves as an introduction to the quantum theory of solid state physics at the graduate level. Topics covered include: band theory of electron in a periodic potential, semiclassical theory of electron dynamics, quantum theory of lattice dynamics, electronphonon interaction, transport properties of solids, superconductivity, and selected topics of current research interest."
"The aim of this course is to provide students the basic concepts and research methods in soft matter physics. Topics covered include: Structural, thermodynamic and dynamical properties of macromolecules, gels, colloids, amphiphilic molecules, membranes and liquid crystals. Principles for some of the major experimental techniques used in soft matter research will also be discussed. Students who take this course are expected to have a good knowledge of thermodynamics and statistical mechanics."
"Principles, instrumentation, experiments and data interpretation of spectroscopy, thermal analysis, microscopy and other instrumentation. Laboratory experiments for practice and illustration of the subject matter."
This course provides an introduction to the major ideas and methods in equilibrium statistical mechanics as well as in nonequilibrium statistical physics. Topics will be selected from the statistical mechanics of magnetic systems; interacting fluids and soft matter; theory of critical phenomena and the renormalization group; stochastic dynamics and nonequilibrium processes; introduction to quantum statistical mechanics; and other topics of current interest in statistical physics.
"This course provides an introduction to the basic concepts and theoretical techniques of the quantum theory of many-body systems at zero-temperature as well as at finite temperature. Topics covered include: second quantization, Green's functions at zero-temperature, Green's functions at finite temperature, perturbation theory and Feynman diagram, equations of motion of the Green's functions, linear response theory, and applications of many-body theory in condensed matter physics."
"An introductory survey of major ideas and important results in particle physics. Topics include symmetries groups and conservation laws, relativistic quantum mechanics, perturbation theory, quantum electrodynamics, quantum chromodynamics, weak interactions, the Standard Model, gauge symmetry, spontaneous symmetry breaking, Higgs mechanism, neutrino oscillations."
"This course is intended to provide a solid training in the advanced techniques of contemporary computational physics. Topics covered include: classical Monte Carlo method and applications, algorithms in matrix operations and ODE PDE solvers, many-body system optimizations, A brief introduction to Density Functional Theory, random systems, and selected topics of current interest in computational physics."
"Concept of photons, properties and applications of nonclassical light, photo-detection of optical coherence, photon-atom interaction models, quantum theory of damping, laser theory, atom coherence effects, and an introduction to quantum communication."
Topics of contemporary interest will be selected both from fundamental physics and from physics with important applications to technology. The objective is to introduce students to the frontiers of physics. The level of presentation assumes basic understanding of undergraduate physics.
"This course provides an overview of the theory and applications of general relativity. Topics covered include: tensors, metric description of curved spaces, parallel transport and Riemannian geometry, Einstein gravitational field equations, the Schwarzschild solution and classical tests of general relativity, introduction to cosmology, cosmological models, inflation as well as some advanced topics."
"This is a graduate course which covers various topics in theoretical astrophysics in one of the following areas: (1) Plasma physics and its applications in astrophysical phenomena, (2) Astroparticle Physics. For area (1), basic concepts in plasma physics such as plasma waves, shocks, MHD instabilities and magnetic reconnection are introduced. In addition, illustrations from astrophysics such as solar flares, cosmic rays, interstellar turbulence, and protostellar disks will be discussed. For area (2), current topics in Astroparticle physics including Big Bang nucleosynthesis, content and dynamics of the Universe, Cosmic rays, Neutrino astrophysics, and Dark matter will be discussed, with emphasis on how fundamental processes at the particle level impact astrophysical and cosmological evolution. In both areas, experimental and observational studies will be discussed in parallel with basic theory."
"This course provides an introduction to the basic concepts and applications of quantum information and quantum computation. Topics covered include: key concepts of quantum mechanics, single qubit transformations, quantum circuits, quantum algorithms, quantum communication, and quantum information theory."
"This course will discuss various fundamental topics of modern atomic physics at the postgraduate level. The first part of the course focuses on atomic structures, the semi-classical theory of atom-light interactions and their application to the understanding of laser cooling and related topics. The second part is on atom-atom interactions at ultracold temperatures, including its application to evaporative cooling for reaching quantum degeneracy. An advanced topics section is also included to introduce the most recent developments in this field. Students should have undergraduate level Quantum Mechanics before taking this course."
"Biophysics investigates biological phenomena using theoretical and experimental approaches derived from physics, such as statistical mechanics, fluid mechanics, and optics. This course provides an introduction to biophysics for postgraduate students with no biology background. Students will be introduced to basic biology and physics concepts relevant to the course, followed by topics including the functions of biomolecules, dynamics of regulatory networks, physics of cellular behavior, and recent development of frontier biophysics techniques. Through this course, students will become familiar with the scope and basic approaches of biophysics research, learn how to perform computer simulations on biomolecules, and develop interest in exploring new territories of biophysics. Students should have undergraduate level thermodynamics and statistical mechanics before taking this course."
"This course provides an introduction to the physical properties of thin films as well as the preparation methods. Topics covered include: vacuum science and technology, thin film deposition techniques, growth processes and modes, characterization, epitaxy, lattice engineering, optical and electrical properties of thin films. State-of-the-art scientific research on thin film preparation and properties will also be selectively introduced."
"This course discusses the physics of semiconductors and the principles behind selected applications. The physics of the electronic band structures, electrons and holes dynamics, effects of impurities, semiconductor statistics, and lattice vibrations will be discussed, using the technologically important semiconductors such as Si, Ge, and GaAs as examples. Transport properties and optical properties of semiconductors will then be treated. The principles of some common devices based on semiconductors will be introduced. The physics of selected semiconductor heterostructures will also be discussed. Using semiconductors as the context, the students will learn and appreciate how quantum physics, statistical physics, and elementary solid state physics can be applied to understand much of semiconducting materials, which have transformed and will continue to transform technologies and the world."
"To study designated sections of textbook, reviews or literature. To make periodical reports to the supervisor."
"To study designated sections of textbook, reviews or literature. To make periodical reports to the supervisor."
"To study designated sections of textbook, reviews or literature. To make periodical reports to the supervisor."
"To investigate a special topic, or to study designated sections of textbooks, reviews or literature under the guidance of a teaching staff.The registration of the course requires a permission of the instructor."
A project in physics for M.Sc. students. The project provides a challenge for students to apply their knowledge acquired in lecture courses to carry out independent projects. A project report has to be written under the supervision of the teaching staff.
"A dissertation in physics for M.Sc. students only. The dissertation provides an opportunity for students to apply their knowledge acquired in lecture courses to carry out independent research. To prepare for this course, students are expected to have taken a Guided Study course or are taking a Guided Study course concurrently on a related topic by the same teaching staff (the supervisor). A combination of the literature review in the guided study and the application of the knowledge learned in the guided study and other lecture courses to investigate related physical problems should be performed. The student should report his/her progress to the supervisor on a regular basis. The dissertation to be written under the guidance of the supervisor is required. An oral presentation should be conducted to a dissertation committee of the supervisor and another invited teaching staff."
To carry out reading and presentation assignments for the purpose of increasing knowledge and improving research skills.
"In this course, a student is required to meet with his/her supervisor regularly who provides necessary guidance and supervision to write up a thesis and monitors the student's academic progress."
"In this course, a student is required to meet with his/her supervisor regularly who provides necessary guidance and supervision to write up a thesis and monitors the student's academic progress."
"In this course, a student is required to meet with his/her supervisor regularly who provides necessary guidance and supervision to write up a thesis and monitors the student's academic progress."
