"CHEM1070 is an introductory chemistry course for students with good background of HKDSE chemistry. It includes the study of atomic structure, bonding, periodic trends in physical properties, molecular geometry, stoichiometry, states of matter, thermodynamics, chemical equilibrium, acid/base chemistry, electrochemistry and kinetics. The course is suitable for potential majors in chemistry and other physical sciences."
"CHEM1072 is intended to introduce students to the study of chemistry by building concepts and skills related to investigating the structure and nature of matter, and its potential for change. This course is designed for science and engineering students with no or little background in chemistry. The student will learn basic characteristics of matter, atomic structure and bonding, the principles of chemical nomenclature and stoichiometry, fundamental energy concepts, equilibrium, acid and base, and a brief introduction to organic chemistry and biochemistry. This course will help students to prepare themselves for further study of the general chemistry including CHEM1070 and CHEM1280."
"This course provides an overview of organic functional groups that constitute biomolecules. Under themes of common interests and practical importance, this course will provide students with basic principles of organic chemistry to understand the formation, structures and chemical properties of biomolecules. Selected fundamental concepts in chemical bonding and stereochemistry relevant to biomolecules will be highlighted."
"The transition between high school and university presents new challenges for the students of chemistry. This course reviews the basic concepts of physical chemistry introduced in CHEM1070 and provides the foundations of three mandatory physical chemistry courses in the latter years of the chemistry curriculum. In particular, special topics in thermodynamics, atom structure, quantum chemistry, and chemical kinetics are discussed. Problem-solving skills are introduced to help bridge the gap in the upper-level physical chemistry courses for chemistry majors."
"This is primarily for students in engineering faculty requiring a one-semester introductory in general chemistry at a fundamental level. It includes the study of atomic structure, bonding, periodic trends in physical properties, molecular geometry, stoichiometry, states of matter, thermodynamics, chemical equilibrium, acid/base chemistry, electrochemistry and kinetics."
"This course consists of laboratory class, which covers basic techniques and training in experimental chemistry. Students have chances to build experimental apparatus such as polarimeter, fluorometer, and spectroscope. The basic principles of chemistry are also illustrated through experiments. A number of areas related to daily life are also covered, such as polymer, skin care products, analysis of drug content, LED lighting, water purification and analysis, heat pad, and UV test. Related photos can be found in:CHEM1870 photoshttps://gocuhk-my.sharepoint.com/:f:/g/personal/yscheung_cuhk_edu_hk/Eg-Fca-GwihOkv9hCHcBbnsBXnWVKS5b2gKOCOYqZCQF5A?e=HDTlhh"
"This course teaches primary spectroscopic techniques used commonly for structure elucidation of organic compounds. It includes: ultraviolet-visible spectrometry, infrared spectroscopy, mass spectrometry, 1H and 13C nuclear magnetic resonance spectroscopy, brief introduction of multinuclear NMR."
"This course covers acid-base chemistry, chemistry in aqueous and non-aqueous solutions, chemistry of s- and p-block elements and periodicity."
"This course covers the fundamental aspects of organic chemistry that are essential to the understanding of the more advanced topics of modern organic chemistry in the senior years. The various chemical bonds commonly encountered in organic chemistry, together with a basic understanding of their chemical reactivity, will be given. In addition, the different classes of organic functional groups will be presented, with a strong focus on their structural aspect, relative reactivity and chemical reaction mechanism."
"The main objective of this course is to let students learn literature searching and practical skills for scientific presentation. They are required to deliver talks on different topics, as prescribed by the Department, after reading. Discussions in the class will follow after each oral presentation."
"This course builds on fundamental concepts in thermodynamics. Topics covered include state equations of ideal and real gases, the first law of thermodynamics, heat, work and thermochemistry. This course also contains a discussion of the second and third laws, entropy and spontaneous reactions, Gibbs free and equilibria, phase diagrams for one and two component systems, chemical equilibria, and solutions."
"This course introduces the basic principles of quantum theory and their applications to the atomic and molecular systems of interest to chemists. Topics covered include the revision of the historical background on the failures of classics physics, wave mechanics and electronic structure of atoms, chemical bond, spectroscopy, and molecular structure."
"(UGEB2380 is double-coded with CHEM2382.)  This course aims to introduce the roles of chemistry in different stages of our life. 'Topics include: 1. basic chemical knowledge related to life science; 2. origin of life - essential elements. water, and proteins; 3. growing up - food. nutrients, and hormones; 4. medication: chemicals against diseases; 5. messing up - narcotics, some stimulant drugs, and hallucinogens ( e g heroin. ketamine, and ecstasy); 6. ageing; 7. the mystery of heredity - nucleic acids and the Double Helix."
"This course aims to provide students with some fundamental concepts in analytical chemistry. These include treatment of analytical data, chemical equilibria and quantitative analysis using titrimetric, electrochemical and chromatography methods."
"This laboratory course includes experiments in volumetric titrations, as well as electrochemical and spectrochemical methods in chemical analysis."
This laboratory course (1) covers the basic laboratory techniques for carrying out organic reactions and product isolation; (2) includes experiments that involve some basic chemical reactions such as nucleophilic substitution and electrophilic aromatic substitution. It allows students to acquire fundamental understanding of the chemical reactivity of the various organic functional groups.
This laboratory course covers the basic laboratory techniques for organic reactions and product isolation.
"This laboratory course includes experiments that illustrate the basic principles of thermodynamics and their applications. Examples of these experiments include the studies of heat of combustion, vapor pressure of a pure liquid, binary liquid-vapor phase diagram, partial molar volume, and electrochemistry. This course strengthens students’ experimental skills in calorimetric measurements, titrations, vacuum operations, distillations, density measurements, electrical measurements, electrochemical cell constructions, etc."
"This laboratory course covers the basic laboratory techniques for inorganic synthesis and product isolation, experiments for synthesizing and studying the chemical properties of the compounds of the main group elements, and the basic spectroscopic techniques for analyzing inorganic compounds."
"This laboratory course covers the basic laboratory techniques and essential laboratory safety practices for carrying out organic and inorganic chemistry experiments. The experiments provide comprehensive training for students on (1) safe handling of chemical reagents and chemical waste; (2) proper usage of laboratory apparatus and equipment; (3) basic techniques of analyzing, isolating and purifying organic and inorganic compounds from a mixture; (4) common techniques for carrying out simple organic and inorganic reactions; (5) simple experimental techniques for identifying organic and inorganic compounds; (6) recording experimental data and writing experimental report, and; (7) conduct search on scientific literature. This course allows students to acquire experiences on fundamental organic and inorganic experimental practices."
"This laboratory course covers the basic laboratory techniques and essential laboratory safety practices for carrying out inorganic chemistry experiments. The experiments provide comprehensive training for students on (1) safe handling of chemical reagents and chemical waste; (2) proper usage of laboratory apparatus and equipment; (3) basic techniques of analyzing, isolating and purifying inorganic compounds from a mixture; (4) common techniques for carrying out simple inorganic reactions; (5) simple experimental techniques for identifying inorganic compounds; (6) recording experimental data and writing experimental report, and; (7) conduct search on scientific literature. This course allows students to acquire experiences on fundamental inorganic experimental practices."
"This laboratory course covers the basic laboratory techniques and essential laboratory safety practices for carrying out organic chemistry experiments. The experiments provide comprehensive training for students on (1) safe handling of chemical reagents and chemical waste; (2) proper usage of laboratory apparatus and equipment; (3) basic techniques of analyzing, isolating and purifying organic compounds from a mixture; (4) common techniques for carrying out simple organic reactions; (5) simple experimental techniques for identifying organic compounds; (6) recording experimental data and writing experimental report, and; (7) conduct search on scientific literature. This course allows students to acquire experiences on fundamental organic experimental practices."
"This laboratory course covers the basic laboratory techniques and essential laboratory safety practices for carrying out organic and inorganic chemistry experiments. The experiments provide basic training for students on (1) safe handling of chemical reagents and chemical waste; (2) proper usage of laboratory apparatus and equipment; (3) basic techniques of analyzing, isolating and purifying organic and inorganic compounds from a mixture; (4) common techniques for carrying out simple organic and inorganic reactions, and; (5) recording experimental data and writing experimental report, This course allows students to acquire experiences on fundamental organic and inorganic experimental practices."
"This laboratory course covers the basic laboratory techniques and essential laboratory safety practices for carrying out analytical and physical chemistry experiments. The experiments provide comprehensive training for students on (1) safe handling of chemical reagents and chemical waste; (2) proper usage of laboratory apparatus and equipment; (3) basic techniques of determination of the properties of pure substances and solutions; (4) common techniques for qualitative and quantitative analysis of real samples; (5) fundamental procedures and techniques to investigate theories with experimental data and results; (6) recording, processing, and reporting experimental data and results, and; (7) conducting search on scientific literature. This course allows students to acquire experiences on fundamental analytical and physical experimental practices."
"This laboratory course covers the basic laboratory techniques and essential laboratory safety practices for carrying out physical chemistry experiments. The experiments provide comprehensive training for students on (1) safe handling of chemical reagents and chemical waste; (2) proper usage of laboratory apparatus and equipment; (3) basic techniques of determination of the properties of pure substances and solutions; (4) fundamental procedures and techniques to investigate theories with experimental data and results; (5) recording, processing, and reporting experimental data and results, (6) conducting search on scientific literature; and (7) basic techniques in using computer in chemistry. This course allows students to acquire experiences on fundamental physical experimental practices."
"This laboratory course covers the basic laboratory techniques and essential laboratory safety practices for carrying out analytical chemistry experiments. The experiments provide comprehensive training for students on (1) safe handling of chemical reagents and chemical waste; (2) proper usage of laboratory apparatus and equipment; (3) common techniques for qualitative and quantitative analysis of real samples; (4) recording, processing, and reporting experimental data and results, and; (5) conducting search on scientific literature. This course allows students to acquire experiences on fundamental analytical experimental practices."
"This laboratory course covers the basic laboratory techniques and essential laboratory safety practices for carrying out analytical and physical chemistry experiments. The experiments provide basic training for students on (1) safe handling of chemical reagents and chemical waste; (2) proper usage of laboratory apparatus and equipment; (3) basic techniques of determination of the properties of pure substances and solutions; (4) common techniques for qualitative and quantitative analysis of real samples; (5) recording, processing, and reporting experimental data and results; and (6) conducting search on scientific literature. This course allows students to acquire experiences on fundamental analytical and physical experimental practices."
"This laboratory course covers the essential laboratory techniques and laboratory safety practices for carrying out analytical and physical chemistry experiments. The experiments provide training for students on (1) safe handling of chemical reagents and chemical waste; (2) proper usage of laboratory apparatus and equipment; (3) basic techniques of determination of the properties of pure substances and solutions; (4) common techniques for qualitative and quantitative analysis of real samples; (5) recording, processing, and reporting experimental data and results, (6) conducting search on scientific literature, and (7) basic techniques in using computer in chemistry. This course allows students to acquire more experiences on fundamental analytical and physical experimental practices."
"Coordination chemistry: bonding, electronic spectra, magnetic properties, structure and isomerism, reactions, kinetics and mechanisms. Fundamentals of organometallic chemistry."
"It includes: the chemistry of alcohols, phenols, ethers, epoxides, aldehydes and ketones, enolates."
"This course covers chemistry of conjugated molecules including aromatic hydrocarbons, aromatic heterocyclces and pericyclic reactions, and provides an introduction to synthetic polymers mainly from a view of synthesis. This course emphasizes structure-reactivity relationship and application of basic principles of organic chemistry in practical problems. This course will train students with respect to the following capabilities and visions: understanding the complexities of matters at molecular level; presenting molecular structures of organic compounds correctly and clearly; understanding mechanisms of important organic reactions; defining and analyzing practical problems of environment, health and sustainable development based on chemical structures and reactions; divergent and convergent thinking in planning organic synthesis; fundamental ideas in designing and producing materials and medicines at molecular level."
"Statistical mechanics and kinetic theory of gases. Treatment of molecular speeds, Maxwell-Boltzmann distribution and simple hard-sphere collision. Theoretical foundation of the rate equation. Catalysis. Experimental kinetics and gas reactions. Fick’s laws and transport phenomena in gases/liquids."
"Introduction of molecular spectroscopy, interactions and orders of magnitudes, molecular structure and symmetry, spectroscopy of molecules."
"Materials Science is an interdisciplinary course where basic concepts in chemistry and physics are applied to understand the relationship between the properties of materials and their structures at the atomic, microscopic and macroscopic levels. This introductory course will introduce the fundamentals of materials science and useful characterization techniques for different properties of materials, from principles to instrumentation. Materials that have found important and critical applications in our lives will be highlighted."
"The course divides into two main parts, namely spectrophotometry and separation sciences. Spectrophotometry covers electromagnetic radiation; interactions between photons and matters; UV-visible atomic absorption spectrometry; UV-visible molecular absorption spectrometry; infrared molecular absorption spectrometry; atomic emission spectrometry; X-ray absorption spectrometry; and X-ray fluorescence spectrometry. Separation sciences include an introduction of the principles of chromatographic separation; gas chromatography (GC); high performance liquid chromatography (LC); mass spectrometer as a sample-selective detector for GC/LC; supercritical fluid chromatography; and capillary electrophoresis."
"General practices and rules in testing laboratory, ISO Guide 17025, Laboratory Accreditation in HK (HOKLAS), Method Validation, Measurement Uncertainty, Proficiency Testing as well as Case Study in testing laboratories.."
"This laboratory course includes experiments of various important reaction classes. Examples of these reactions are nucleophilic substitution, addition reactions, elimination reactions, epoxidation, oxidation and reduction reactions of organic compounds, reactions involve enols and carbanions, electrophilic aromatic substitution reactions, etc. These experiments allow students to acquire in-depth understanding of reactivity, selectivity and the mechanisms of the various types of important organic reactions. This course strengthens students’ skills for carrying out organic reactions, and their experience in determining the structures of organic compounds by spectroscopic methods. After completion of this course, students should be able to carry out simple organic synthesis reactions, purify the reaction products by using the appropriate techniques, and identify the structures of the reaction products by IR and NMR spectroscopy."
"Co-requisite: CHEM3230. This laboratory course comprised of experiments mainly focus on some advanced practices in organic synthesis, including advanced organic reaction techniques, multi-step organic synthesis and catalytic organic reactions. The course aims to strengthen students’ experience on carrying out more advanced and complicated practical tasks in organic chemistry, and understanding the essential principles in planning a multi-step organic synthesis route."
"This laboratory course covers laboratory and computer techniques that illustrate the basic principles of physical chemistry. The experiments provide comprehensive training for students on (1) safe handling of chemical reagents and chemical waste; (2) proper usage of laboratory apparatus and equipment commonly involved in physical chemistry; (3) basic techniques in using computer in physical chemistry; (4) fundamental procedures and techniques to investigate theories with experimental data and results; (5) recording, processing, and reporting experimental data and results, and; (6) conducting search on scientific literature. This course allows students to acquire experiences in fundamental experimental practices in physical chemistry."
"Corequisite: CHEM3340. This laboratory course covers laboratory and computer techniques that illustrate the basic principles of physical chemistry. The experiments provide comprehensive training for students on (1) safe handling of chemical reagents and chemical waste; (2) proper usage of laboratory apparatus and equipment commonly involved in physical chemistry; (3) basic techniques in using computer in physical chemistry; (4) fundamental procedures and techniques to investigate theories with experimental data and results; (5) recording, processing, and reporting experimental data and results, and; (6) conducting search on scientific literature. This course allows students to acquire experiences in fundamental experimental practices in physical chemistry."
"Laboratory work covers inorganic synthesis, modern techniques of analysis and experiments designed to illustrate the fundamental principles of coordination chemistry."
"This is a practical course in analytical chemistry which covers various instrumental techniques and training in experimental analytical chemistry. The principles of instrumental analysis are also illustrated through experiments. The topics of the experiments are in various types including for example, spectrophotometric methods including atomic absorption and emission and x-ray fluorescence, chromatographic separation methods and mass spectrometry. Students are required to prepare for the experiments by understanding and analyzing the goal of the experiment. They also need to search for knowledge and information from diverse channels such as assigned textbooks, literature, and internet resources available to them."
"This is a practical course in analytical chemistry which covers various chemical tests performed in the accredited laboratories of the society. Quality assurance of the chemical test is illustrated through experiments and it includes the use of certified reference material, calibration of equipment and the use of spiked sample during measurements. Students are required to prepare for the experiments by understanding and analyzing the goals of the experiment. They also need to search for knowledge and information from diverse channels such as assigned textbooks, literature, and internet resources available to them. Co-requisite: CHEM3420"
"Course to be followed by CHEM4020 in the second term.This final year project will be of problem-based type in the area of analytical chemistry. Students will be, either individually or divided into small groups, to carry out hands-on experiments on projects prescribed, and to solve problems encountered during the process. At the end of the project, each group is required to give an oral presentation and to submit a written report on the project."
"This final year project will be of problem-based type in the area of analytical chemistry. Students will be, either individually or divided into small groups, to carry out hands-on experiments on projects prescribed, and to solve problems encountered during the process. At the end of the project, each group is required to give an oral presentation and to submit a written report on the project. Pre-requisite: CHEM4010."
"Course to be followed by CHEM4040 in the second term.This final year project will be of problem-based type. Students will be divided into groups to carry out hands-on experiments on projects prescribed, and to solve problems encountered during the process. At the end of the project, each group is required to give an oral presentation and to submit a written report on the outcomes obtained."
"Pre-requisite: CHEM4030This final year project will be of problem-based type. Students will be divided into groups to carry out hands-on experiments on projects prescribed, and to solve problems encountered during the process. At the end of the project, each group is required to give an oral presentation and to submit a written report on the outcomes obtained."
"This course aims to provide students a deeper understanding of modern inorganic chemistry. The concept of molecular symmetry as well as the elements and applications of group theory will be introduced. Two or more of the following topics will also be covered: metal clusters, advanced main group chemistry, inorganic catalysis, bioinorganic chemistry, and inorganic materials."
"This course will introduce bioorganic chemistry and chemical biology to senior undergraduate students who have learned basic organic chemistry courses. The course has two modules. First module is bioorganic chemistry: chemical structures, reactions, synthesis, and functions of biomolecules. The lecturer will first introduce four types of biomolecules, namely peptides and proteins, lipids, carbohydrates, and nucleic acids to chemistry students, with a focus on their molecular structures, higher-order structures and organizations, and the organic reactions to synthesize or to transform these molecules in a synthetic laboratory or inside cells. Enzymes, a special group of proteins will also be introduced to the audience, together with cofactors and coenzymes as one example of proteins possessing catalytic power. The second module of the course will focus on chemical biology, including current technologies developed and selected research projects in this field. Through this course, students will be able to apply their basic organic chemistry knowledge to complicated biological molecules, and deepen their understanding on molecules in life, from an organic chemist's point of view. This course will be distinct from an introductory biochemistry course by focusing on the organic chemistry aspects of the molecules in life, i.e. molecular structures, higher-order structures, functional groups, transformations, reactions and syntheses."
