"Biofuel, namely fuel produced through chemical engineering processes of biomass, represents a major alternative and sustainable source of energy. The course covers review of organic chemistry and physical chemistry; structures and combustion energy of fuel molecules; related biochemistry and enzymology; biochemical conversion processes; ethanol production from carbohydrate-based biomass; biodiesel production from lipid-based biomass; hydrogen and methane production from organic and waste products; fermentation and alkane production; chemical engineering processes of biofuel production; biofuel economics, policies, and research and development; field trip to bioenergy farm. A guest lecture from a practitioner on biofuel production industry is scheduled. Students are required to run experiments for a project and to design their own solutions to solve problems met in biofuel industry."
Brief overview of statistical mechanics and quantum chemistry and their connections to modern computational chemistry simulations. Hands-on exercises on these theoretical topics will be given.
"Minimization of materials to the nanometer scale imposes new properties and functions on nanomaterials. This course will introduce the underlying principles and applications of the emerging field of Nanoscience and Nanotechnology. Tools and principles relevant at the nanoscale dimension will be introduced. Current and future nanotechnology applications will be discussed in chemistry, physics, biology, engineering, materials, electronics, and energy."
This course presents important advanced analytical methods and instrument in chemistry. The topics covered include: advanced error analysis; digital electronics; spectroscopic techniques for surfaces; Raman spectroscopy; Fourier transform; centrifugation; capillary electrophoresis; thermal methods; electrochemical analysis; labeling methods; microchip/microarray techniques; flow injection analysis; particle sizing techniques.
"This course aims to provide students with a solid understanding of the approaches to solving both episodic and routine issues in our food and environment using chemical analyses. Students will learn the basic principles of analysis, including sampling, sample treatment, analyte identification and assay. Through various detailed examples, students will learn the classical and instrumental methods used in food and environmental analyses and, more importantly, the rationale for method selection. Related local and international regulations and protocols will also be discussed."
"This course aims to provide students with hands-on experience in the operation of accredited laboratory including aspects of test accreditation, measurement traceability, quality assurance, documentation, and ISO standards."
This course covers an internship in the chemistry field for each student. The internship provides training for students on (1) application of chemical knowledge in actual working environment and serving the community; (2) skills for scientific and technical communication; (3) interpersonal and teamwork skills in a company setting. This course allows students to gain out-of-class experiences for the development of their future career.
Research-oriented experimental work or non-experimental data collecting undertakings dealing with special chemical problems. Written approval from department to take the course is required.
Research-oriented experimental work or non-experimental data collecting undertakings dealing with special chemical problems. Written approval from department to take the course is required.
Modern organic synthesis requires the construction of molecules in an enantiopure form (asymmetric synthesis) because the (+)- and the (-)-enantiomer display different pharmacological response. This advanced organic chemistry course focuses on protocols for diastereoselective and enantioselective carbon-carbon formation. Contemporary organocatalytic reactions involving carbon-carbon formation and carbon-heteroatom formation are also covered. Examples on the syntheses of chiral drug molecules are illustrated.
"This course introduces chemical methodologies used in modern pharmaceutical research. Particular emphasis will also be paid to the molecular basis of drug actions. Some fundamental concepts in biology, biochemistry, operational research, statistics and computer modeling will also be briefly mentioned."
"This course is designed to train senior undergraduate students to do practical quantum chemistry calculations. An overview will be provided about the basic principles, with emphasis on the basic concepts, rather than the mathematical details. Practical problems are covered, so that a student learns how to solve chemical problems by computation.Theoretical Overview: Many electron problems, the Slater determinants, the calculation of one-centre and two-centre integrals, Hartree-Fock method, Linear combination of atomic orbitals, the variation principle. Post-Hartree-Fock treatment and Density Functional Theory. Practical consideration: choice of basis sets; typical xc-functional for DFT. Practical problems: geometry optimization, potential energy surface, optimization of transition states, calculation of harmonic frequencies, energetics."
Special topics having significant impacts on the advancement of modern chemistry in the lecturer's field of expertise will be covered.
"This course aims to provide students with the fundamental concepts and applications of mass spectrometry. It consists of several core modules including desorption/ionization techniques, ion activation methods, mass analysers and ion detectors. The use of mass spectrometry methods for structural elucidation of small organic molecules. Theory of unimolecular decomposition and simple mass spectral interpretation will be taught. Biological applications of mass spectrometry, including genomic, proteomic and glycomic applications, will also be taught."
"This course reviews analytical methods to solve biological problems. It serves as a primer to the expanding field of bioanalysis. The topics covered by this course include: purification and separation, spectroscopic methods; electrophoresis; mass spectroscopy; chromatography; NMR; analysis of nucleic acids; protein sequencing; immunoanalysis, single molecule technique; single cell analysis; etc."
"Industrial chemistry plays a vital role as an applied science in diverse areas that influence human society, ranging from economic, environmental to political stability. This course explores the relationship between industrial activities and their importance to our society. Students will learn important chemical processes used in industry, ranging from the large-scale production of bulk chemical commodities, industrial gases, fertilizers, petrochemicals and polymers. The course will also examine the emerging environmental issues related to the expanding industrial activity and discuss the future industries based on insights from environmental chemistry."
"This course provides an introduction to the basic metals commonly used in industry and the chemistry and application engineering of protective coatings to these substrates. Both electro and chemical metallic deposition, are discussed besides anodizing. Organic coating and sacrificial protection are also discussed in the course. Apart from principles and chemical theories, there are discussions and examples of industrial production processes and quality control specifications for protective coatings."
"Forensic sciences form a vital part of modern judiciary system. Chemical examinations have been used extensively in the search for crucial evidence at scenes of crime, exhibits identification and comparison, which in turn provide valuable and scientifically-based information for the court to form its judgement. This course will show students how to apply their acquired chemical knowledge in the retrieval of crucial evidence and exhibit examinations to generate information of evidential value to assist law enforcement agencies to find out the truth of cases encountered."
"This course serves as a research/capstone course for non-major students. Enrolled students will carry out research activities on topics in chemical science under the supervision of an academic staff. At the end of the academic year, the results of research will be presented in the form of an oral examination as well as written report."
"This course serves as a research/capstone course for non-major students. Enrolled students will carry out research activities on topics in chemical science under the supervision of an academic staff. At the end of the academic year, the results of research will be presented in the form of an oral examination as well as written report."
"With approval from the Department, undergraduate will undertake research activities on a special topic and submit a thesis in the final year under the supervision of an academic staff."
"With approval from the Department, undergraduate will undertake research activities on a special topic and submit a thesis in the final year under the supervision of an academic staff."
"Colloids are of increasing importance in both industry and academics. Not only do many commercial products involve colloids, but research in modern chemistry, biology, material science, and physics often require knowledge of the colloidal domain. This course will give the student an introduction to the physico-chemical principles governing surface phenomena and the properties of colloidal materials. We will explore the interactions and self-organization on the nanometer and micron scale with great relevance for material engineering as well as biological processes."
"Minimization of materials to the nanometer scale imposes new properties and functions on nanomaterials. This course will introduce the underlying principles and applications of the emerging field of Nanoscience and Nanotechnology. Tools and principles relevant at the nanoscale dimension will be introduced. Current and future nanotechnology applications will be discussed in chemistry, physics, biology, engineering, materials, electronics, and energy. Through guided literature review and interactive guest lectures, the very recent research progress and prospective applications of nanomaterials and nanotechnology will be demonstrated to deepen postgraduate students’ understanding to current status and challenges of nanoscience."
This course aims to provide a comprehensive understanding of the requirements of the International Standard for laboratory accreditation based on ISO/IEC 17025. It also focuses on applying internal auditing skills of testing laboratory with an elaboration on relevant technical issues required for monitoring performance of work and the follow-up tools. Emphasis is also given to the practices and applications of laboratory management system to improve the reliability and productivity of laboratories.
"This course aims to provide fundamental knowledge on various statistical tools available for treatment of analytical data. This includes an introduction to probability and counting, distributions, descriptive statistics, estimation, mean and variance, comparing two means and two variances, simple linear regression, correlation and analysis of variance and principal component analysis. Particular emphasis is also given to the estimation of measurement uncertainty based on the ISO/IEC Guide 98-3 and EURACHEM/CITAC GUIDE under different testing conditions. Finally, Monte Carlo calculations will be introduced for uncertainty evaluation."
This course aims to provide training and guidance on the method validation and quality techniques used in the laboratory to obtain reliable results. It includes evaluation of detection and quantitation limits; assessment of the range and linearity of calibration curve; traceability and the use of certified reference standards. Emphasis is given to the quality control of the analytical process and performance checks of analytical instruments.
This course deals in detail the management and technical principles required to observe to member states required of OECD.
"This course provides a comprehensive coverage of qualitative and quantitative analytical methods of materials derived from different industries. Topics include basic materials science and analytic techniques for testing different construction and building materials such as cement, aggregates, concrete, and reinforcement bar. This course will also discuss the basic principle, factors affecting corrosion of metallic materials, such as steels and other alloys, their corrosion testing and failure investigation, as well as characterization techniques for measuring physical and chemical properties of polymeric materials."
"This course provides comprehensive coverage on food safety, food regulations and analytical approaches to dealing with nutrients, additives such as colouring matter and preservatives, contaminants such as toxic metals, trace residues of pesticides and veterinary drugs, and food deterioration. The quality assurance and accreditation requirements for food analysis will be discussed in detail."
"Forensic sciences form a vital part of a modern judiciary system. Chemical examinations have been used extensively in exhibit identification and comparison, which in turn provide valuable information for the court to form its judgement. This course will introduce analytical methods commonly used by forensic scientists and show students how to apply their chemical knowledge in exhibit examinations to generate information of evidential value to assist law enforcement agencies to find out the truth of cases encountered."
"This course aims to provide coverage of environmental pollutants and the analytical methodologies for use in environmental protection which includes environmental monitoring, incident investigation, preventive measures and regulatory compliance. The course will also discuss the quality assurance and requirements for accreditation of relevant analytical methods."
"The course will cover the fundamentals of spectroscopy and various analytical spectroscopic techniques for use in common testing laboratories. These spectroscopic techniques include flame and electrothermal atomic absorption spectrometry, plasma atomic emission spectrometry, inductively coupled plasma mass spectrometry and X-ray fluorescence spectrometry. Selected applications of analytical atomic spectrometry will be discussed in details."
"This course intends to provide an in-depth knowledge on the advanced chromatographic and mass spectrometric methods for characterization of different materials, including synthetic (such as drugs and polymers) and naturally available molecules (such as proteins and DNAs). This course starts with a review of the principles and instrumentation of standalone chromatography and mass spectrometry methods. This is followed by the principles and applications of various tandem and hyphenated techniques involving either or both chromatography and mass spectrometry."
"With approval from the Department, postgraduate will undertake research activities on a special topic and submit a thesis under the supervision of an academic staff."
"This optional course aims to provide an opportunity for student to undertake a research project relevant to the accreditation chemistry, such as development and validation of a test, verification of reference materials and performance checks and calibration of measuring devices; and/or experimental evaluation of measurement uncertainty. The research work will be conducted on one weekday and Saturdays of the term time. Students with free time on Saturdays are encouraged to take this course and to acquire practical experience."
"This course aims to provide a comprehensive knowledge of risk management in chemical testing laboratories regarding environmental protection, food safety, occupational health and safety. Topics encompass relevant local regulations and international standards for risk management in environmental protection, food safety, hazard analysis and critical control points (HACCP) principles, occupational health and safety. International management systems, namely ISO 17025, ISO 14001, ISO 45001 and ISO2200 standards are discussed."
"Traceability and comparability of chemical measurements are fundamental to harmonization of international measurement standards and mutual recognition of measurement results, which serves as a basis for global agreements related to international trade, commerce and regulatory issues. This course provides an in-depth discussion on the international metrology framework, the significance of traceability and comparability of chemical measurements in seeking accreditation of test methods, the selection and use of inter-laboratory comparisons and certified reference materials in test method validation, and the use of international standards in calibration and performance verification of analytical instruments."
"This course aims to provide students with necessary knowledge of chemical testing of consumer products to national or international standards as well as the import requirements of major economies of the world. The most common types of consumer products such as toys and children products, textiles and garments, cosmetics, food containers, etc. will be covered. Practical consideration when conducting method validation and setting quality assurance plan for the testing will also be discussed."
"This course provides a comprehensive coverage of qualitative and quantitative analytical methods of materials derived from different industries. Topics include basic science and analytic techniques for testing different construction and building materials such as cement, concrete, pulverized fuel ash, aggregate, ground granulated blast furnace slag, soil, admixture, water and reinforcement bar."
"This course will cover the testing principles and methodologies of pharmaceutical testing and analysis, and their applications in quality control, regulatory compliance and incident investigations pertaining to raw materials and finished pharmaceutical products. The quality assurance of and the accreditation requirements for relevant analytical methods will also be discussed."
"The course aims to provide an overview of drinking treatment processes and technologies together with associated chemistry, application of sampling and analytical methodologies for process and water quality control, scope and significance of different testing regimes and investigation of water quality issues. The course will also discuss quality assurance and the requirement for accreditation of relevant testing methods."
"This course provides a comprehensive coverage of analytical methods used for characterization of surface finishing and coatings on different substrate materials used in various types of industrial and commercial products. Topics include basic science and analytic techniques for various type of surface finishing technology, such as electroplating, vacuum deposition, anodizing and coatings, etc."
"An overview of bioinorganic chemistry. Principles of coordination chemistry related to bioinorganic research. Biomolecules: proteins, nucleic acids and other metal-binding biomolecules. Transition-metal storage and transport. Metalloproteins. Electron-transfer proteins. Dioxygen transport and oxygen-atom-transfer reactions. The bioinorganic chemistry of Photosynthesis and Respiration. Hydrolytic reactions by metalloenzymes."
"This course consists of introduction, metallocene and non-metallocene complexes of f-elements and their applications in homogeneous catalysis. It will focus on the synthesis, structure, and reactivity of organo-f-element compounds. Similarities and differences between d- and f-block organometallic chemistry will be discussed."
"Catalysis is a cutting-edge science and plays a central role in modern organic synthesis. Enjoying the modification of the ligand, the activity of the transition metal complex can be manipulated to fit specific catalysis. This course will give students an in-depth understanding of catalyst structures via organometallic and organic chemistry approaches, and how those catalysts (d-block transition metal complexes) can be applied in sustainable and complex chemical synthesis. The industrial applications of some tailor-made catalysts will also be discussed. In this course, student presentation of current frontier catalysis is required."
"The aim of this course is to provide students with comprehensive knowledge of synthetic methods in organic chemistry and deeper understanding of factors that control reactions and product formations. Details in retrosynthetic analysis, modern synthetic tools, named organic reactions and natural product synthesis will be discussed. Specific topics including oxidation, reduction, olefination, protecting groups, functional groups interconversion, carbonyl chemistry, cycloaddition, rearrangement and organometallic reagents will be covered."
"This course provides an overview of fundamental concepts and essential applications of supramolecular chemistry. This course covers two parts. The first part focuses on the fundamental concepts, including a brief history of supramolecular chemistry, characterization of supramolecular systems, noncovalent interactions and ion binding, templated synthesis and self-assembly as well as inclusion complexes. The second part focuses on the application of supramolecular chemistry, discussing selected supramolecular systems and introducing important examples of applying supramolecular chemistry in materials sciences and biology."
Talks given by invited speakers covering recent progress in chemical sciences.
"This course offers postgraduate students who are interested in the research at the interface between chemistry and biology in-depth knowledge about chemical biology. The course has three modules. Module 1 covers the chemical structures, reactions, synthesis, and functions of biomolecules. The lecturer will first introduce four types of biomolecules, namely peptides and proteins, lipids, carbohydrates, and nucleic acids to chemistry students, with a focus on their molecular structures, higher-order structures and organizations, and the organic reactions to synthesize or to transform these molecules in a synthetic laboratory or inside cells. The course will also focus on the functions that the structures and reactivities of the biomolecules encode. Enzymes, a special group of proteins will also be introduced to the audience, together with cofactors and coenzymes as one example of proteins possessing catalytic power. Module 2 will include current technologies developed in chemical biology, and selected research projects in this field, including literature review and guest lectures based on the knowledge delivered in the first two parts. Module 3 will be guest lectures in chemical biology. Through this course, students will be able to apply their chemistry knowledge to complicated biological molecules, to comprehend chemical biology research, and to identify/solve chemical biology problems."
"This course aims to provide students with the fundamental concepts and applications of mass spectrometry. It consists of several core modules including desorption/ionization techniques, ion activation methods, mass analysers and ion detectors. The use of mass spectrometry methods for structural elucidation of small organic molecules. Theory of unimolecular decomposition and simple mass spectral interpretation will be taught. Biological applications of mass spectrometry, including genomic, proteomic and glycomic applications, will also be taught. Through the guided literature reviews and presentations, postgraduate students will have a better understanding on the extended applications of mass spectrometry, including protein conformation analysis and mass spectrometry imaging."
"This course reviews analytical methods to solve biological problems. It serves as a primer to the expanding field of bioanalysis. The topics covered by this course include: purification and separation, spectroscopic methods; eletrophoresis; mass spectroscopy; chromatography; NMR; analysis of nucleic acids; nucleic acid and protein sequencing; immunoanalysis, single molecule techniques; single cell analysis; biochips; etc."
"Electrochemistry is playing a more and more important role in the application of renewable energy. This course will cover the theory and practice of a broad spectrum in electrochemistry especially inelectrochemical energy storage and conversion systems. It will provide a brief introduction to the basic chemistry and physics concepts in electrochemistry. The further application in electrocatalysis,batteries, fuel cells, super capacitors and electrochemical synthesis will also be introduced."
This course describtes the new developments of chemical research.
Review of statistical mechanics and quantum mechanics and their applications in modern computational chemistry simulations and brief overview of computational quantum chemistry. Some of the state-of-the-art methods will be covered.
Research students in their first year of attendance are required to attend Graduate Seminars given by seniors.
Students are required to give oral presentations based on their chosen field of research under the guidance of immediate supervisors. Attendance to presentations of other students is also required to ensure them in acquiring knowledge of wider spectrum. Students are expected to answer questions raised by audience.
"Literature survey on the recent development and current status of selected topics in Physical and Analytical Chemistry, which will focus on case studies."
