"(UGEC1016 is double-coded with ARCH1320.) The course provides a general outline to architecture. The aim is to introduce architecture as a cultural phenomenon. The course will increase the student's awareness of the built environment as it exists all around. It examines a variety of spatial experiences encountered in exemplary places and buildings. The scope of the course is not limited to buildings alone, but includes cities and landscapes as extensions of architecture. The course introduces a range of topics, including the historical, symbolic, aesthetic, functional, cultural and green aspects of architecture."
"This course provides a framework of the history of England for nearly two thousand years. It is hoped that through this course students will be able to broaden their knowledge of some key aspects of the history of England integrated into SDGs themes.Students, thus, will be more connected to the modern world by understanding the past since some important ideas and inventions are legacies from England. Students will discuss from different perspectives of 'England' in this course, such as political development, intellectual ideology, cultural influences and transformation of society in modern Britain. For example, the concept of 'democracy' is based on the constitution movement and it still affects the modern world (#16 Peace, Justice and Strong Institutions)The industrial revolution and the changing the modern consumption. (#8 Decent Work and Economic Growth #9 Industry, Innovation and Infrastructure). Women's suffrage in the United Kingdom was a pioneer women movements (#5 Gender Equality)It is hard to understand the shaping of modern world without knowing the role of England in the WWII.Finally, the discussion of the role of Britain in colonial Hong Kong also provides an opportunity for students to understand the legacy of Britain in Hong Kong today. Students should be able to review the following SDGs themes, including #5 Gender Equality #8 Decent Work and Economic Growth #9 Industry, Innovation and Infrastructure #16 Peace, Justice and Strong Institutions after this course, which fulfills the SDGs goals."
"(UGEC1120 is double-coded with GRMD1301.) Since the establishment of the Special Administrative Region in 1997 under “One Country Two Systems”, the synergy between Hong Kong, Macao and the PRD has been renewed. With the recent Central Government's initiative of the development of Guangdong-Hong Kong-Macao Greater Bay Area, there will be closer and mutually beneficial co-operation among cities in this economic region. This will reshape the socio-economic relations and the urban landscapes of the three places. Studying the changing relations of Hong Kong, Macao and the PRD will not only help students understand the dynamic socio-economic development of the Greater Bay Area as a rapidly growing mega-city region in the world, but also capture the latest transformation of the region. A wide variety of teaching and learning activities, including lectures, forums and video watching will be conducted to present a lively and comprehensive picture of the Greater Bay Area to students."
"(UGEC1209 is double-coded with GDRS1001.)  This course aims to develop students’ ability to analyze the everyday life through the lens of gender. Drawing on the interdisciplinary nature of Women’s and Gender Studies, the course will guide students to examine how gender works as one of the primary social organizing principles in the movies we watch, the housework we do, the behaviors we express and many other daily activities that have been routinized. The first three lectures will equip students with a critical gender lens by questioning biology and getting familiar with theories of gender role, socialization, gender schema, doing gender and queer theory. All concepts to be explored in class will be explained with reference to research. At the end of the course, students will come to understand how political their personal life is. In particular, the course hopes to inspire students to take part in creating social change for gender equality, which is in line with the United Nations Sustainable Development Goals."
(UGEC1232 is double-coded with JASP1100.) The main objective of this course is to give students a general idea of Japanese cultural history and social background of modern Japan. Guidance leading to a better understanding of Japan will be provided.
"(UGEC1271 is double-coded with JASP1160.)  This course examines the development and academic significance of various forms of Japanese popular culture such as films, comics, music, TV dramas and culinary culture, from multidisciplinary perspectives, including history, cultural anthropology, cultural studies and media studies. It aims to deepen understanding the following three facets of Japanese popular culture:1) the applicaton of cultural globalization theory in Japan; 2) the global strategy of Japanese cultural industries; and 3) social and intellectual transformation of contemporary Japanese society. Using concrete examples and grounding on representative academic writings, this course discusses the globalization of Japanese popular culture and relevant issues in indigenization, glocalization, hybridization, transnational cultural flows and media-mix. Students are trained to understand the nature and cultural implications of Japanese popular culture in an Asian context. Besides lectures, discussions and readings, this course selectively utilizes topical essays (projects), e-learning, audio-visual materials and fieldwork-based assignments as supplementary teaching tools."
"(UGEC1281 is double-coded with JASP1120.) This course explores the relationship between Japanese language and culture. Everyday communication strategies adopted by people in Japanese society will be examined in terms of Japanese language expressions, styles and structures. Linguistic approaches will be the principal analytical tools employed in this course but interdisciplinary approaches will also be adopted. This course is designed for students who are interested in knowing more about Japan but who have very limited or no knowledge of the Japanese language. Student will gain an understanding of the basic structure of the Japanese language, learn how usage of the language reflects Japanese culture and behavior, and explore how communication patterns of Japanese speakers differ from speakers of other languages."
"(UGEC1302 is double-coded with JASP1140.) Film is always regarded as an important medium for understanding society and culture. This course looks into the formation and characteristics of Japanese mentality and behaviour, through Japanese movies and academic readings of Japanese studies. This course consists of two major parts: 1) Lesson 2 to Lesson 7: Japanese Self-Image as Revealed in Japanese Movies; 2) Lesson 8 to Lesson 12: Comparison of the Thinking Patterns of Japan and Others. This course emphasizes interdisciplinary research and study methods, including film criticism, history and cultural studies. The lecturer will commence each lesson by referring to various academic readings, and will show movie clips if necessary, to serve as the basis for in-class discussions."
"(UGEC1511 is double-coded with ECON1010.)   This is an introduction to the nature of the economic problem and how society and man deal with the economic problem. It will cover resource allocation and the concept of economic efficiency, product and factor markets, macroeconomic indicators and the nature of macroeconomic problems, and macroeconomic policy. Economic concepts and theories will be applied to various social and economic issues such as marriage, crime and government policies."
"(UGEC1512 is double-coded with GPAD1020.)  Introduction to the nature of political inquiry, the basic concepts in political science and the main features of the major types of political systems. Some emphasis is placed on the institutional aspects of government and administration, with concrete examples."
"(UGEC1522 is double-coded with GPAD1030.)  This course introduces contemporary study and practice of public administration, and the characteristics and roles of public bureaucracy in various types of administrative systems. Students will also learn to analyze some issues such as codes of conduct for civil servants, budgetary politics and redress of administrative grievances."
"(UGEC1540 is double-coded with GPAD1070.)  This is an introductory course that surveys key issues in Chinese politics, including the historical background of the system, the roles of the party/state, the style of leadership, the forms of popular participation, and the distinctive features of Chinese politics. The focus of this course is political change. Classic essays by Sun Yatsen, Lu Xun, Mao Zedong and others provide students with grounding in the key problems modern China has faced, as well as the solutions it has pioneered. From that foundation, we will move on to contemporary institutions and intellectual debates over inequality, human rights, and the future shape of political reform in China."
"This course is designed to introduce students to contemporary Korean popular culture, and more specifically the 21st century South Korean cultural phenomenon called Hallyu (Korean wave) – its promises and limitations as well as its popularity and backlash against it. By taking an interdisciplinary approach to the topic, we will study food, film, television, music, fashion and sports and ask how they participate in the transnational production, distribution and circulation of culture, identity, modernity, tradition, ideology and politics both regionally and globally. One of the major questions this course will explore is the curious ways in which these popular media continuously re-stage and re-define Korea’s historical past in order to comment on its present. This course also targets to equip students with analytical tools to critically think about popular culture as well as understand theories of cultural globalization."
"This course aims to introduce students to an array of global issues by using popular movies as major teaching instruments. In class, students will learn basic theories of globalization, development of global history since 1945, the contemporary structure of global order, and challenges/opportunities in the realm of global security (e.g. terrorism), global economy (e.g. free trade and inequality), global politics (e.g. global governance). The selected movie texts in this course would serve two purposes: learning tools and learning objects. On the one hand, students will analyze the features and real-life impacts of global issues depicted from these movies. On the other hand, they will also be trained to exercise critical thoughts towards the narratives conveyed from these movies. This course is suitable for students who have no prior knowledge in International Relations or Global Studies."
"The Democratic People's Republic of Korea (DPRK), also known as North Korea, remains as one of the most isolated and the only few nations in our world still upholding socialist ideology. For the last decades, although North Korea is a frequent issue that is widely reported in the headlines of our international media, the understanding of the nation is often mis-interpreted, ill-informed and largely distracted by insufficient information.Therefore, this course intends to go beyond the media images and messages to analyze multidisciplinary issues including the politics, economy, society and culture in North Korea. It will cover history and political ideologies in North Korea, North Korean economic reform and the development of underground economy, policy of nuclear brinkmanship, controversial issues of human rights violations, North Korean defectors and the inter-Korean relations, art and propaganda in North Korea, North Korea travel and tourism development, and also sports and nationalism in North Korea."
"(UGEC1560 is double-coded with ECON1420.)   This course is an overview of the institutional and practical aspects of the banking and financial sectors of the economy, with emphasis on how the two sectors impact on the economic well being of workers, consumers, and investors. This course is designed for students with no previous knowledge or training in economics. Topics to be discussed include: interest rate determination, operation and management of the banking system, banking policy and supervision, interbank market and liquidity, money supply, exchange rate systems and linked exchange rate, investment returns, risk diversification and portfolio choice, stock market movement, initial public offering and derivatives, financial ethics, international debt crisis, and their relationships with consumer prices, trade, investment, unemployment and the level of economic activity."
"(UGEC1625 is double-coded with ANTH1310.) This course invites students to explore the issue of gender cross-culturally through the framework of kinship. It introduces basic concepts and major issues in the areas where the study of gender and the study of kinship intersect through an anthropological lens. Issues to be explored include kinship structures and related gender roles in cross-cultural perspective, the changing relationship between marriage and love, and the various new ways of people “doing” kinship in contemporary societies and the emerging social problems resulted from these changes. Themes such as kinship and the new reproductive technologies, fictive kinship and human-pet bond will all be discussed."
"(UGEC1633 is double-coded with ANTH1710.) This course aims to provide students with some basic understanding of archaeology. It will introduce the basic theory, method and practice of archaeology. It will focus on the nature and development of archaeology, data acquisition (archaeological surveys and excavations), data processing and analysis, synthesis and interpretation (reconstruction of the past environmental ecology, economic, social and cultural life) and important archaeological discoveries and studies around the world. The significance of archaeology to contemporary societies will also be discussed."
(UGEC1681 is double-coded with ANTH1010.) This course discusses the nature and development of humans and culture. Examples from different cultures in the past and the present will be used to illustrate the similarities and variations among human groups.
"Many drugs have mind-altering effects but some are defined as legal and some as illegal. The War on Drugs have been launched in many societies but none of them has successfully become a drug-free society. This course provides students an understanding of drug-related issues from a perspective of medical anthropology. Through close readings of ethnographies, viewing of videos, and fieldtrips, the class explores drug use, prevention, and treatment in both scientific and cultural perspectives and re-examines the linkages between legal and illegal behaviours, healthy and unhealthy bodily conditions, as well as science and culture."
"(UGEC1731 is double-coded with DSPS1002.) This course focuses on the important connection between data science and public policy by identifying and analyzing the policy challenges posed by data science technologies. It assesses what policy options and tools are available to address them and examines what new capacities governments and also citizens must develop in the era of data science. Students would also be introduced to the professional and ethical responsibilities and social, economic, political and legal impacts under the changes and innovations brought by data science."
"This course introduces key concepts, theories and models in the study of policy sciences. To resolve complex and multi-level public problems of a globalized world in ways that help to identify and enhance the common interest, policy sciences provide an integrated and interdisciplinary approach for making good policy decisions. This course also aims to help students understand the process and structure in designing policies. The concerns of this course are integrating theory and practice into actionable social knowledge and apply it to real world problems."
"(UGEC1814 is double-coded with GPAD1100.) This course aims to provide an introductory examination of legal systems and the role of law in the shifting social and political contexts. Interdisciplinary perspectives (e.g. philosophical, political and sociological etc.) will be taken on to deal with the conceptual and empirical issues. The course is not designed for professional legal training, but aims to assist students to reflect on the legal phenomena they experience in their daily life."
"(UGEC1823 is double-coded with SOCI1102.) This course explores into the significance of sociological perspectives in understanding modern society. Attention will be given to the application of sociological concepts in the observation and analysis of social phenomena in modern society. The course is designed particularly to develop intellectual skills, as part of a student's general education, for a better understanding of the nature of modern society."
"(UGEC1825 is double-coded with ECON1310.)  This course introduces students with no economics background to various aspects of the Hong Kong economy, such as trade, industries, logistics, housing and real estate, banking and finance, the monetary system and linked exchange rate, public finance, employment, inflation, income distribution and the China-Hong Kong economic relationship. Well-known experts from the financial sector and governmental organizations will be invited to analyse the latest information and discuss some of the above economic issues and development."
"(UGEC1835 is double-coded with ANTH1410.)  This course introduces students to characteristic aspects of Hong Kong culture. It will cover a wide range of cultural changes that have taken place since WWII. The course starts with an introduction to anthropological research in Hong Kong, and looks at topics including village culture and urbanization, food culture, marriage, family and gender, religion, and popular culture. Underlying most topics are questions of the modern versus the traditional, rural versus urban, cosmopolitan versus parochial, and how all these opposites interact to construct culture in Hong Kong. Hong Kong has been developed at a rapid pace since WWII. This course also discusses to what extent the development in Hong Kong meets the 17 Sustainable Development Goals (SDGs), in particular in the area of gender equality, cultural inclusiveness, and socially responsible production and consumption."
"(UGEC1885 is double-coded with GPAD1050.) This is an introductory course in government and politics of Hong Kong. It examines the following major issues: political institutions and processes; the various theoretical approaches to understand Hong Kong politics; the Basic Law and the principle of “one country, two systems”; the performance of the SAR Government since the return of sovereignty ; political culture; political parties and elections; and public administration and public policy. Emphasis is placed on recent changes and development, and the prospects for democratization."
"(UGEC1920 is double-coded with PHPC1001.) This course will introduce undergraduate students to the discipline of public health and its basic academic framework, concept and methodology. The objective of the course is to provide a broad intellectual perspective of public health and presents both local and global public health challenges that are facing our society in the 21st century. The various academic disciplines within the domains of public health that include environmental health sciences, health policy and management, social and behavioral sciences and basic science will be introduced and discussed. The impact of these public health problems in relation to our society and our everyday lives will be emphasized. An analytic public health problem solving framework will be used to enable students to appreciate and learn the problem solving methodology in evaluating and appraising various public health problems."
"This course explores human language in the broader context of culture and society. How, for example, does one language community interacts with another language community in the multilingual world? Does language change and what are the processes involved? To what extent does the same language vary due to gender, power, status, and identity? How do men and women, people with higher and lower social status talk differently? How are these relationships reflected in the use of politeness markers and other linguistic devices? What are the implications of sociolinguistics on education and language planning? Exploration of these topics aims to enhance students’ awareness of language as a cultural phenomenon and sharpen their sensitivity toward the nuances of language use in relation to the multilingual world, with special reference to Hong Kong."
"Wine weaves in with human history from its very beginnings and has developed into one of the foremost products of civilization. Wine has its roots in the customs, traditions and history and it occupies an important place in the culture and life of the people worldwide. The purpose of this course is to lead students on a cultural journey around the world and introduce them to a historical perspective on wine and its place in society. It is a course addressing the science of wine, the world wine regions, and the role of wine in human culture. Specifically, the course is designed to increase students’ understanding of essential wine knowledge and culture and help them build a strong base for lifelong wine appreciation and enhance their quality of life. The topics include cultural history of wine, the identification of grape varieties, the methods of viticulture (grape cultivation) and the techniques of vinification (wine making). The impact of alcoholic beverages on society and human physiology will be emphasized. Comparative tasting methods will be introduced through sensory evaluations training."
"This course traces and examines the development of Singapore since 1819, when Stamford Raffles of the English East India Company established a trading settlement on the island. The main focuses of the course will include the political, social and economic development of Singapore since the colonial era up to the post-independent period, the characteristics of Singapore as a multiracial and multicultural society, the impact of decolonization on Singapore and Southeast Asia, the roles performed by Lee Kuan Yew and the People’s Action Party in the nation-building of Singapore, and a comparison between Singapore and Hong Kong from a historical perspective."
"Macau is renowned for its gaming industry, yet it is also the place where East meets West. After more than three centuries of social evolution and cultural exchange, which attributes to Macau’s social diversity and valuable cultural heritage. This course will be divided into two parts. Part I traces and examines the development of Macau from a historical perspective, foster students an understanding of the contexts that shape the society and culture of the city from the past to the present, and how these contexts served as obstacles or opportunities in achieving the Sustainable Development Goals (SDGs). Part II exposes students to selected themes, including ethnic relations, economic activities, religious and cultural exchange, heritage conservation, etc., exploring Macau’s social diversity and cultural inclusiveness, and examine their relevance to the Sustainable Development Goals (SDGs), including SDG#8 Decent Work and Economic Growth, SDG#10 Reducing Inequality and SDG#11 Sustainable Cities and Communities."
"This course provides an overview of the key challenges of the world population [in the 21st century]. For example, aging or overpopulation in urban cities, environmental degradation, food and water resource crisis, large-scale voluntary and involuntary migration, and spread of communicable disease. A key goal of the course is to map out the linkages between population patterns, trends, and some of the socio-economic issues that occur locally, nationally, and at the global level which bring great challenges to our society. You will learn the concepts, theories, and data essential in the scientific study of the size, composition, and spatial distribution of human populations; and the changes that occur in these phenomena through the processes of fertility, mortality, and migration. You will gain an understanding of the roots of population structures, processes, and the consequences for individuals, family, and societies, and how it will affect and be affected by natural resources availability or depletion and health care system. Students will acquire the basic ability to analyze, explain and present the potential crisis facing the population system. In particular, this course will stimulate students’ interest in understanding how the population could be linked to sustainable development, and reflect on the relationship between population growth and availability of resources, as well as the relationship between population and social institutional arrangements such as child and old care support, job supply and public asset distribution. In the end, students will learn to apply their skill and knowledge in proposing solutions for solving population-related challenges for achieving Sustainable Development Goals (SDGs), for example, zero hunger and no poverty, good health and well-being, reducing social inequality including gender inequality, maintaining decent work and economic development while developing more sustainable cities and communities."
