"(UGEC2353 is double-coded with GLSD2501.) This course aims to provide students the foundational knowledge on the operation of world economy and examine how social, political and institutional factors contribute to the creation of global economic order. It examines the intertwining and interaction of economics (wealth creation) and politics (political power) in global affairs.The course will first offer a general survey of the key concepts and major theoretical perspectives in the study of Global Political Economy (GPE) (Liberalism, Mercantilism, and Marxist theory, etc.). In the second part, we cover substantive policy issues including international trade and monetary system, foreign investment and multi-national corporations, etc.. It focuses on how the world economy is transformed by globalization, with a particular focus on the development of various international and regional institutions that govern the current economic order. Finally, the course will be concluded with the discussion of latest trends of global economic governance, with a particular focus on the transforming role of national states and the endeavors of international development on poverty and inequality reduction. Relevant country experiences will be adopted to illustrate the dynamics of economic growth and stability. GLSD2501 intends to promote students’ appreciation of the role of institutions and politics in the operation of global economic order. Students are not required to have any background in the discipline for the course is designed to introduce essential concepts, major theoretical perspectives and basic operations of modern world economy, allowing students to communicate issues in world economic order effectively in group work and individually, in oral as well as written forms."
"(UGEC2354 is double-coded with GLSD2401.)  The course introduces the concept of human carrying capacity in the globe. The capacity symbolizes the balance between population size and environmental resources ––the underlying foundation for sustainable development. In history, it is shown that the human carrying capacity was periodically shrunk by climate deterioration and human-induced environmental degradation, resulting in catastrophic social consequences such as mass migrations, wars, or even population collapses. In this course, the background knowledge of climate-induced and human-induced environmental change will be introduced. The associated physical and social dimensions of environmental change will also be covered. Based on the lessons of the past, together with recent trends in global climate change and social development, the human carrying capacity in contemporary societies will be systematically examined. Some controversial issues related to human-environment nexus will also be discussed. This is a course of general appeal to students with different backgrounds."
"(UGEC2391 is double-coded with FAAS2106.) This course discusses the changes of visual and material cultures of the Ming dynasty through studying objects, images and texts. Topics including ceramics, lacquerwares, gold and precious stones, textiles, prints and other art and artefacts made for people from all walks of life will be covered. Through introducing representative images and objects and different trends of social development of the Ming period, such as religious fervor, sumptuous consumption, and erotic culture, the course aims at exploring how the emergence of classic images and artefacts are linked to the political, economic, religious, technological and aesthetic development of a time."
"(UGEC2434 is double-coded with CHES2103.)  This rise of China as a global power has drawn critical attention from all over the world from various perspectives. This course will approach this phenomenon from the angle of popular culture. Examining contemporary Chinese popular culture in Mainland China, Hong Kong, and Taiwan, this course considers the process of globalization, cultural exchanges among China, European, America, and Africa, the cultural flows among East Asian popular culture, particularly, with Japan and Korea, as well as interactions among Sinophone communities around the world. This course takes an interdisciplinary methodology, incorporating materials in the form of literature, films, TV series, pop music, reality shows, online forums, video games, and so on, to explore how economic development, technological innovations, and political atmosphere shape the youth culture, gender dynamics, class structure and many other issues on a daily basis."
"This course studies the ""little"" religious traditions in Hong Kong in the context of South China. The so-called ""little"" traditions are different from the three ""great"" Chinese traditions: Taoism, Buddhism and Confucianism. The ""little"" traditions are often known as popular religions or common religions. They represent the religious orientation of the majority of Chinese people. By expanding our horizon from globalized, highly abstract and univocal systems of thought to domestic localized oral and non-elite mentalities, we are striving to represent more accurately the heterogeneity of religious experience of Hong Kong people. Through the study of popular religions in Hong Kong, this course hopes to enrich students with a better understanding of both the structure and the dynamics of Hong Kong society as well as its local culture."
"(UGEC2500 is double-coded with CURE2375.) This course is a study of Chinese temples and festivals. Temples are cultural heritages which preserve as mute testimony to local history. Their structures and the use of ornaments also reflect traditional architectural characteristics. ""Jie dan"" (festivals), including birthdays of the gods and jiao rituals, are the ritual activities being held for prosperity in folk culture. The belief system, indigenous custom, human diasporas as well as community cohesiveness of the Chinese can be illustrated from both temples and festivals in China and Hong Kong."
"In this course we will review the major issues surrounding the process of globalization in the contemporary world. We will get behind these issues and discuss the backgrounds, manifestations, and implications of these issues on global development. Issues including the economic globalization, the global financial system and crisis, political governance and globalization, social impacts of globalization, the globalization of culture, the environment and globalization and anti-globalization movement will be covered, but additional issues and special topics may be added when necessary. The social scientific theories of globalization will serve as a background for our discussions but we are also going to emphasize the relevance of globalization to our everyday life."
"This course mainly introduces, from the comparative perspective, the establishment of modern education system and recent educational reform in The Chinese Mainland, Hong Kong, Taiwan, and Macau. It aims to help students critically analyze the role of education and major reform issues in the Chinese societies. Major topics include: (1) the establishment of modern schooling; (2) the pursuit of quality education; (3) decentralization and educational reform; (4) curriculum reform; (5) quality assurance mechanism and the rise of schooling market; (6) Internationalization and the establishment of education hub."
"(UGEC2610 is double-coded with GPAD2345.) Examination of the actors, dynamics, strategies and rules of the changing international political system, and patterns of interaction among the powers."
(UGEC2621 is double-coded with COMM2910.) Theories and methods in news sociology in understanding the news-making process and its impacts on the product itself and the society. Students also learn to conduct their own analysis of news in local or foreign media.
"(UGEC2623 is double-coded with COMM2210.)  This course talks about the characteristics and functioning of news, and its important role and functions in society. News is vital to us as it brings latest information of the day, helps create public opinion, educate our young generations, monitor the government and the powerful, as well as provide relaxation to our busy lives. To understand the news can essentially help us know our society. Various concepts and theories from the mass communication discipline are introduced together with some perspectives from other social sciences. Real-life examples from Hong Kong and abroad are analyzed.Students are first introduced to the unique nature of news and different types of news as found in both print and electronic media. Some new news formats, including free dailies, online newspapers, network social media and citizen journalism, are discussed in both international and local contexts. Relationships between journalism and closely related professions such as advertising and public relations are explicated in order to understand the actual functioning of news, as well as its impact on society. The professional concerns of the field of journalism and individual’s news consumption habits are also highlighted in the course.After taking this course, students will be able to understand more about news and its relationship with the society. They should be able to critically evaluate news and social phenomena. It is hoped that they can become wise news consumers and well-informed citizens."
"(UGEC2624 is double-coded with COMM2940.) This course aims to examine a number of key issues that are closely related to developments in Internet and digital media. The advent of communication technologies has brought tremendous changes to media environments. Media convergence and participatory culture are two most notable emerging trends that have contributed to new forms of media production and consumption. Students will be introduced to key concepts and perspectives in appreciating, analyzing and evaluating such trends. Through case studies about social media, streaming entertainment, Internet celebrities, networked social movements and digital surveillance culture, etc, students will review the many tacit assumptions about Internet in their everyday life."
"(UGEC2631 is double-coded with SOWK2160.) This course aims at analyzing economic insecurity from a global perspective and introducing social security as a societal measure to combat economic insecurity. Specifically, this course will examine the sources of economic insecurity of the individual and the relationship between globalization and economic insecurity. It will also discuss the philosophy, development, characteristics and functions of different types of social security measures in different countries and analyze current debates on the future development of social security in national and cross-national perspective."
"(UGEC2632 is double-coded with COMM2920.)  This course is designed to provide students with some familiarily with and critical perspectives on media representations of violence, social conflict, sex, sexuality and gender roles. Efforts will be made to explore the potential impact of such media representations on conflicts, violence, crimes and sexual practices in the real world."
"(UGEC2634 is double-coded with COMM2140.)  The course is designed around two major themes, namely media and social development in Mainland China since the founding of the People's Republic in 1949. Using key concepts and theories from the political economy of media and developmental communication studies, it introduces students to different periods of media reform and social change from the era of Chairman Mao to the period of ""harmonious society"". Emphasis is attached to post-1989 media regulatory systems, media industrialization, and their influence on the meeting of such developmental goals as poverty alleviation, democratization, and communication empowerment.The course will examine Mainland China's key media sectors including the printing press (newspapers and magazines), film and broadcasting media (radio and TV), and new networked communication tools (Internet and mobile phone) as well as alternative social formations through Internet activism, non-governmental organizations (NGOs) and transnational developmental projects. The course will identify and discuss several ongoing debates, and the ensuing actions, held by different stakeholders, including governmental officials, media producers, educators, activists, international agencies, and the general audiences. Wider implications to public policy will be identified. There will also be discussions of current affairs related to media and social development in the country.Students will be able to describe the key characteristics of contemporary Mainland Chinese media and their roles in facilitating or obstructing development towards the ideals of a ""new China""."
"(UGEC2636 is double-coded with COMM2813.) With the advent of the new media technology, new forms of organizational crisis emerge. They are called Internet-mediated crises. A major difference between the Internet-mediated crises and the traditional crises lies in the intensive interactivity, collectivity, simultaneity and dialogic sphericity of the former. This very nature of Internet-mediated crisis makes it all the more hard to handle. A specialized and critical function of the public relations practice is the management of crisis. This course covers two major levels. The first level takes on a functionalism approach to crisis management. The second level takes on a more critical approach in public relations. Students will learn how crisis reflects complicity and dynamism between citizens and organizations in modern societies. They will acquire an enhanced appreciation of communication that can be brought to bear in such crisis situations and a greater familiarity with the interactivity of an organization and its stakeholders as well as the environments in times of crises. They will also gain more sensitivity in public demands of socially responsible practices in the business contexts."
"(UGEC2638 is double-coded with COMM2840.) In this course, students will analyze real life campaigns to understand major effects of advertising in everyday life. Students will examine topics like materialism and commercialization of friendship to see how advertising persuade consumers through subtle uses of messages. They will also decode the formation and shifting of values promoted by Government and green campaigns. The course will help students distinguish between authentic and mediated reality regarding topics on artificial perfection of body image, sexual objectification and gender stereotyping."
"(UGEC2653 is double-coded with ANTH2310.) This course looks at the relationship between gender and culture, by comparing women and men in societies with different modes of production and social organization. Through analysing gender roles, enculturation process, kinship, division of labour by gender, power and control and social development, students will understand how culture influences the concept of gender and its related behaviour among human groups."
"(UGEC2654 is double-coded with ANTH2321.) This course examines mental illness and mental health as subjective experiences, social processes, and objects of scientific knowledge and practice. It invites students to explore human experiences that are labelled as abnormal or pathological, to understand the expert knowledge and technologies employed to remedy these conditions, and to think about the complex relationships between them and the broader social and cultural contexts. Readings are drawn from psychiatric anthropology or anthropology of mental health, clinical case studies, and memoirs. They are chosen to reflect an interdisciplinary scope that includes social sciences, psychiatry itself, and the layman’s/patient’s perspective."
"(UGEC2655 is double-coded with ANTH2324.) This course is an anthropological introduction to contemporary India, its social life and diverse cultures. India is home to more than a billion people, who look differently, speak various languages, practice different religions, and have distinct rituals, cuisines, and music. It is one of the world’s powers with global economic, political, and intellectual influence. Moreover, it shares important ties in the sphere of philosophy, religion, and medicine with China and other Asian societies. Therefore, students will learn about India’s place both in the world and the Asian region, including its ties with Hong Kong. Students will also develop an understanding of the country’s diversity and complex social phenomena such as kinship, communalism, caste system, tribe, third gender, and class. We will discuss pressing issues and theoretical debates related to globalization, sexuality, social movements, religious conflicts, public health, environment, and labor, and how these issues have been shaped by post-colonial politics and current transnational processes."
"(UGEC2662 is double-coded with ANTH2510.)  Culture is ubiquitous in every aspect of societies, including how we do business. This course will examine the role of culture in contemporary business and study work and management in industrial societies anthropologically. Students will be introduced to the cultural logics of business practices, particularly business operations, organization and management through ethnographic explorations of different cultures, locales and sociohistorical settings. The aims of the course are twofold. First, it reveals cultural aspects and the cultural mechanisms of business. It shows the significance of culture in the business world, as well as the cultural significance of business. Second, it attempts to put anthropology into business practice. It demonstrates to students how anthropological knowledge and methodologies can be applied to business operations and help to achieve business goals. By examining the themes including but not limited to the indoctrination of work ethics, labor relations, gender and racial issues in the workplace, capitalism and its discontents, and responses to and actions upon market capitalism in terms of both production and consumption, the course attends to these Sustainable Development Goals: No Poverty (SDG#1), Gender Equality (SDG#5), Decent Work and Economic Growth (SDG#8), Reduced Inequalities (SDG#10), Responsible Consumption and Production (SDG#12), and Partnerships for the Goals (SDG#17)."
"(UGEC2664 is double-coded with ANTH2390.)This course will examine the role and importance of sports in different societies and cultures, in the present and the past. Sports are often thought of as trivial, or as unimportant games to amuse young people. But in the wealthiest countries, sports represent huge portions of GDP and are important topics of daily conversation. Almost half the world watched the 2010 football/soccer World Cup. Sports have been compared to religions in their ability to unite people and to inspire fanatical devotion.The academic study of sports is interdisciplinary, with contributions from psychologists, historians, gender studies scholars, sociologists and anthropologists. This course will take an interdisciplinary approach while emphasizing anthropology’s focus on culture, on the experience of participants, and on both symbolic and political-economy aspects of sports. Topics will include Race and Performance, Sports and Rituals, Sports as Moral Education, Gender and Sexuality in Sport, Sports and Nationalism, Globalization of Sport, the Olympics, and Sports Stars and the Media. Students will be expected to do a research project for the course."
"(UGEC2665 is double-coded with ANTH2540.) This course addresses the ways in which social media and other related interactions in cyberspace have become a central element in the everyday lives of humans across the globe in the 21st Century. Our modern lives are now largely interwoven with digital technologies that have not only changed our own cultures, but also have brought forth new cultural forms through mobile phone technologies, networked “smart”-products, and cultural groupings only possible through digital means. The course approaches the anthropology of these digital cultures through its main themes—the transformation and expansion of social media, social research online, the intermixing of our online and offline lives, critical social issues of online lives, and the question of posthumanism. These themes are addressed explicitly in the course, and are also the subtexts of the different lectures, readings, and project work. Students will learn the techniques of online fieldwork and referencing. They will explore a diverse array of new ethnographies on social media: on gender, political movements, online dating, hacking, and gaming culture. These ethnographies also serve to model online social research and provide examples of methodology and design. The social consequences of cyberspace are addressed in the topics of internet pornography, addiction, surveillance, activism, and social networking. Gender and identity issues are a continuous theme throughout the course, highlighting how online lives accentuate already existing dynamics. Hong Kong connections to these subjects will also be critically discussed, often drawing on topical themes presented on blogs and forums. Students will learn of the philosophical questions of posthumanism and the nature of technologically mediated human culture. This serves as a philosophical ballast to the course allowing students to reflect personally on their own experiences and how technology has and will continue to shape their lives. The role of anthropology in understanding and capturing human culture in this context anchors on the investigation of how technology is possibly making us ‘more’ human than previous forms of cultural life."
"(UGEC2667 is double-coded with ANTH2320.) How can we understand the minds of other people? Do people in different cultures or societies feel and think in different ways? How do childhood experiences affect people and shape or even determine what kinds of persons they will become? What is it like to be mentally abnormal or even pathological? Do people in different cultures or societies experience, understand, and treat psychopathology in different ways? This course examines psychological experiences—feelings, perceptions, thoughts, and motivations—from social and cross-cultural perspectives. It sets out to explore the intersection between anthropology, a field that typically turns to the exotic other, and psychology, a field that often takes the universality of mental activities and mechanisms for granted. Specific focus is placed upon how ethnographers, clinicians, and researchers with training in both fields grapple with various mental phenomena and different ways of understanding them. As most of the materials are drawn from psychological anthropology, this course also serves as an eclectic introduction to this subfield, which was once influential in the history of American anthropology."
"This course aims to discuss and facilitate students to reflect education issues, policies and practices in Hong Kong. By applying sociological and political concepts and theories, the course will critically analyze current education issues and its development. This course will help students to understand and reflect on the interplay between politics, society and education system and its effect. It aims at equip students with a broader and deeper understanding of Hong Kong education policies and education system."
"(UGEC2680 is double-coded with SOWK2200.) The purposes of this course are to provide students a basic understanding of violence that takes place in our daily life in the contexts of intimate relationship, family, school and community and to arouse their consciousness of contemporary values of equality, human rights and social justice. Various concepts and theories of violence will be introduced to explore the nature, causes, consequences and trends of violence in different aspects of life. Emphasis will be placed on the issues of interpersonal violence in contemporary societies. Social policy and provisions to prevent and eliminate interpersonal violence will also be discussed."
"(UGEC2683 is double-coded with GPAD2355.) This course introduces undergraduate students to the key concepts, theoretical frameworks, and main political discussions/reflections related to globalization. Globalization itself is introduced in a broad sense not limited by the economic aspect but a common experience of social change. For example, global environmental challenges, the common threat of nuclear crisis, the controversy between sovereignty and human rights, and the North-South divide. With both the historical and thematic perspectives, the class engages students with most recent research and debate on the topic. On the one hand, the class encourages students to relate their own experiences and observations in their own societies to digest what globalization is and what its impacts are. On the other hand, it also leads them to reflect on politics and social development in their own societies, in the context of globalization."
