"(UGEC3203 is double-coded with GDRS3005.)  This interdisciplinary course introduces and examines gender and sexuality from a contemporary and regional perspective. Based on a cross-cultural perspective, we will read and analyze different meanings of gender and sexuality, and how these meanings are constructed. In a context of modernization campaigns and globalization processes, this course illustrates how gender relations and sexual politics are related with historical backgrounds, cultural heritage, market expansion, ideological shifts, and capitalist dynamics. The topics of gender and sexuality will be interwoven with that of migration, work, family, popular culture, mass media, and consumerism. The course will help students to understand issues of discrimination against women and girls, unpaid care and domestic work, access to sexual and reproductive health and reproductive rights, and equal rights to economic resources, and to reflect on how to promote gender equality (SDG5 among 17 Sustainable Development Goals, SDGs, in the 2030 development agenda). Students will be encouraged to explore localized knowledge and living experiences of gender and sexuality, and to think critically about how to reduce inequality (SDG10) related to social systems of sex and gender."
"(UGEC3204 is double-coded with GDRS3006.)  Living Feminisms is all about how to put feminism into practice. Specifically, it is concerned with living out feminist consciousness in every step of making fundamental and lasting social change. With this in mind, Living Feminisms is not an exposition of feminist theories per se but an exploration of how social change effort would look like when we take up feminist consciousness that transcends separateness and duality. It explores the root causes that lead to the domination system that has plagued humanity for centuries, examines the possibility of having a fundamental and lasting social transformation that supports life of all, and takes a closer look at a few selected alternative practices such as restorative justice and sharing economies that hold out hope in times of crises. The course also equips students with practical knowledge of being a change agent, introducing some practices with feminist consciousness that transform limiting beliefs about social change, nourish resilience by taking care of social and political trauma, and cultivate need-based facilitation skills and leadership that help navigate conflicts in the process of making internal as well as external transformation. To put it in a nutshell, Living Feminisms is a course that cultivates change agents with feminist consciousness.Living Feminisms deeply resonates with the Sustainable Development Goals (SDGs) adopted by all United Nations Member States in 2015 as a blueprint for building a sustainable future by 2030. The course directly touches on alternative practices working towards the SDGs 5 (Gender Equality), 8 (Decent Work and Economic Growth), 10 (Reduced Inequalities), 11 (Sustainable Cities and Communities), 16 (Peace, Justice and Strong Institutions) and 17 (Partnerships for the Goals)."
"(UGEC3213 is double-coded with GDRS3025.) This course examines the gender dimensions of innovation and novelty. The key questions are: How/Why/What/When innovation(s) are gendered? We will discuss the fluidity and messiness of doing and undoing gender in innovation practices and meanings produced. Broadly defined, innovation refers to new ideas, new knowledge, new technologies, new designs, and creative practices with the goal to solve social or technical problems. Many innovations may seem gender-neutral but are inherently imbued with gender perceptions. The course will equip students with ways to apply gender analysis to decipher innovations and innovative processes. The course incorporates sustainable development goals (SDGs) on Gender Equality and Reduced Inequalities to become more discerning toward more sustainable practices to advance Industry Innovation and Infrastructure. Using case studies from the technology culture, the routine practices, and the emergent new economy, students will learn to untangle how gender intersects with the seemingly neutral artefacts of innovation and technology. The course further covers how emergent issues of diversity and inclusion, AI and information technology, social entrepreneurship and social innovation, and leadership style could reshape the existing relationship between gender and innovation to advance sustainability and social resilience."
"(UGEC3214 is double-coded with GDRS3026.) This course examines the rich tradition of feminist film theory and provides students with an understanding of its main concerns and debates. Topics will include the key semiotic and psychoanalytic approaches of the 1970s-1990s, classic films which have inspired feminist debate, avant-garde cinema, local cinema, independent cinema, and postmodern cinema, as well as recent cinematic re-conceptualizations and exploration of gender and sexuality local and abroad. In systems of representation from fine art to mainstream cinema to advertising, women have been constructed and existed as spectacle or passive object “to-be-looked-at,” in Laura Mulvey’s now often quoted words. Following her trail, feminist critics turned their attention to mainstream films and popular media addressed to female spectators and exposed the contradictions within and between the notion of “women’s pictures” and the diversity of female experience. Local cinemas and independent creators also tell their own unique stories of women’s lives in dramatically different cultural contexts. Critics from other fields further complicate these images by examining them through lens including race, class, ability, queerness, and more.Mulvey’s groundbreaking analysis of gendered looking relations in classical Hollywood cinema has since generated numerous analyses of the place of women as spectacle or passive object in films “cut to the measure of [male] desire.” Critics around the world showed how different groups of women attempt to take control of their positioning through viewing or using texts in their own ways, and by creating their own. What happens when female-identified artists, audiences, and theorists look back, and seek to rebel against such cinematic traditions by experimenting with alternative visual languages and narrative tools? This course starts with the paradigm of narrative film analysis that Mulvey outlined in the 1970s and move on to explore a wider range of questions in feminist film studies, including spectatorship, authorship, popular culture, character stereotypes in genre films, self-representation, (g)local cinema, and new feminist media. Students would be introduced to trailblazing works by female filmmakers worldwide, special focus will be placed onto important works in Hong Kong cinema for critical examination and comparative studies. Through critical reflections on notions such as gender stereotypes, representation, power, diversity, and equality, the course engages directly with the Sustainable Development Goals (SDGs) adopted by all United Nations Member States in 2015 by engaging directly with the SDGs 5 (Gender Equality) and 10 (Reduced Inequalities)."
"(UGEC3224 is double-coded with GDRS3009.)  This course examines issues revolving the family as a social institution in different cultures. It explores processes of how the family is constructed in different forms as it intersects with various social systems including kinship, marriage, class, ethnicity, religion, and political economy. Particular attention is paid to how family as a gendered construction, while being a basic principle of social life globally, exhibits great diversity as it shapes and is shaped by local histories, traditions, and state policies. In an era of globalization and transnational mobility, the ideology and practice of the family are rapidly changing, but there are simultaneously trends of reversion and localization. Students will read ethnographies and develop cross-cultural perspectives on classic and contemporary issues concerning the family, such as work and domesticity, motherhoods and fatherhoods, sexual orientations, reproductive technologies, surrogacy and adoption. Students learn to critically think and articulate about family issues, and will acquire enhanced knowledge and skills in reflexive thinking and positive communication, cultural sensitivity, and diversity and inclusion. The course is relevant to the Sustainable Development Goals (SDGs) adopted by all United Nations Member States in 2015, in particular SDGs 5 (Gender Equality), 10 (Reduced Inequalities) and 16 (Peace, Justice and Strong Institutions)."
"(UGEC3225 is double-coded with GDRS3024.)  Educational and occupational accomplishments vary dramatically among individuals and profoundly affect lives. Importantly, gender is among the powerful individual characteristics that affect people's experiences in educational and work settings. Gender shapes youths' experience and outcomes of education across the globe and across history. This course is designed to introduce to students, with a critical mindset, important contemporary issues at the intersection of gender, education and jobs. The topics address the role of gender in school- and related preferences and achievements, with a focus on social and cognitive approaches. For example, what is quality education (SDG goal 4) and why is it important to evaluate it with a gender perspective? Do men and women really differ in their abilities, and if so, by how much? Is personal interest a better explanation of gender imbalances in occupations? What are the ways that biases exist in education and the workplace, and how do teachers, parents, and employers contribute to gender biases (SDG goal 5)? Can gender equality in performance and hiring be improved by removing stereotypes? The literature will cover childhood, adolescence as well as adulthood in order to provide insight into the age-related changes of the gender issues. Particular attention will be paid to issues that relate closely to daily life, both local and international. Empirical evidence will be reviewed to illustrate the gender biases and substantiate the explanatory theories. Potential interventions to address gender biases in education and the workplace will also be discussed."
"(UGEC3227 is double-coded with GDRS3021.)  This course critically explores the development of LGBTQI+ studies as an interdisciplinary field of inquiry. It traces how LGBTQI+ communities develop against the backdrops of social forces and social oppression. It analyzes the cultural, social and legal environments that LGBTQI+ people live with, in diverse spheres such as families, education, employment, health and the media. The discussions focus on both the structural constraints that LGBTQI+ people face, but also the agency and resilience they display. It explores the development of contemporary LGBTQI+ identities and social movements, as well as the politics involved. The course also asks how gender and sexual diversity is understood in different parts of the world in an era of globalization. Students are also exposed to different practices, policies and laws that are related to LGBTQI+ people’s lives.The Sustainable Development Goals vow to work towards a society where no one if left behind, particularly those who are most vulnerable and marginalized. In many parts of the world, LGBTQI+ people are historically amongst the most vulnerable and marginalized in society. This course will discuss the unequal treatment they face in cultural, social, political and legal systems and discuss how such inequality may be addressed."
"(UGEC3228 is double-coded with GDRS3008.)  This course examines the social construction of minorities and the history of Hong Kong public policy towards them, including legal changes, social institutions, immigration policy, and political mobilization. Current debates in public policies such as anti-discrimination legislation, education policies of ethnic minorities, disciplining of youth and anti-poverty scheme will also be evaluated within this context. We will draw on an array of intellectual resources ranging from political economy, critical race theory, feminism, phenomenology and queer theory to examine issues about racial/ethnic minorities, the economically underprivileged, minorities with disabilities, sexual/erotic minorities, gender minorities and youth in light of the latest scholarly discussions on multiculturalism, pluralism and the politics of difference and social recognition.The course is relevant to the Sustainable Development Goals 5 (Gender Equality), 10 (Reduced Inequalities) and 16 (Peace, Justice and Strong Institutions) with a focus on how public policy plays an important role in obstructing and facilitating the attainment of these goals."
"(UGEC3229 is double-coded with GDRS3007.)  This course examines men’s diverse experiences as boys/men and public discourses and practices about masculinities. It will focus on how the gendered social order influences men’s actions and the way men perceive themselves, other men, women, and social situations. It will pay special attention to the exploration of the relationships between multiple dimensions of social relations and inequalities including gender, race/ethnicity, class, and sexual orientation. It will address issues such as: male socialization, boyhood culture, male body images, male friendship, male sexuality and fertility, men’s experiences as fathers, male aggression and violence, men’s commitments to sports and work, and media representations of boys and men in contemporary culture. It will also explore female masculinities and queer masculinities and to what extent they post challenges to hegemonic masculinity. Students will be introduced to the latest developments and their global networks, and to evaluate the prospects for social change in how men may think, feel, and act otherwise.The course resonates with the Sustainable Development Goals (SDGs) adopted by all United Nations Member States in 2015 by engaging directly with the SDGs 5 (Gender Equality) and 10 (Reduced Inequalities), and 16 (Peace, Justice and Strong Institutions) through critical engagement with different discourses and phenomenon related to masculinities."
"(UGEC3308 is double-coded with FAAS3110.) This survey explores the historical development of Buddhist visual and material culture from around 5th century BCE to 20th century CE in Asia from a trans-regional perspective. Major topics include, but are not limited to, (1) worship icons, (2) materiality and ritual protocols, (3) iconography and iconometry, (4) illustrations, manuscripts, and pictorial narratives, (5) relics and other charismatic objects, (6) sacred space and monumental architecture, (7) artistic styles and their development and diffusion, and (8) patronage and socio-political context. The course also introduces the religion of Buddhism viewed uniquely in light of archaeological context."
"(UGEC3309 is double-coded with FAAS3113.) This course—an interdisciplinary study of art history, archaeology, anthropology, and religious studies among others—introduces the visual and material culture of the Korean peninsula and its adjacent regions from the Neolithic Age to the early twentieth century CE by surveying major historic monuments and excavated artifacts. Major topics include (1) state formation, (2) tombs and mortuary furnishings, (3) the influx of Buddhism and its successful development, (4) capitals and provinces, (5) elite culture of the court, aristocrats, and the literati, (6) ceramics and lacquerware, and (7) trans-regional interaction, especially, with China and Japan."
"(UGEC3319 is double-coded with FAAS3114.) This course—an interdisciplinary study of art history, archaeology, anthropology, and religious studies—introduces the visual and material culture of the Japanese archipelago from the Prehistoric Age to the twentieth century by surveying major monuments and sites. Major topics include (1) prehistoric potteries, (2) tombs and mortuary furnishings, (3) the influx of Buddhism and its successful development, (4) capitals and provinces, (5) elite culture of the court, aristocrats, and the learned, (6) ceramics and lacquerware, and (7) trans-regional interaction, especially, with China and Korea."
"(UGEC3481 is double-coded with CURE3003.) How do we understand and connect to animal kingdom?How do human-animal connections shape modern culture and society?How do cultural studies and humanities expand our scope on animal and nature?Culture is ordinary, in Raymond William’s saying, but the ordinariness is merely treated as a reflection of human everyday life. Although cultural studies has sustained concern on everyday life with mass production, consumerism, sexism, racism and postmodernism, the discipline always lags behind the concern of nature and animal species. As the issues of animal abuse, environmental protection, factory farming, animal protection policy and law-making, as well as media various portrayals being the hot topics of our (post)modern world, the study of animal with the perspective of cultural studies and other humanity disciplines can explore the possibilities of better human-animal relationship. This course is designed with an empathic concern of other-than-human animals. By exploring different issues of human and animals’ life, this course looks for a harmonious balance of nature and modern culture.This course focuses on three areas, through which we can explore the different aspects of animal and cultural studies. These areas are:A. Entering Jurassic Park – Remaking Animals in Leisure (Lecture A1-A4)B. Attacking Godzilla – Representing Animals in Media (Lecture B1-B4)C. Finding Nemo – Revitalizing Animals in the City  (Lecture C1-C4)Each area covers a set of animal issue discussion. Area A, apart from theorizing animal with cultural studies, tackles the basic animal issues: pet-nurturing, zoo-building, forest-sustaining and tourism. This is to provide a foundation for understanding animals with a critical reflection of everyday life. Area B, set with the concern of media, discusses issues of animal representation in cartoon, cinema, literature and journalism. This is to read how animals would be represented and how this affects human understanding and related policy-making. A screening will be run after Lecture Area B. This is to provide an alternative understanding of animal representation in popular media. Area C further deals with the matters of animal-city relationship in seeing how dogs and cats, cattle and swine, and fishes and dolphins are (mal)treated in the street, the farm and the sea respectively. This is to end the course with a leading thought of perfect balance of nature and modernity; and more queries of human-animal relationship will be raised for contemplation."
"(UGEC3482 is double-coded with CURE3033.) This course is a survey of Southeast Asian cinema read against the backdrop of its distinct historical, political, ecological, and cultural conditions. Initially a Cold War construct comprising Singapore, Indonesia, Thailand, the Philippines, Vietnam, Malaysia, Cambodia, Brunei, Laos, and Timor-Leste, the term ‘Southeast Asia’ has come to refer to a highly complex and pluralistic region of over 660 million people, 25,000 islands, and 150 ethnolinguistic communities. With its national identities formed from the encounter with and struggle against American, British, French, Dutch, Hispanic, Indian, Japanese, and Chinese influence, Southeast Asia’s movies have served as venues for propaganda and resistance. This course looks at how the remediations of different genres such as noir, melodrama, western, and sci-fi tackle controversial issues of gender, race, religion, poverty, migration, and the environment. Instead of smoothening the continuity of official historical narratives, it uncovers how documentaries, epics, and horror reexamine the trauma of past colonization, authoritarianism, and violence. To conclude, the course explores how television serials, anthology films, and online databases trace nascent cross-border and intra-regional communities beyond the limits of sovereignty."
"(UGEC3483 is double-coded with CURE3034.) This course aims to introduce Korean society and culture through Korean Popular Culture in relation to media and cultural studies scholarship and its socio-cultural contexts. In particular, we will examine the meaning of media and culture and its social changes in contemporary Korea through exploring various emerging trends and cultural studies as methodological tool within modern and contemporary Korean issues. Global popularity of Korean popular culture and the transnational Hallyu (Korean Wave) boom continue to percolate beyond Asia and inspire various critical questions regarding trans-nationalism, cultural imperialism and musical authenticity and hybridity. The course readings engage wide range of various issues and arguments of media and cultural studies scholarship as methodological tools; such as cultural representation, meaning of hegemony, cultural industry/economy and globalism of media, post colonialism, audience of mass media and fandom culture, gender and queer issues, and then further focus on the specific context of Korean popular culture including the pivotal notions of colonial modernity, Japanese imperialism, cultural hegemony in colonial Korea, meaning of Americanization, issues of popular memory and decolonization discourses, nationalism and globalization and Korean Wave, body/gender/sexuality / LGBTQ issue in Korean Media and Popular culture, cyber culture and internet memes, transnationalism and diaspora issues and its aftermath. We actively discuss various audio-visual artifacts including Korean news, music video, films, TV dramas, and pop music in each class in order to understand better the texts and contexts within the historical and sociocultural paradigm of recent sociology, media/communication studies scholarship."
"(UGEC3546 is double-coded with GLSD3405.)  This course aims to elevate students' understanding of Southeast Asia by examining the dynamics of interaction between nation-states, regional organizations, and non-state actors in Southeast Asia under the context of Globalization. After looking into the history, interests, strategic concerns, and senses of vulnerability shared among these actors, students are encouraged to think critically about the significance of this oft-overlooked region in the study of world politics. Hence, this course stresses analytical skills instead of hard facts about the region. Topics of the course include: 1) Definition of Southeast Asia and its history; 2) Basic International Relations Theories; 3) Actors in Contemporary Southeast Asia International Politics; 4) Evolution of ASEAN and regionalism in the World Politics; 5) Economic development of Southeast Asia and; 6) Regional Security in Southeast Asia."
"(UGEC3612 is double-coded with COMM3193.) The course is developed and evolved around two major themes, namely mass media and gender. Using key concepts and theories in mass communication and cultural studies, it discusses the influences and power of mass media with an emphasis on gender-related issues. The latter are in turn related to other social and cultural phenomena that will bring in knowledge and perspectives from other disciplines (e.g. sociology and psychology). The course will examine several recurring controversies related to gender in mass media. These controversies range from representation of sex and gender in media, to the media portrayals of homosexuals and the treatment of taboos. The course will identify and discuss the many competing viewpoints, and the ensuing actions, held by different stakeholders, including media producers, social activists, government regulators, educators and the general audiences. Their implications to legislation and education will also be identified.Students will be able to describe the key characteristics of modern media, in particular their roles in the construction of gender identities and discourses about various gender issues."
"(UGEC3635 is double-coded with COMM3191.) Since the 1970s, a very distinctive Hong Kong culture has emerged. The course will focus on the role of film and television in the historical formation of this vibrant Hong Kong culture. It will also explore themes such as re-nationalization, nostalgia and representations of mainlanders after the sovereignty transfer in 1997."
"(UGEC3893 is double-coded with SOCI3241.) This course introduces undergraduate students to the knowledge world of global and transnational sociology, and the sociology of law, globalization and global governance, in which it will offer a guided entry into the complex ideas and writings of the sociological, political and legal scholars. The concepts they developed to analyze law, society and global governance are fundamental to address global and international concerns, including ESG (environmental, social & governance) investment, SDG (sustainable development goals), global climate change (Paris Agreement), global health (WHO), international economic, trade and monetary institutions (e.g., World Bank, WTO, IMF), global gender, children, labor and human rights systems (UNICEF, ILO, OHCHR), international law (ICJ) and international peace and security (UN Security Council). Upon completing this course, student will have critical understanding of the process in which UN intergovernmental bodies, states and non-governmental stakeholders coordinate at the inter-organizational and inter-institutional levels to implement the UN 2030 Agenda, and respond to the challenges within."
