"Gender inequalities often stem from distinctions either empirically grounded or socially constructed. “History” is of essential importance in understanding how these inequalities are constructed in different periods and different contexts. This course traces and examines the history of women in China from the late Qing period to the present. Discover and analyze the sex roles, sexual politics and sexual symbolism in the course of modernization and nation building, how they are related to economic development, ideological shifts and colonialism, and to find out how they functioned to reduce gender distinctions (SDG#10 Reduced Inequalities), how they affected the formulation and changes of women policy (SDG#16 Peace, Justice and Strong Institutions), and how they promoted woman’s rights and social changes (SDG#5 Gender Equality)."
"(UGEC2042 is double-coded with CURE2016.)  This course is an introduction to the formation of modernity in relation to various aspects of urban culture. Tracing the development of cities and the urban cultures evolved within the new urban development since the 19th Century, cities such as Paris, London, New York will serve as 'texts' for analysis. Architecture, urban planning, artistic and intellectual movements as well as modes of everyday life in urban living are studied to demonstrate how the modern ways of thinking, seeing and living come into being. The course will also focus on the specificity of Hong Kong's experience in urban development and its adaptation of 'modernity' during a process of urbanization. The course will employ a wide range of visual images and audio-visual materials to explain the dynamism between modernity and urban culture."
"The universal appeal of classical music is masked by a troubled past. It is a complex story of white colonization by European powers, spanning centuries and continents. Classical music has its own colonial baggage, too, with links to slavery profits and other problematic phenomena, whether in the gendered tradition of the “great composers,” or in a thriving piano industry of the early 20th century, which resulted in forced labor and countless deaths in the colonial ivory trade, or in the transnational circulation of opera in and beyond the 19th century, which would not have been possible without the port city networks of rapidly expanding empires. Importantly, such legacies have led to new forms of advocacy aimed at decolonizing classical music today. This SDG-GE course will examine how current practices around the world, on the back of complex and violent histories, attempt to democratize classical music in lockstep with the needs and concerns of contemporary society. What does it mean to decolonize musically in the 21st century, recenter marginalized individuals and groups in classical music, and make classical music more sustainable and reflective of a fair society? These questions run through the three themed sections of the syllabus: i) gender and representation, ii) equality, diversity, inclusion, iii) institutions and justice. We will explore related ideas and concepts, in connection with past contexts and present practices, including orchestras, opera companies, community projects, and social enterprises. By drawing on a variety of perspectives, we will discuss how and why decolonizing classical music matters, to whom, along with its ongoing challenges for improving and enhancing equity.  This course engages directly with SDGs 5, 10, and 16. Through the three themed sections, we will assess how classical music practices today can be observed to respond to the identified SDGs, particularly in terms of further empowering indigenous women musicians, reducing age-old inequalities, and promoting greater social justice from within institutions that can better reflect the untold tales and human experiences of classical music.  Neither score-reading nor prior musical knowledge is required for this course."
"(UGEC2171 is double-coded with GRMD2401.)  Sustainable development is a global vision for the future. This approach to development should not only generate economic growth, but also distribute its benefits equitably, regenerate the environment rather than destroy it, as well as empower people rather than marginalize them. The UN 2030 Agenda came into effect in 2015 promising to “interlink and integrate” Sustainable Development Goals in an attempt to implement solutions facing humanity. Sustainable development goals are an all-inclusive invitation to act to end poverty, secure the planet and ensure that all people appreciate peace and prosperity.This course introduces the concept of sustainable development, the evolution of models and the implicit assumptions they make, as well as their contradictions. It also traces the advent of the SDGs and the extent that they support the principles of sustainable development. We examine the emergence of environmental problems and critically review the institutional responses to these problems since the late 1960s. We then consider in detail the increasingly popular idea of efforts in the pursuit of the SDGs from different perspectives that centres around people, planet, prosperity, peace and the partnerships involved in achieving the goals. The lectures will explore how achieving sustainable development goals will depends much on effective planning and good governance. Examples from different parts of the world will be used to underline the tight inter-connections between processes in different regions and across geographical scales in the context of sustainable development."
"(UGEC2188 is double-coded with ENGE2530.) The objective of this course is to give students an overview of the status, features, and use of Hong Kong English (HKE), the variety of English commonly used in Hong Kong. In the first part of the course, students will be introduced to the concept of ‘world Englishes’ and examine different theoretical frameworks for conceptualizing the evolution of new varieties of English. The course then examines relationship between Hong Kong English and Hong Kong culture from cultural, social, historical, and educational perspectives, particularly in relation to and juxtaposition from Cantonese and Putonghua. The second part of the course examines both spoken and written features of HKE, including grammar, discourse particles, vocabulary, and pronunciation, as well as the practices of code-mixing and code-switching. This section of the course also focuses on the social impact of the use of these features in Hong Kong culture. In the third part of the course, language attitudes and ideologies towards ‘standard’ language varieties (for example American and British English) in relation to HKE will be explored. The course will also examine the relationship between use of HKE and social identity as well as gender in Hong Kong culture."
"(UGEC2189 is double-coded with ENGE2600.) Although English has long spread around the world, the consequences of this spread are only now beginning to be appreciated by speakers in diverse cultures and societies. English has changed the world, impacting specific local cultures in both positive and negative ways. But English has also been localized and acculturated, made to express the realities of diverse cultures and societies, and so the language has been changed in turn. The discourse of world Englishes aims to re-imagine our understanding of the language. The difference between error and innovation can no longer be decided by reference to ‘ownership’ of the language. Additionally, the language is beginning to be a medium of the expression of identity for more and more people in very different social and cultural contexts. World English must be pluralized, which is why we think in terms of world Englishes. This course is split into two sections. The first section will introduce you to issues in the discourse of world Englishes: innovation, variety, creativity, globalization, etc. The second section will look at specific case studies in different cultures and societies, and will focus on Asian Englishes, e.g. English in Singapore, China, and Japan. Different Asian cultures have distinct historical experiences with English, leading to different levels of cultural penetration (e.g. in popular culture) and depth of function (e.g. in business and law). The second section looks at different examples to explore their specific cultural engagements with the English language, but also to identify what they have in common: Japan English and Singlish develop in very different cultures, but the course with emphasis comparison as well as contrast."
"The first part of the course will cover the general introductory concepts and provide students with theoretical and historical background of the discipline. This will be followed by in-depth study of specific environmental settings and resource issues that will complement our understanding of ecotourism. Hong Kong is the main focus of discussion though examples or cases in Mainland China and around the world are also provided throughout the course. Critical issues in ecotourism such as its multi-dimensional impacts, governance, planning, and resource and visitor management will also be covered. Lastly, students will be exposed to the relation of the phenomenon of ecotourism and the concept of sustainable tourism. Some of the lectures will address SDGs, for example, Goals 12, 16 and 17 embrace the knowledge and evolution of environmentalism and nature-human relationship; Goals 14 and 15 connect with the concept of protected areas and environmental conservation; Goals 1, 3, 5, 8, 11, 12 and 13 cover multi-dimensional tourism impacts and, more importantly, climate change issue. The concept of sustainable development will frame and conclude the entire course since the concepts has played an indispensable role in tourism development nowadays."
"The pursuit of ideal living environment has long been a human undertaking throughout history. Because of environmental variations, some places are definitely better than the others for living and development. In the ancient time, man strived for searching a nice place for settlement which could provide a better resource base. Nowadays, man acquires sciences and technologies to change or even create the environment that makes living pleasant and comfortable. This course provides students with the insights needed to gain an understanding of ideal environment for living from a geographical perspective. Topics include environmental perception, siting and location, urbanization, land use and functions, urban planning, urban design, architecture and interior design. As the course examines the understanding of ideal environment for living from different angles, students will not only gain objective geographical knowledge about the relationship between man and environment, but also learn how some urban challenges and issues are tackled. While the coverage will be broad and pluralistic, examples and cases of mainland China and Hong Kong will be emphasized. In order to enhance the learning experience, an interactive teaching mode will be adopted in the lectures so that the instructors can guide students to analyze the cases and issues through queries and answers."
"Food is essential for life by providing energy and nutrition and achieving zero hunger is one of 17 Sustainable Development Goals in the United Nations’ 2030 Agenda for Sustainable Development. Ironically, world hunger is increasing and FAO’s most recent estimates put the number of hungry people at 822 million in 2018-19, an increase of more than 28 million since 2014-16, even though the technology of food production has improved significantly. Why? It is because the causes of world hunger are multiple and, in principle, include food availability, accessibility and utilization. The course therefore adopts a multidisciplinary approach to examine the different issues of food and hunger, and how they change with time. The causes of world hunger will be analyzed with special emphasis on food production systems, bearing in mind there is no single solution to the problem. Towards the end of the course, the development of sustainable agriculture and measures to mitigate the hunger problem in the 21st century will be addressed to achieve the Sustainable Development Goals. Lectures will be supplemented with case studies, videos and slides."
"Popular representations of the African continent produced in global discussions are marked by a stereotyped image of Africa, its culture, environment and development. The purpose of this course is to critically examine the common framing of Africa as a continent of conflict, disasters, poverty and a region that is perpetually in need of external intervention. In addition to the myth that surrounds Africa, there is a growing dynamics of activities resulting into the current interest on the continent. Earlier, the UN settled on the Agenda 2030 as a plan of action for people, planet and prosperity for the whole world. This plan dovetails very well with the Africa’s Agenda 2063. This therefore provides an opportunity to identify where Africa situates on SDG issues that include its people, its environment and its economic development.The course will therefore present to students the context of Africa relating to its geography, environment, culture as well as contemporary development issues shaping the destiny of Africa. Through lectures, guest speakers, videos and possibly field studies, students will be able to critically evaluate the stereotypical notion of Africa as a continent rather than as a country as is quite often misconstrued. The course will provide an intellectual platform to understand and analyze issues from a multi-disciplinary perspective as they relate to Africa and humanity. The students will be able to interpret and explain in broad terms, the contemporary position of Africa as it relates to other parts of the world with special attention to its relationship with Asia and China in particular."
"Cities have always been magnets attracting a growing number of citizens. The unprecedented pace of urbanization has recently witnessed a historic shift of human population with the majority now living in cities. The growth of cities in this age of globalization raises many opportunities and challenges, concerning the quality of life, poverty, sustainability, environmental degradation and urban competitiveness. All of which deserve our attention.This course offers students a comprehensive understanding of cities and urban challenges from the perspective of sustainable development. It examines the historical, social, economic, cultural and environmental dimensions of cities. As the course focuses on urban issues at global, regional and local levels, students will not only gain knowledge about the causes and impacts of urban problems, but also learn how different stakeholders can help achieve sustainable liveable cities in the age of globalization. By adopting an issue-based approach, different SDGs such as no poverty (SDG 1), industry, innovation and infrastructure (SDG 9), reduced inequality (SDG 10) and sustainable cities and communities (SDG 11), will be included in a variety of topics ranging from socio-economic to environmental aspects in the course. Different cities will be chosen as case studies for understanding various urban challenges and solutions. Apart from lectures, students will develop critical thinking on various urban challenges that affect their daily lives through video discussion, group projects and presentation in the discussion forums."
"(UGEC2241 is double-coded with CURE2030.)  This course is a survey of Hong Kong cinema, with emphasis on its contemporary development. This course will cover both textual and contextual analyses: we treat Hong Kong cinema as an art form and introduce different ways to appreciate them and criticize them; we also read these films as commercial cultural products to investigate links between movies and society at-large. The course will introduce basic film theories and film languages. It helps students to reflect on their own relationship with these Hong Kong movies they grow up with, as well as help elucidate the complex relationship between Hong Kong cinema and Hong Kong identity."
"(UGEC2243 is double-coded with CURE2018.)  Human have altered the environment in ways that have no precedence in human history. Ecological crisis, environmental degradation, and extreme weathers have become the watchwords of contemporary politics. The conventional boundaries between “nature” and “culture” are now being questioned. How do nature, culture and power intersect in our everyday life? How do we get to understand issues of sustainability and environmental crisis from a broad historical perspective and global activism angle? How are gender, class and race interact with technology, damaged environment, animal and plant species? This course explores these questions and the rich debates in the emerging field of environmental humanity and literature of the Anthropocene.Class topics are organized on major global green movements that resisted oil pollution, toxic factories, logging companies, dam constructions and nuclear plant building. Students get to learn the historical developments of major environmental activism in the West and the global south. How was the Greenpeace founded? What is the Narmada Dam Movement in India? Do you know Ken Saro-Wiwa, an environmental activist against Shell oil pollution in Nigeria? In each class we examine historical texts, visual materials and theoretical debates to explore how environmental justice has been intertwined with histories of colonialism, neoliberalism, and questions of gender, race, poverty and class. Together the class explores the problem of the Anthropocene (Nature) in the context of colonial history, grass root struggles (Culture) and corporation greed (Power).This course addresses many of the 17 United Nation Sustainable Development Goals (SDGs): Climate Actions (13), Life on Land (15), Life below Water (14), Peace, Justice and Strong Institutions (16), Clean Energy (7), Reduced Inequalities (10), and Gender Inequality (5). Students are able to identify the weekly course content aligned with specific SDGs and be able to understand these goals in both historical and contemporary contexts."
"(UGEC2273 is double-coded with CURE2022.)  A long-lasting struggle of gender equity was triggered by the women’s movements in England and U.S in the end of 19th century. Feminists fight for equality by publications, demonstrations and organizations. In 20th century, the feminist movement matured. Feminists have been more sensitive to the differences among women of different race, class, culture, religion and circumstances and noticed the importance of differences in unity. This course will introduce the strategies and main arguments of various kinds of feminism. Through learning from others’ experience, history and our daily life, we will understand the development of diversity in feminisms. We can have more understanding of feminists fighting for the right of disadvantage groups by self-review and mutual criticism in different times and culture."
"(UGEC2294 is double-coded with CURE2042.) The course introduces the student a basic knowledge of Xiqu (Chinese Opera), including its artistic features as a performing art, and the characteristics of different kinds of local Xiqu, such as Beijing Opera, Kunqu, Shanghai Opera and Cantonese Opera. Based on the basic knowledge of the art-form, we will discuss the cultural issues reflecting in the plays and performances. Through the textual analysis of scripts and performances, students will be introduced different topics of Xiqu related to cultural studies."
"Lingnan is located in the south of the Five Ridges, the mountain areas running from east to west that serve as a clear geographical and cultural demarcation between South and Central China. Lingnan plays a significant role in the historical development of Modern China. This course aims to overview 500 years of interweaving between Lingnan region, state and the world from the perspective of business, migration, knowledge and culture in the long-term history to understand Lingnan and enhance cultural recognition. At the same time, this course combines archival studies and fieldtrips. Besides discovering history through archive material, we will also visit museums, villages, temples, communities, and enterprises. Through contact with cultural and historical sites, students can deepen their understanding and perception of the social and cultural history of Lingnan. Students from the Chinese University of Hong Kong (CUHK) and the Chinese University of Hong Kong, Shenzhen (CUHKSZ) will jointly enroll in this course to promote cultural exchange and enhance mutual understanding. The course assessment methods will consist of individual assignments and group projects."
"(UGEC2317 is double-coded with FAAS2116.) This course traces the history of comics and graphic novels in Western Europe and North America. Beginning with an introduction presenting the main characteristics of this medium, this course will trace its development, from the beginnings of storytelling with images in Antiquity to the latest innovations. Even though they have retained their own characteristics over the last two centuries, Western European and North American comics have also developed in close proximity. Following the development of the press and book industry, as well as other media like cinema, comics and graphic novels have a rich history that can only be understood in their cultural context. This course is designed to allow students to understand how this medium has shaped and been shaped by many aspects of the history and cultures of these places."
"(UGEC2351 is double-coded with GLSD2201.) Culture is in the air that we breathe and it is inevitable that people construct reality through their own 'cultural lens'. However, in this globalization era, people often have many cultural lenses. Through understanding the impact of globalization on cultures and societies, we will have nuanced understanding of how people from different cultures construct reality. Many scholars and activists argue that globalization will lead to a worldwide homogenized consumer culture dominated by Western values. Others believe that globalization can lead to the clashes of incorrigible cultures. Meanwhile, globalization has catalyzed formation of new hybrid cultures and fostered the blooming of creative cultural industries. In this course, we will explore the above topics through understanding the effects of globalization on personal identities, the economy, consumerism, and communication, etc. in the immediate and distal environment."
"(UGEC2352 is double-coded with GLSD2301.) This course aims to provide a comprehensive introduction to global politics, focusing in particular on its origins and historical evolution, its key concepts, major theoretical frameworks, main actors and institutions, the global architecture of power, and its dynamic nature in the process of globalization. It aims to offer students with the basic knowledge and analytical tools for making sense of current issues in global politics. It adopts a multi-disciplinary approach that integrates theoretical issues with regional case studies. The course will first offer a general survey of the key concepts and major theoretical perspectives in the study of Global Politics (Liberalism, Realism, Social Constructivism and Marxist theory, etc.). It then proceeds to cover selected topics of global politics in the areas of War and Peace and the Clash of Civilization. It focuses on how world politics is transformed by globalization, with a particular focus on its impacts on issues concerning the identity and national pride, balance of power, peace and conflicts, borders and security, etc. Finally, the course will be concluded with the discussion of latest trends of global governance, with a particular focus on the emergency of international and regional organizations. Relevant real world examples and case studies will be adopted to illustrate the big ideas and key concepts of global politics.This course intends to promote students’ appreciation of the role of ‘power’, ‘security’ and ‘justice’ in shaping the global political order nowadays. Students will gain deeper insights into not only latest developments in global political affairs, but also concepts and theories useful for further studies in politics, international relations, and global political economy. The course is designed to introduce essential concepts, major theoretical perspectives and basic mechanisms of global political order, allowing students to communicate issues in world politics effectively in group work and individually, in oral as well as written forms."
