"Two dimensions of theoretical approaches could be incorporated in GLSD1001. First, a general overview of theories approaching dynamics and changes of globalization could be covered in the first part of GLSD1001. Second, some specific theoretical approaches unique to respective cluster could be introduced after a general theoretical overview has been built. Four clusters on globalization are (1) Global Media and Popular Culture; (2) Global Economy; (3) World Politics; and (4) Planetary Health."
GLSD1003 is an extension of theoretical foundations students developed in GLSD1001. Debates and issues central to each cluster shall require students take up conceptual lens to explain causes and consequences of globalization with empirical findings by data and case studies. United Nations Sustainable Development Goals (SDGs) which are relevant to selected issues or debates for topics on globalization to be covered in the course. Seminars on four clusters shall be organized by guest speakers from respective clusters.
"The objective of this course to equip students with the analytic and research skills that are expected from an ethical and competent researcher in the field of global studies. Through mini-lectures, experiential learning activities and in-depth class discussions, students will learn why they should and how they can identify key problems in global studies, and design and carry out innovative and rigorous studies that offer informed solutions to the identified problems. Topics that will be covered in this course include: Research ethics in social science research; the Belmont principles; fallibility of commonsense; hypothesis generation; principles of scientific inferences; statistical reasoning; causal inferences; experimental simulation, controlled experiments, priming studies, survey, archival data analysis; and research presentation skills."
"This course is designed to introduce students the key concepts, issues, challenges and trends essential to understand the process of integrating global network. More specifically, this course offers an overview of the changing paradigm of global communication by studying the interrelation between cultural, economic, political, social, and technical dimensions of media and communication in the contemporary world, as well as examining the changing nature of power and the process of power diffusion in an information age. In doing so, this course will discuss the evolution of the transnational communication, the phenomenon of “electronic colonialism”, and the debate of New World Information and Communication Order (NWICO) etc. This is an interdisciplinary course, which covers the essential theories and concepts ranging from political science, international relations, media studies and communication. The first session of this course will first introduce the new trend of globalization, in particular, the emergence of broadcasting news agency and social media. The second part of this course will then critically assess the impact of the new way of world communication on international affairs and domestic events."
"(UGEC2351 is double-coded with GLSD2201.) Culture is in the air that we breathe and it is inevitable that people construct reality through their own 'cultural lens'. However, in this globalization era, people often have many cultural lenses. Through understanding the impact of globalization on cultures and societies, we will have nuanced understanding of how people from different cultures construct reality. Many scholars and activists argue that globalization will lead to a worldwide homogenized consumer culture dominated by Western values. Others believe that globalization can lead to the clashes of incorrigible cultures. Meanwhile, globalization has catalyzed formation of new hybrid cultures and fostered the blooming of creative cultural industries. In this course, we will explore the above topics through understanding the effects of globalization on personal identities, the economy, consumerism, and communication, etc. in the immediate and distal environment."
"(UGEC2352 is double-coded with GLSD2301.) This course aims to provide a comprehensive introduction to global politics, focusing in particular on its origins and historical evolution, its key concepts, major theoretical frameworks, main actors and institutions, the global architecture of power, and its dynamic nature in the process of globalization. It aims to offer students with the basic knowledge and analytical tools for making sense of current issues in global politics. It adopts a multi-disciplinary approach that integrates theoretical issues with regional case studies. The course will first offer a general survey of the key concepts and major theoretical perspectives in the study of Global Politics (Liberalism, Realism, Social Constructivism and Marxist theory, etc.). It then proceeds to cover selected topics of global politics in the areas of War and Peace and the Clash of Civilization. It focuses on how world politics is transformed by globalization, with a particular focus on its impacts on issues concerning the identity and national pride, balance of power, peace and conflicts, borders and security, etc. Finally, the course will be concluded with the discussion of latest trends of global governance, with a particular focus on the emergency of international and regional organizations. Relevant real world examples and case studies will be adopted to illustrate the big ideas and key concepts of global politics.This course intends to promote students’ appreciation of the role of ‘power’, ‘security’ and ‘justice’ in shaping the global political order nowadays. Students will gain deeper insights into not only latest developments in global political affairs, but also concepts and theories useful for further studies in politics, international relations, and global political economy. The course is designed to introduce essential concepts, major theoretical perspectives and basic mechanisms of global political order, allowing students to communicate issues in world politics effectively in group work and individually, in oral as well as written forms."
"(UGEC2354 is double-coded with GLSD2401.)  The course introduces the concept of human carrying capacity in the globe. The capacity symbolizes the balance between population size and environmental resources ––the underlying foundation for sustainable development. In history, it is shown that the human carrying capacity was periodically shrunk by climate deterioration and human-induced environmental degradation, resulting in catastrophic social consequences such as mass migrations, wars, or even population collapses. In this course, the background knowledge of climate-induced and human-induced environmental change will be introduced. The associated physical and social dimensions of environmental change will also be covered. Based on the lessons of the past, together with recent trends in global climate change and social development, the human carrying capacity in contemporary societies will be systematically examined. Some controversial issues related to human-environment nexus will also be discussed. This is a course of general appeal to students with different backgrounds."
"(UGEC2353 is double-coded with GLSD2501.) This course aims to provide students the foundational knowledge on the operation of world economy and examine how social, political and institutional factors contribute to the creation of global economic order. It examines the intertwining and interaction of economics (wealth creation) and politics (political power) in global affairs.The course will first offer a general survey of the key concepts and major theoretical perspectives in the study of Global Political Economy (GPE) (Liberalism, Mercantilism, and Marxist theory, etc.). In the second part, we cover substantive policy issues including international trade and monetary system, foreign investment and multi-national corporations, etc.. It focuses on how the world economy is transformed by globalization, with a particular focus on the development of various international and regional institutions that govern the current economic order. Finally, the course will be concluded with the discussion of latest trends of global economic governance, with a particular focus on the transforming role of national states and the endeavors of international development on poverty and inequality reduction. Relevant country experiences will be adopted to illustrate the dynamics of economic growth and stability. GLSD2501 intends to promote students’ appreciation of the role of institutions and politics in the operation of global economic order. Students are not required to have any background in the discipline for the course is designed to introduce essential concepts, major theoretical perspectives and basic operations of modern world economy, allowing students to communicate issues in world economic order effectively in group work and individually, in oral as well as written forms."
"This course is designed to help students apply classroom learning to the real-world situations in relation to Global Studies. Students can broaden their horizon and enrich their knowledge by exposure and comparison of different countries/regions. This course provides students with opportunities of both individual and group learning. Students are required to participate in all activities throughout the course, which includes but not limits to lectures, field studies, presentations and individual report. The destination of the course will be suggested by students, and confirmed by teacher who offers the course in a particular year."
"This course will examine how the Internet and multimedia shape the global world into an information society in the sociocultural and economic aspects. Focus will be placed on the significance of digital and social intersection, such as the important role of online platform for interpersonal and mass communications for intercultural exchanges. Besides understanding the advancements brought by the Internet, students will also learn about contemporary uses of the Internet to uncover problems and come up with innovative solutions to solve problems in the digital society nowadays."
"Global popular culture includes music, games, movies and videos that cuts across geographical boundaries. This course examines the cultural, social, political and economic implications of global popular culture. The course will introduce to students theories, concepts and tools in the emerging field and encourage students to assess the consumption of global popular culture in their daily life."
The course aims to present the effect of globalization on global cities and urban space. This is a required course for students majoring Global Studies without substantial background in social science disciplines on society and urban space use. The course shall first provide students with basic ideas and concepts relevant to topics relating to modern society and control of public space in social science disciplines. The second part of the course shall present fundamental concepts and theoretical perspectives to the study of globalization and its consequence on urban development and global changes. Such course design aims to build students’ conceptual thinking and imagination on the global world so they shall use such capacities to evaluate issues and debates shaped by the effects of globalization on the expansion of global cities and functions of public space in GLBS4501 Analyzing Development and Change in Global Cities and Urban Space.
"This course looks at the ""Rise of China"" from the perspective of Global Governance and specifically sheds light on its diplomatic, trade and cultural relations with others in the Global Community. It provides a critical analysis on the transformation of Chinese foreign policies since the establishment of the People's Republic of China and the momentum behind this change of practices. This course covers, but not limited to, i) the History and evolution of Chinese foreign policies; ii) the analytical framework of policy-making process in China, particularly in handling foreign and security affairs; iii) its foreign relations with both the developed and developing nations; iv) its booming economy and integration with the global economy; v) assessment on the rhetoric of ""Peaceful Rise"" and ""Charm Offensive"" with reference to the Confucius Institute."
This course explores various topics in Global Media. The focus of the course may vary according to the area of expertise of the instructor.
"People from all over the world are similar to and different from one another. Besides being individuals, they are also products of their culture—their psychological processes (i.e., thoughts, feelings, behavior, identities, beliefs, and assumptions) are shaped by their cultural backgrounds and experiences. In this course, we learn about how cultures influence and shape individuals’ psychological processes, what happens when individuals from different cultures meet one another (resulting from globalization), and when cultures meet one another within individuals (resulting in multiculturalism).The course will focus on timely, essential and at times sensitive and controversial topics central to the psychology of globalization, such as colonialism and how it shaped our psychological understanding of ourselves and others; how racism and stereotyping are psychological phenomena that interfere with successful globalization today; or how different moral cultures understand and often conflict with each other.This course adopts an introductory approach to cultural psychology and focuses on how our individual psychology interacts with an increasingly globalized world. The first part of the course will introduce students to fundamental concepts and findings in the field of cultural psychology. The second part of this course will explore the relevance of this body of knowledge in a time of rapid globalization, one of the most important developments in the twenty-first century."
This course explores various topics in Cultures and Societies. The focus of the course may vary according to the area of expertise of the instructor.
"This course aims to provide students with the analytical skills and critical knowledge over the concepts, theories, and cases relating to the scholarship of international relations (IR) and international law (IL) (Liberalism, Realism, Constructivism and Neo Colonialism, etc.), which govern the world order and structure the states’ behavior in the twenty-first century. This course will particularly explore a number of theoretical debates in IR literature, and the practice of IL in different political arena, for instances, trading relationship, multinational cooperation and territorial administration. This course will also cover the historical evolution of the international system after the Second World War and the transformation of the IL. Finally, the course will be concluded with the discussion of latest development of IR. Relevant real-world examples and case studies will be adopted to illustrate the big ideas and key concepts of IL and politics. This course intends to offer students a more comprehensive idea of IR and IL. This course prepares students a deeper insight into not only on study of global politics and IL, and but also provide a farsighted idea of todays’ issues and to meet future challenges. The course is designed to introduce essential concepts, major theoretical perspectives and basic mechanisms of IR and IL, allowing students to communicate issues in world politics effectively in group work and individually, in oral as well as written forms."
"This course examines the relationship between Sports and World politics, in particular about the evolution of global political economy through various sports events like the Olympic Games and World Cup. Taking different sport games as case studies, this course aims to raise attention about some ongoing debates on the global political arena, e.g. Separatism, regional identity, global democracy. It also encourages students to think critically how politics and sports are mutually shaping each other."
"This is an elementary level course which examines how media industries have projected the global agenda items through movies. It enables students to understand how the difference in cultural/national/social background would impact on the perceptions of people, in spite of the same objects and referents. In some occasions, such interpretations may reflect a certain degree of bias and hence jeopardize integrity of the facts. It is particularly helpful to students who haven't studied any courses from the Global Studies Programme in understanding relevant topics."
This course explores various topics in World Politics. The focus of the course may vary according to the area of expertise of the instructor.
"This course aims to provide a comprehensive overview of major global environmental challenges, with the focus put on the nature of various global environmental problems and how different actors (e.g. governments, NGOs, international organizations, etc.) respond to the problems in political and socio-economic dimensions. The societal impacts of environmental problems are also discussed. It aims to offer students with basic knowledge and analytical tools for making sense of how global environmental issues are shaped by world politics and international policies. It adopts a multi-disciplinary approach that integrates theoretical issues with empirical case studies.The course will first offer a general introduction of current global environmental challenges such as climate change and deforestation. After providing a brief historical advancement of addressing trans-boundary environmental problems, it proceeds to examine how different actors respond to the problems. Also, the roles played by different actors in global environment governance on selected topics are discussed. It focuses not only on how the responses of different actors towards global environmental crisis are driven by world politics, but also the tight connection between global political-economy and physical environment, including how socio-economic factors contribute to, and also being affected by, global environmental problems. Finally, the course will be concluded with the discussion of the latest trends and future of global environmental governance, particularly the recent dynamics of international and regional organizations. Relevant real world examples and case studies will be presented to illustrate the big ideas and key concepts of global environmental politics."
"This course examines the connection between Globalization and South Korea after World War II. It is also interested in accounting for the changes of political, economic, social and cultural aspects of South Korea in the last few decades and the transformation of the attitudes towards Globalization in South Korean society. This course will cover a variety of topics ranging from i) brief overview of the historical development of South Korea since WWII; ii) driving forces and features of the economic developments, iii) their foreign policy concerns, iv) the characteristics of the traditional cultural identities, v) the recent Korean-wave phenomenon; vi) opportunities and challenges brought by Globalization to Korean society."
"This course adopts various approaches to unravel the complexity of the ongoing integration project in Europe. Alongside the theoretical analysis, this course sheds light on the connection between Europe and the World. It will cover topics including, but not limited to, the Common Foreign and Security Policy, the EU Law, as well as EU’s contribution to Global Governance."
"This course examines the connection between Globalization and foreign policy-making of the country after World War II. It will cover a variety of topics ranging from the rationales behind the ups-and-downs of its economy, towards the Japanese perceptions towards Sino-Japanese relations and even the country’s role in the Global society."
"(UGEC3546 is double-coded with GLSD3405.)  This course aims to elevate students' understanding of Southeast Asia by examining the dynamics of interaction between nation-states, regional organizations, and non-state actors in Southeast Asia under the context of Globalization. After looking into the history, interests, strategic concerns, and senses of vulnerability shared among these actors, students are encouraged to think critically about the significance of this oft-overlooked region in the study of world politics. Hence, this course stresses analytical skills instead of hard facts about the region. Topics of the course include: 1) Definition of Southeast Asia and its history; 2) Basic International Relations Theories; 3) Actors in Contemporary Southeast Asia International Politics; 4) Evolution of ASEAN and regionalism in the World Politics; 5) Economic development of Southeast Asia and; 6) Regional Security in Southeast Asia."
This course explores various topics in Sustainability and Environment. The focus of the course may vary according to the area of expertise of the instructor.
"This course is the study and analysis of how the increasing vital role played by the multi-corporations has shaped the global market, the trend of globalization, business environment and states' behavior in a far-reaching way. It aims to provide students with the foundations to understand the global economy. More specifically, this course tends to explore the theories, patterns, growth of and rationale for foreign direct investment, and it essentially sees the multinational corporations as a powerful non-state actor in the globalized era. This course will explore the implications of the emergence of global market and organized business interest in the age of globalization and to explore how and why the international business organizations has become the key driver of economic development. This is a multidisciplinary course, covering from the disciples of political science, international relations, international business to economics."
This course explores various topics in Global Economy. The focus of the course may vary according to the area of expertise of the instructor.
"This aim of this course is to provide students with opportunities to observe the management operations in the business, public sector or non-government organizations (NGOs) in Hong Kong or beyond, and to experience the work life in the sector, as well as to nurture students’ global vision.It is recommended that the internship to be conducted from June to August after finishing year two studies in the block mode (i.e. 5 days x 8 hours x 8 weeks). However, in case of special circumstances, students may also choose the ‘distributed mode’ (i.e. several hours in a week over a number of weeks equaling 320 hours). GLSD Programme will deploy work units, agencies, or organizations that provide internships relevant to the general course objectives. Meanwhile, students are encouraged to explore opportunities of internship to fit their own specific learning needs. However, all self-selected internship must comply with the course requirements, and subjected to the approval of GLSD Programme Director. Guidance and assistance will be provided whenever appropriate. During the internship, each student would be guided and assisted by an academic supervisor. The supervisor offers advice and help whenever necessary during the attachment period. At the same time, each student will be receiving guidance and assistance from his/her agency supervisor. Students will construct and submit a portfolio to reflect on the experience in the internship. Academic advice will be provided to help students consolidate their learning in the internship."
"Students are required to collaborate with students from (a) partner institution(s) to design and complete a research project on a chosen global issue happened in Hong Kong and/or city/region where partner institution(s) locate(s) – analyzing challenges and controversies, pinpointing the flaws and proposing workable solutions. The students will be supervised by selected faculty members in the institutions involved, and are required to research the chosen topic with fieldwork from a comparative perspective."
(This course is the first part of capstone thesis.) Students will write an individual thesis under the supervision of their instructors on a selected topic related to the Global Studies concentrations.
(This course is the second part of capstone thesis.) Students will continue to complete an individual thesis under the supervision of their instructors on a selected topic related to the Global Studies concentrations.
"(This course is the first part of capstone project.) Students are required to form groups and design a project on selected topics related to current global affairs or global phenomena happened in Hong Kong under the supervision of a faculty member. Students need to use their knowledge and experiences gained from all courses, overseas exchange, and internship to formulate a feasible solution to the chosen topic. Students are encouraged to think out of the box to submit their projects in any formats such as development project, video, website, a proposal of business start-up, as mutual consent between students and the supervisor."
