5001,Early Childhood Education: Curriculum and Teaching
5101,Early Childhood Education: Curriculum and Teaching
5201,Foundations of Early Childhood Education
5202,Creative Arts for Early Childhood
5203,Teaching and learning through play in Early Childhood Education
5301,Educational Management and Sustainable Development of Early Childhood Settings
5302,Parental Involvement in Young Children’s Education
5303,Ethics and Professional Standards for the Teaching Profession
5401,Early Childhood Development
5402,Supporting Young Children with Diverse Needs
5501,Teaching Fundamental Movement Skills and Rhythmic Activity for Young Children
5901,Teaching Practicum
